B0FG7QMV1Y,B0F3C9BMFZ,"NewEleven Retirement Gifts - Retirement Gift for Woman, Farewell Gift, Goodbye Present for Men, Women - Going Away, Goodbye Gifts for Coworkers - Candle",WY-FHPL-MTWW,12,0,0.23%,0.00%,12,0,0.18%,0.00%,100.00%,0.00%,2,0,16.67%,0.00%,$23.96,$0.00,2,0
B0FHKT7T9Q,B0F59YJV71,"NewEleven Dad Birthday Card - Gifts For Dad From Daughter, Son, Kid - Father's Day Gift Idea For Dads, Bonus Dads - Humorous Greeting Card",50-79MF-SYWH,29,3,0.57%,6.00%,36,4,0.55%,6.15%,100.00%,0.00%,2,0,6.90%,0.00%,$15.98,$0.00,2,0
B0FH6R5YTH,B0FC6CL2XN,"NewEleven Teacher Thank You Cards - Teachers Appreciation Gifts, Heartfelt Messeage, Meaningful Thank You Teacher Gifts From Student, Kids - Greeting Card",DM-O5C7-TN8L,40,0,0.78%,0.00%,43,0,0.65%,0.00%,100.00%,0.00%,2,0,5.00%,0.00%,$9.98,$0.00,2,0
B0DVZ9NWDG,B08Y8RZRHG,"NEWELEVEN Coworker Leaving Gift - Farewell, Going Away, New Job, Goodbye, Good Luck for Colleagues, Boss, Men, Women, Friends - 20 Oz Tumbler",31-PNFY-F78S,8,0,0.16%,0.00%,11,0,0.17%,0.00%,100.00%,0.00%,1,0,12.50%,0.00%,$19.98,$0.00,1,0
B0F9W75LLW,B097B9H21P,"NewEleven Gifts For Mom From Daughter, Son, Kids - Unique Birthday Gift For Mom Wife, New Mother, Bonus Mama, Pregnant Mama - Funny Gifts Ideas For Mum - 20 Oz Tumbler",YP-SEHP-8NOP,10,0,0.20%,0.00%,12,0,0.18%,0.00%,81.82%,0.00%,1,0,10.00%,0.00%,$16.98,$0.00,1,0
B0FD9RR4NB,B097H6PJCN,"NewEleven Gift For Uncle From Niece, Nephew - Funny Unkie Gift, Uncle Birthday Gifts - Best Present For New Uncles, Funcle, Unky Announcement - 20 Oz Tumbler",C5-L2Z6-TAT4,0,0,0.00%,0.00%,0,0,0.00%,0.00%,0.00%,0.00%,1,0,0.00%,0.00%,$19.98,$0.00,1,0
B09S9PGL4T,B09S9PGL4T,"NewEleven Bird Watching Gifts, Gifts For Bird Lovers - Gift For Men Women - Funny Birding Gift For Birders, Birds Watchers, Birb Lovers, Men, Women, Friends - 20 Oz Tumbler",UD-JSC7-HVGH,2,0,0.04%,0.00%,3,0,0.05%,0.00%,100.00%,0.00%,1,0,50.00%,0.00%,$22.98,$0.00,1,0
B0DYP51XSW,B09YCTFXYV,"NewEleven Retirement Gifts For Men Women 2025 - Retirement Party Decorations - Retired Presents For Coworker Leaving, Men, Retired People, Coworkers, Friends - 20 Oz Tumbler",KG-HY7Y-VD9N,12,0,0.23%,0.00%,15,0,0.23%,0.00%,100.00%,0.00%,1,0,8.33%,0.00%,$19.98,$0.00,1,0
B0D6V486CJ,B09ZYBDMZ1,"NewEleven Coworker Leaving Gifts - Farewell Gifts, Going Away Gift For Coworker - New Job Gift, Goodbye, Good Luck Presents For Coworkers, Friends, Boss, Men, Women - 20 Oz Tumbler",Y3-JOZK-KF6U,32,0,0.62%,0.00%,43,0,0.65%,0.00%,100.00%,0.00%,1,0,3.13%,0.00%,$19.98,$0.00,1,0
B0DVZ28QXB,B0BC8SB3Y4,"NewEleven Gifts For Aunt From Niece, Nephew - Cool Gifts For New Aunt, Auntie, Sister - Aunts Birthday Gift - Announcement, Promoted To Aunty, Best Auntie Ever - 16 Oz Coffee Glass",DT-HT71-4QRG,13,0,0.25%,0.00%,14,0,0.21%,0.00%,100.00%,0.00%,1,0,7.69%,0.00%,$12.98,$0.00,1,0
B0DWDQQ88X,B0BRB6J55H,"NewEleven Gifts For Sister - Unique Birthday Present For Soul Sister, Big, Little Sis, Sisters In Law, Sibling, Bestie - 16 Oz Coffee Glass",OW-SAUE-CM7G,5,0,0.10%,0.00%,7,0,0.11%,0.00%,100.00%,0.00%,1,0,20.00%,0.00%,$15.98,$0.00,1,0
B0F8VCZ61V,B0BRCCZLL8,"NewEleven Bridal Shower Gifts - Wedding Gifts For Bride - Bachelorette Gift, Engagement Presents For Women - Gift For Bride To Be, Fiancee, Wifey, Her - 16 Oz Coffee Glass",63-QY4L-OED4,2,0,0.04%,0.00%,2,0,0.03%,0.00%,100.00%,0.00%,1,0,50.00%,0.00%,$13.98,$0.00,1,0
B0FG7PKPXP,B0BYDBW7PH,"NewEleven Gifts For Nurse - Nurse Gifts For Women - Caregiver Appreciation Gift, Nursing Student, Nurses Practitioner - RN Gift For Nurses Women - 16 Oz Coffee Glass",IP-TZ2U-AFMB,17,1,0.33%,2.00%,17,1,0.26%,1.54%,100.00%,0.00%,1,0,5.88%,0.00%,$9.99,$0.00,1,0
B0FGDHKH6G,B0CBJQZCFY,"NewEleven Gifts For Friends, Bestie – Work Bestie Presents For Women Friends - Appreciation Gifts For Coworkers, Unique Present Ideas For Coworker Leaving, Farewell Party – 16 Oz Coffee Glass",2D-H3QH-UR6F,12,0,0.23%,0.00%,15,0,0.23%,0.00%,100.00%,0.00%,1,0,8.33%,0.00%,$14.98,$0.00,1,0
B0DVZ9NWDG,B0CDLPSMGF,"NewEleven Coworker Leaving Gifts - Farewell, Going Away Gift For Coworker - New Job, Goodbye, Good Luck Gifts For Coworkers, Colleagues, Boss, Men, Women, Friends - 20 Oz Tumbler",CO-C7X6-C1NV,13,0,0.25%,0.00%,14,0,0.21%,0.00%,100.00%,0.00%,1,0,7.69%,0.00%,$19.98,$0.00,1,0
B0F8BCC76K,B0CJLF7CW6,"NewEleven Fathers Day Gift For Dad - Cool Dad Gifts From Daughter - Unique Birthday Present Ideas For Father, Husband, Bonus Father, Step Papa, New Papa From Daughter - 20 Oz Tumbler",JY-5OP2-ZVFB,3,0,0.06%,0.00%,12,0,0.18%,0.00%,100.00%,0.00%,1,0,33.33%,0.00%,$17.98,$0.00,1,0
B0F8BCC76K,B0CJLM3SV5,"NewEleven Fathers Day Gift For Dad - Cool Dad Gifts From Daughter - Unique Birthday Present Ideas For Father, Husband, Bonus Papa, Step Father, New Papa From Daughter - 20 Oz Tumbler",5B-L34H-TU17,1,0,0.02%,0.00%,8,0,0.12%,0.00%,100.00%,0.00%,1,0,100.00%,0.00%,$19.98,$0.00,1,0
B0D6YH6BCN,B0CKYMNV39,"NEWELEVEN Christmas Book Lovers Gifts for Women, Friends - Bookshelf Cup, Accessories for Writers, Readers, Librarian, Bookaholic, Bookworm - 16 Oz Coffee Glass",QE-7AYT-7B4M,15,0,0.29%,0.00%,17,0,0.26%,0.00%,100.00%,0.00%,1,0,6.67%,0.00%,$9.99,$0.00,1,0
B0FFH2DPYK,B0CLYRNFBT,"NewEleven Birthday Gifts For Men, Women - Funny Gag Gifts Ideas For Dad, Mom, Grandpa, Grandma, Husband, Wife, Uncle, Him - 40th 50th 60th 70th 80th Birthday Gifts For Men Women – 20 Oz Tumbler",3N-MM56-1WA4,13,1,0.25%,2.00%,17,4,0.26%,6.15%,100.00%,0.00%,1,0,7.69%,0.00%,$15.99,$0.00,1,0
B0F8BCC76K,B0CM5R5BDX,"NewEleven Fathers Day Gift For Dad - Birthday Gifts For Dad From Daughter - Husband Gifts - Unique Birthday Present Ideas For Father, Husband, New Papa, Bonus Father From Daughter - 20 Oz Tumbler",WC-3I7C-6VN5,1,0,0.02%,0.00%,1,0,0.02%,0.00%,100.00%,0.00%,1,0,100.00%,0.00%,$19.98,$0.00,1,0
B0FGDHKH6G,B0CRKQR2KF,"NewEleven Gift For Friends, Bestie - Birthday Gifts for Women Friendship - Unique Friendship Gifts For Women, Friend, Bestie, Bff, Soul Sister, Work Bestie - 16 Oz Coffee Glass",C6-OPZ3-4B3S,16,0,0.31%,0.00%,22,0,0.33%,0.00%,100.00%,0.00%,1,0,6.25%,0.00%,$14.98,$0.00,1,0
B0FD9QBGZH,B0CT8JTMF8,"NewEleven Birthday Gifts For Women - Funny Gag Gifts Ideas For Mom, Grandma, Wife, Her, Sister, Coworker - 40th 50th 60th 70th 80th Birthday Gifts For Women – 20 Oz Tumbler",T3-8QDV-BD6U,18,0,0.35%,0.00%,18,0,0.27%,0.00%,100.00%,0.00%,1,0,5.56%,0.00%,$15.98,$0.00,1,0
B0F7H2RCV2,B0CWNTN1JN,"NewEleven Retirement Gifts For Women 2025 - Happy Retirement Party Decorations - Coworker Leaving Gifts, Farewell Gift, Goodbye Gift For Coworkers, Friends - 16 Oz Wine Glass",XL-MR6A-RPZ5,30,0,0.59%,0.00%,40,0,0.61%,0.00%,100.00%,0.00%,1,0,3.33%,0.00%,$23.98,$0.00,1,0
B0FHPQWHQY,B0CY4G9VSR,"NewEleven Trucker Cap for Men, Dad, Husband, Fisherman – Funny Fishing Hat, Trucker Hat Birthday Present for Him, Father, Guys Who Love Fishing",BP-B33W-HG8K,34,1,0.66%,2.00%,40,1,0.61%,1.54%,97.30%,100.00%,1,0,2.94%,0.00%,$19.98,$0.00,1,0
B0F8QTMBRV,B0CYPT8HM7,"NewEleven 30th Birthday Gifts For Women - 30s Birthday Decorations - 30 Year Old Gifts For Her, Woman, Sister, Mom, Daughter, Best Friend - In My Thirties Era Glass - 16 Oz Coffee Glass",C9-FSMU-8JV2,19,0,0.37%,0.00%,21,0,0.32%,0.00%,100.00%,0.00%,1,0,5.26%,0.00%,$16.98,$0.00,1,0
B0F8QTMBRV,B0CYPWBV21,"NewEleven 40th Birthday Gifts For Women - 40s Birthday Decorations For Women - 40 Year Old Gifts For Her, Woman, Sister, Mom, Daughter, Best Friend - In My Forties Era Glass - 16 Oz Coffee Glass",SB-QEC6-U9NU,22,0,0.43%,0.00%,26,0,0.40%,0.00%,100.00%,0.00%,1,0,4.55%,0.00%,$16.99,$0.00,1,0
B0F8BCC76K,B0CZRZTBMT,"NewEleven Fathers Day Gift For Dad From Daughter Son Kids - Gift For Dad, Father, Step Father - Funny Birthday Gifts For Father - 20 Oz Tumbler",DJ-XD9G-NIPY,1,0,0.02%,0.00%,1,0,0.02%,0.00%,100.00%,0.00%,1,0,100.00%,0.00%,$19.98,$0.00,1,0
B0DK4PDRY3,B0D5YGB4KV,"NewEleven Witchy Gifts for Women, Witch Gifts, Witch Stuff, Witch Accessories - Birthday Halloween Presents for Women Witches Wiccan Her Friend Sister Daughter Female - 16 Oz Coffee Glass",ZB-3CPZ-WSS8,5,0,0.10%,0.00%,5,0,0.08%,0.00%,100.00%,0.00%,1,0,20.00%,0.00%,$15.99,$0.00,1,0
B0FFH2DPYK,B0D5YHG24C,"NewEleven 50th Birthday Gifts For Women, 50th Birthday Decorations, 50 Years Old Gifts For Her, Sister, Mom, Bestie, 1975 Birthday Gift For Women, Fifties Wine Tumbler - 12 Oz Tumbler",V3-2DHI-A0G1,10,0,0.20%,0.00%,10,0,0.15%,0.00%,100.00%,0.00%,1,0,10.00%,0.00%,$16.98,$0.00,1,0
B0DKDWHJ2P,B0DCJQ2SKV,"NewEleven Gifts For Mom, New Mom – 2025 Pregnancy Gifts For First Time Mother, Pregnant, Expecting Mama, Mother To Be, Mama, Mommy To Be - 16 Oz Coffee Glass",F5-C0C3-Z1JN,20,0,0.39%,0.00%,26,0,0.40%,0.00%,100.00%,0.00%,1,0,5.00%,0.00%,$12.99,$0.00,1,0
B0F3886BZJ,B0DJXZ36VG,"NewEleven Sister 2025, Sister Birthday Gifts for Women, Big Sister Gifts for Girls - Gift for Women, Soul Sister, BFF, Big Sister Gift Glass Christmas Ornaments",O2-5UU0-154U,3,0,0.06%,0.00%,6,0,0.09%,0.00%,100.00%,0.00%,3,0,100.00%,0.00%,$17.97,$0.00,1,0
B0FD9TKCYT,B0DWN2GX75,"NewEleven Nurse Gifts For Women, Nursing Student, Nurses Practitioner, Registered Nurses - Nurse Appreciation Gifts For Women From Friends, Family And Coworker - 20 Oz Tumbler",P3-U5Q5-Y2JP,25,0,0.49%,0.00%,33,0,0.50%,0.00%,100.00%,0.00%,1,0,4.00%,0.00%,$12.98,$0.00,1,0
B0FG7PKPXP,B0DWN3SH33,"NewEleven Nurse Gifts For Women, Nursing Student, Nurses Practitioner, Registered Nurse - Gifts For Nurses From Friend, Family And Coworker - 16 Oz Coffee Glass",C0-X5FU-OU85,15,1,0.29%,2.00%,19,1,0.29%,1.54%,100.00%,0.00%,1,0,6.67%,0.00%,$14.99,$0.00,1,0
B0FD9TKCYT,B0DYDZFRZD,"NewEleven Gift For Teachers - Teacher Appreciation Gifts For Women, New Teachers - Teacher Gifts For Women From Student, Friends, Family And Coworker - 20 Oz Tumbler",4E-EG59-NN41,16,0,0.31%,0.00%,25,0,0.38%,0.00%,100.00%,0.00%,1,0,6.25%,0.00%,$18.98,$0.00,1,0
B0FHPQWHQY,B0DYJ45P7Q,"NewEleven Birthday Gifts for Dad from Daughter, Son, Wife - First Time Present for Father, Men, Girl Dads Hat - Trucker Hat",QF-PTRY-DG2W,10,1,0.20%,2.00%,11,1,0.17%,1.54%,90.91%,100.00%,1,0,10.00%,0.00%,$17.98,$0.00,1,0
B0F7H2RCV2,B0F13MKH7X,"NewEleven Retirement Gift For Woman 2025 - Coworker Leaving Gift, Going Away Gifts For Friends, Her, Mom, Boss - Farewell Gifts For Coworkers Women From Friend, Family And Colleague - 16 Oz Wine Glass",ML-PHKJ-4KBU,35,0,0.68%,0.00%,43,0,0.65%,0.00%,100.00%,0.00%,1,0,2.86%,0.00%,$0.00,$0.00,1,0
B0FFGT9TWF,B0F7XCP31P,"NewEleven Gift For Brother - Brother Birthday Gifts, Christian Gifts For Little, Adult Bro, Sibling - Meaningful Gift For Brothers From Sister, Family - Bible Jar",JB-RJTD-OQ2R,29,0,0.57%,0.00%,34,0,0.52%,0.00%,100.00%,0.00%,1,0,3.45%,0.00%,$18.98,$0.00,1,0
B0FH6R5YTH,B0FC5TLHKZ,"NewEleven Funny Boss Gifts - Appreciaton Card, Boss Birthday Card For Men, Women, Manager - Supervisor Gifts For Women From Coworker, Colleague - Greeting Card",RT-64X6-JD53,34,1,0.66%,2.00%,35,1,0.53%,1.54%,100.00%,0.00%,1,0,2.94%,0.00%,$4.99,$0.00,1,0
B0FH6R5YTH,B0FC69R4PK,"NewEleven Retirement Gift For Woman - Retirement Card For Women, Men, Boss - Funny Retirements Gifts For Men, Farewell Gifts For Coworkers From Work Bestie, Colleague - Greeting Card",A9-HSHI-ATQO,33,0,0.64%,0.00%,36,0,0.55%,0.00%,100.00%,0.00%,1,0,3.03%,0.00%,$5.99,$0.00,1,0