B0F8VCZ61V,B0CYSTZG5R,"NewEleven Bridal Shower Gifts - Wedding Gifts For Bride - Bachelorette Party, Engagement Gift For Women - Gift For Bride To Be, Fiancee, Wifey, Her - 16 Oz Coffee Glass",UH-A4QB-NCR6,6,0,0.13%,0.00%,6,0,0.10%,0.00%,100.00%,0.00%,1,0,16.67%,0.00%,$9.99,$0.00,1,0
B0D6Y54MJD,B0CZDV6J3V,"NewEleven Gifts For Book Lovers - Book Lovers Gifts For Women - Book Themed Gift for Readers, Librarians, Bookaholics - Birthday Gift For Women, Her, Best Friend – 16 Oz Coffee Glass",0B-GUIB-F6GL,12,0,0.25%,0.00%,15,0,0.24%,0.00%,100.00%,0.00%,1,0,8.33%,0.00%,$13.98,$0.00,1,0
B0FG7PKPXP,B0D1GF81G8,"NewEleven Gifts For Nurse - Nursing Graduation Gift For Women Her - Caregiver Appreciation Gifts, Nursing Student, New Nurses, Nurse Practitioner, RN - 16 Oz Coffee Glass",WJ-F0KW-EYOB,8,0,0.17%,0.00%,8,0,0.13%,0.00%,100.00%,0.00%,1,0,12.50%,0.00%,$9.99,$0.00,1,0
B0DVYKZQJ5,B0D2NSHWZK,"NewEleven Gifts For Godmother - Will You Be My Godmother From GodChild - Pregnancy Announcement Gifts For Godmom, Godparents - 16 Oz Coffee Glass",J5-EJIM-0Y8E,12,0,0.25%,0.00%,14,0,0.23%,0.00%,100.00%,0.00%,1,0,8.33%,0.00%,$17.98,$0.00,1,0
B0DKDWHJ2P,B0DCJQ2SKV,"NewEleven Gifts For Mom, New Mom – 2025 Pregnancy Gifts For First Time Mother, Pregnant, Expecting Mama, Mother To Be, Mama, Mommy To Be - 16 Oz Coffee Glass",F5-C0C3-Z1JN,14,0,0.30%,0.00%,17,0,0.28%,0.00%,100.00%,0.00%,1,0,7.14%,0.00%,$12.99,$0.00,1,0
B0FFH2DPYK,B0DH7PQ1RX,"NewEleven 40th Birthday Gifts For Men Women - 1985 40th Birthday Decorations For Men Women - Turning 40-40 Year Old Gifts For Man, Woman, Mom, Dad, Wife, Husband - 20 Oz Tumbler",7N-6OBC-K7DN,10,0,0.21%,0.00%,14,0,0.23%,0.00%,100.00%,0.00%,1,0,10.00%,0.00%,$19.98,$0.00,1,0
B0FD9QBGZH,B0DH86X93V,"NewEleven 40th Birthday Gifts For Men Women - 1985 40th Birthday Decorations For Him, Her - Turning 40-40 Year Old Gifts For Man, Woman, Mom, Dad, Wife, Husband - 20 Oz Tumbler",Z0-L1YB-49DF,28,0,0.59%,0.00%,35,0,0.57%,0.00%,100.00%,0.00%,1,0,3.57%,0.00%,$19.98,$0.00,1,0
B0DKJ5THF2,B0DHC2C1S4,"NewEleven 50th Birthday Gifts for Men Women - 1975 Birthday Decorations for Him, Her - Gifts for People Turning 50 Year Old Mom, Dad, Wife, Husband - Retro Trucker Hat",S1-6FQM-HSP6,14,0,0.30%,0.00%,16,0,0.26%,0.00%,100.00%,0.00%,1,0,7.14%,0.00%,$17.98,$0.00,1,0
B0F3D315RZ,B0DJY7689G,"NewEleven Thank You Gifts for Women, Nurses, Teacher, Coworker, Friends - Gift for Women, Appreciation Present for Coworkers, Farewell, BFF, Woman, Men - Glass Christmas Ornaments",2F-J6P4-R5IG,1,0,0.02%,0.00%,1,0,0.02%,0.00%,100.00%,0.00%,1,0,100.00%,0.00%,$5.99,$0.00,1,0
B0F3D315RZ,B0DK16MCXG,"NewEleven Women - Friend Gifts Ornaments 2025 - Friendship Gifts for Friends, Birthday Gift for Women, Besties, Soul Sisters - Ceramic Christmas Ornaments",JC-JJYR-OWD3,4,0,0.08%,0.00%,4,0,0.07%,0.00%,100.00%,0.00%,1,0,25.00%,0.00%,$4.99,$0.00,1,0
B0F4CLW9JM,B0DK16SMD9,"NewEleven Engagement Gifts for Couples 2024 - First Christmas Engaged Gifts for Her - Engagement Gift for Newly Engaged Couples, Her, Women, Friends, Bride to Be Gift, Glass Christmas Ornaments",Q6-R02W-6Y1G,11,0,0.23%,0.00%,11,0,0.18%,0.00%,100.00%,0.00%,1,0,9.09%,0.00%,$7.99,$0.00,1,0
B0F3D315RZ,B0DK2YP1FB,"NewEleven Gifts for Women, Friendship, Friends, Birthday Gift for Friends Female BFF Old Best Friends, Best Friend Ornament, Bestie Ornament",JR-LLGY-N975,1,0,0.02%,0.00%,2,0,0.03%,0.00%,100.00%,0.00%,1,0,100.00%,0.00%,$7.99,$0.00,1,0
B0DYJ45P7Q,B0DYJ45P7Q,"NewEleven Birthday Gifts for Dad from Daughter, Son, Wife - First Time Present for Father, Men, Girl Dads Hat - Trucker Hat",QF-PTRY-DG2W,1,0,0.02%,0.00%,3,0,0.05%,0.00%,100.00%,0.00%,1,0,100.00%,0.00%,$17.98,$0.00,1,0