"Product";"ASIN";"SKU";"Units";"Refunds";"Sales";"Promo";"Ads";"Sponsored products (PPC)";"Sponsored Display";"Sponsored brands (HSA)";"Sponsored Brands Video";"Google ads";"Facebook ads";"% Refunds";"Sellable Quota";"Refund сost";"Amazon fees";"Cost of Goods";"Shipping";"Gross profit";"Net profit";"Estimated payout";"Expenses";"Margin";"ROI";"BSR";"Real ACOS";"Sessions";"Unit Session Percentage"
"NewEleven Retirement Gift For Woman 2025 - Farewell Gifts For Coworkers, Boss, Friend, Teacher, Grandma - Coworker Leaving Gifts For Women From Friend, Family - Tumbler 12 Oz COG: 3,4 / Price: 22,98";"B0F189PXWB";"L4-F4C9-QOS5";"4";"";"79,92";"";"-44,15";"-44,15";"";"";"";"";"";"";"-";"";"-29,8";"-13,6";"";"-7,63";"-7,63";"5,97";"";"-9,55";"-56,10";"65 679";"55,24";"25";"16,00"
"NewEleven Birthday Gifts For Women - Humorous Message, Funny Birthday Gift Card For Men, Women, Dad, Mom, Brother, Sister, Friends, Family - Greeting Card COG: 0,39 / Price: 5,99";"B0FC5MVV3Q";"H4-ZU99-Z57Y";"4";"";"23,96";"";"-85,05";"-85,05";"";"";"";"";"";"";"-";"";"-13,12";"-1,56";"";"-75,77";"-75,77";"-74,21";"";"-316,24";"-4 857,05";"10 818";"354,97";"87";"4,60"
"NewEleven Best Friend Gift - Funny Card, Best Friend Birthday Gifts For Women, Her, Girls - Bestie Present, Meaningful Gift From Friends - Greeting Card COG: 0,39 / Price: 4,99";"B0FC62VRRC";"OF-YAJT-Y5A4";"4";"";"23,96";"-0,3";"-22,15";"-22,15";"";"";"";"";"";"";"-";"";"-15,43";"-1,56";"";"-15,48";"-15,48";"-13,92";"";"-64,61";"-992,31";"3 015";"92,45";"57";"7,02"
"NewEleven Gift For Boss - Thank You Boss Gifts For Women, Men, Leader - Meaningful Present, Appreciation Gifts For Boss From Coworker, Staff - Greeting Card COG: 0,39 / Price: 5,99";"B0FC65ZB93";"S6-VP1K-5XOQ";"4";"";"23,96";"";"-21,78";"-21,78";"";"";"";"";"";"";"-";"";"-13,12";"-1,56";"";"-12,50";"-12,50";"-10,94";"";"-52,17";"-801,28";"3 015";"90,90";"48";"8,33"
"NewEleven Gift For Brother From Sister, Bro - Best Birthday Gift For Big, Little Brother, Siblings, Brothers In Law - Funny Gag Gifts For Men - 20 Oz Tumbler COG: 4,4 / Price: 19,98";"B09792XF8F";"CC-VIYV-1LFP";"3";"";"59,94";"";"";"";"";"";"";"";"";"";"-";"";"-23,55";"-13,2";"";"23,19";"23,19";"36,39";"";"38,69";"175,68";"";"";"12";"25,00"
"NewEleven Bird Watching Gifts, Gifts For Bird Lovers - Gift For Men Women - Funny Birding Gift For Birders, Birds Watchers, Birb Lovers, Men, Women, Friends - 20 Oz Tumbler COG: 4,78 / Price: 22,98";"B09S9PGL4T";"UD-JSC7-HVGH";"3";"";"68,94";"";"";"";"";"";"";"";"";"";"-";"";"-23,85";"-14,34";"";"30,75";"30,75";"45,09";"";"44,60";"214,44";"160 709";"";"3";"100,00"
"NewEleven Retirement Gifts For Women 2025 - Happy Retirement Gift - Coworker Leaving Gift, Farewell Gifts, Goodbye Presents For Coworkers, Friends - 12 Oz Tumbler COG: 3,73 / Price: 22,98";"B0B2WGL9ZW";"DI-F7I2-E7AK";"3";"";"68,94";"";"";"";"";"";"";"";"";"";"-";"";"-23,85";"-11,19";"";"33,90";"33,90";"45,09";"";"49,17";"302,95";"15 726";"";"24";"12,50"
"NewEleven Gifts For Cat Mom, Cats Lover - Cat Gifts For Women - Cute Kitten Stuff, Cats Themed Gift For Women - Cute Funny Gift For Her, Best Friend - 16 Oz Coffee Glass COG: 2 / Price: 9,99";"B0BRCJ5VYH";"CZ-V369-AMB3";"3";"";"29,97";"";"";"";"";"";"";"";"";"";"-";"";"-12,95";"-10";"";"7,02";"7,02";"17,02";"";"23,42";"70,20";"38 406";"";"24";"12,50"
"NewEleven Gifts For Book Lovers - Book Lovers Gifts For Women - Bookish Gift for Readers, Librarians, Bookaholics, Bookworm - Birthday Gift For Women, Her, Best Friend – 16 Oz Coffee Glass COG: 2,25 / Price: 12,98";"B0BYDDFNBD";"BC-HKBD-KBAM";"3";"";"44,94";"";"-6,3";"-6,3";"";"";"";"";"";"";"-";"";"-22,41";"-6,75";"";"9,48";"9,48";"16,23";"";"21,09";"140,44";"39 344";"14,02";"18";"16,67"
"NewEleven Gifts For Men, Women - Funny Gag Gifts Ideas For Dad, Mom, Grandpa, Grandma, Husband, Wife, Uncle, Him - 40th 50th 60th 70th 80th Birthday Gifts For Men Women – 20 Oz Tumbler COG: 3,65 / Price: 15,98";"B0CDLQGPKC";"38-P9JP-4W92";"3";"";"47,94";"";"";"";"";"";"";"";"";"";"-";"";"-19,41";"-10,95";"";"17,58";"17,58";"28,53";"";"36,67";"160,55";"2 944";"";"19";"15,79"
"NewEleven Gifts For Mom, Wife - Gifts For Mom From Daughter, Son, Kids - Unique Birthday Present Ideas For Mother, Wife, New Mama From Daughter, Son, Husband - 20 Oz Tumbler COG: 3,71 / Price: 19,98";"B0CG8NHNWF";"2F-5232-03M8";"3";"";"59,94";"-3";"";"";"";"";"";"";"";"";"-";"";"-23,07";"-11,13";"";"22,74";"22,74";"33,87";"";"37,94";"204,31";"5 284";"";"10";"30,00"
"NewEleven Fathers Day Gift For Grandpa From Granddaughter, Grandson - Birthday Present Ideas For Grandfather, New Grandfather, Promoted To Granddad, Grandchildren, Grandkids - 20 Oz Tumbler COG: 3,5 / Price: 17,98";"B0CKYJ8WLN";"FM-KSML-Z7CU";"3";"1";"53,94";"";"-12,14";"-12,14";"";"";"";"";"";"33,33";"-";"-11,27";"-22,56";"-10,5";"";"-2,53";"-2,53";"7,97";"";"-4,69";"-24,10";"5 309";"22,51";"19";"15,79"
"NewEleven Gift For Friends, Bestie - Birthday Gifts for Women Friendship - Unique Friendship Gifts For Women, Friend, Bestie, Bff, Soul Sister, Work Bestie - 16 Oz Coffee Glass COG: 2,81 / Price: 14,98";"B0CRKQR2KF";"C6-OPZ3-4B3S";"3";"";"44,94";"";"";"";"";"";"";"";"";"";"-";"";"-21,09";"-8,43";"";"15,42";"15,42";"23,85";"";"34,31";"182,92";"19 619";"";"23";"13,04"
"NewEleven Bridal Shower Gifts - Wedding Gifts For Bride - Bachelorette Party, Engagement Gift For Women - Gift For Bride To Be, Fiancee, Wifey, Her - 16 Oz Coffee Glass COG: 2,35 / Price: 9,99";"B0CYSTZG5R";"UH-A4QB-NCR6";"3";"";"29,97";"";"";"";"";"";"";"";"";"";"-";"";"-17,61";"-7,05";"";"5,31";"5,31";"12,36";"";"17,72";"75,32";"59 866";"";"10";"30,00"
"NewEleven Gifts New Home - Best Housewarming Gifts 2025, Housewarming Gift - Presents for Homeowners, First House Gift - New Home Candle COG: 4,7 / Price: 15,98";"B0D6GGZ5TL";"IV-JPRM-B4VI";"3";"";"47,94";"-1,6";"";"";"";"";"";"";"";"";"-";"";"-22,63";"-14,1";"";"9,61";"9,61";"23,71";"";"20,05";"68,16";"354 576";"";"18";"16,67"
"NewEleven 50th Birthday Gifts For Her, Women - Vintage 1975 50th Birthday Decorations For Women - 50 Year Old Present Ideas For Wife, Mom, Grandma, Aunt, Friends, Female - 16 Oz Wine Glass COG: 4,26 / Price: 12,99";"B0DH7Y6RDX";"IC-D6DJ-S9KY";"3";"";"38,97";"";"";"";"";"";"";"";"";"";"-";"";"-22,56";"-12,78";"";"3,63";"3,63";"16,41";"";"9,31";"28,40";"49 491";"";"20";"15,00"
"NewEleven Gift For Teachers - Teacher Appreciation Gifts For Women, New Teachers - Teacher Gifts For Women From Student, Friends, Family And Coworker - 20 Oz Tumbler COG: 3,42 / Price: 12,98";"B0DYDZFRZD";"4E-EG59-NN41";"3";"";"56,94";"";"-12,61";"-12,61";"";"";"";"";"";"";"-";"";"-13,12";"-10,26";"";"20,95";"20,95";"31,21";"";"36,79";"204,19";"53 171";"22,15";"10";"30,00"
"NewEleven Retirement Gift For Woman 2025 - Coworker Leaving Gift, Going Away Gifts For Friends, Her, Mom, Boss - Farewell Gifts For Coworkers Women From Friend, Family And Colleague - 16 Oz Wine Glass COG: 4,83 / Price: 23,98";"B0F13MKH7X";"ML-PHKJ-4KBU";"3";"";"71,94";"";"";"";"";"";"";"";"";"";"-";"";"-27,99";"-14,49";"";"29,46";"29,46";"43,95";"";"40,95";"203,31";"12 804";"";"48";"6,25"
"NewEleven Retirement Gift For Woman - Retirement Card For Women, Men, Boss - Funny Retirements Gifts For Men, Farewell Gifts For Coworkers From Work Bestie, Colleague - Greeting Card COG: 0,39 / Price: 5,99";"B0FC69R4PK";"A9-HSHI-ATQO";"3";"";"17,97";"";"-54,98";"-54,98";"";"";"";"";"";"";"-";"";"-9,84";"-1,17";"";"-48,02";"-48,02";"-46,85";"";"-267,22";"-4 104,27";"3 005";"305,95";"52";"5,77"
"NewEleven Gifts For Mom - Heartfelt Message, Birthday Card For Mom From Daughter, Son, Kids - Meaningful Gift, Unique Present For Mother - Greeting Card COG: 0,39 / Price: 5,99";"B0FC6DJMD9";"1E-URHL-R626";"3";"";"17,97";"";"-55,02";"-55,02";"";"";"";"";"";"";"-";"";"-9,84";"-1,17";"";"-48,06";"-48,06";"-46,89";"";"-267,45";"-4 107,69";"10 818";"306,18";"33";"9,09"
"NewEleven Gifts For Him, Men - Gift For Men, Women, Dad, Husband, Friend - Thank You Gifts, Appreciation Gift, Graduation Presents For Men, Nurse, Teacher, Boss, Coworker - 20 Oz Tumbler COG: 4,04 / Price: 16,98";"B0978WGWY4";"BJ-VG4K-QQW3";"2";"";"33,96";"";"";"";"";"";"";"";"";"";"-";"";"-14,72";"-8,08";"";"11,16";"11,16";"19,24";"";"32,86";"138,12";"5 309";"";"20";"10,00"
"NewEleven Coworker Leaving Gifts - Farewell Gifts, Going Away Gift For Coworker - New Job, Goodbye, Good Luck Gift For Coworkers, Colleagues, Boss, Men, Women, Friends - 20 Oz Tumbler COG: 4,22 / Price: 19,98";"B09ZYCD6GX";"1Q-FSNP-VBED";"2";"";"39,96";"";"-12,62";"-12,62";"";"";"";"";"";"";"-";"";"-14,9";"-8,44";"";"4,00";"4,00";"12,44";"";"10,01";"47,39";"25 000";"31,58";"30";"6,67"
"NewEleven Gifts For Dog Lovers, Dogs Owners, Dog Moms, Fur Mama - Dog Mom Gifts For Women - Cute Funny Gift For Women, Best Friend, Girlfriend - 16 Oz Coffee Glass COG: 2,13 / Price: 9,99";"B0BRCG7S9H";"2R-X9LF-IOEW";"2";"";"19,98";"";"";"";"";"";"";"";"";"";"-";"";"-8,81";"-4,26";"";"6,91";"6,91";"11,17";"";"34,58";"162,21";"38 443";"";"9";"22,22"
"NewEleven Gifts For Nurse - Nurse Gifts For Women - Caregiver Appreciation Gift, Nursing Student, Nurses Practitioner - RN Gift For Nurses Women - 16 Oz Coffee Glass COG: 2,48 / Price: 9,99";"B0BYDBW7PH";"IP-TZ2U-AFMB";"2";"1";"19,98";"";"";"";"";"";"";"";"";"50,00";"-";"-8,67";"-10,86";"-4,96";"";"-4,51";"-4,51";"0,45";"";"-22,57";"-90,93";"30 797";"";"15";"13,33"
"NEWELEVEN 16 Oz Coffee Glass - Mom Birthday Gifts, Multicolor, Glass, 16 oz, Reusable, Insulated, Cylindrical, Casual, Cold Drinks, Christmas, Mother's Day, Birthday COG: 2,31 / Price: 12,98";"B0CBJSYJJS";"IV-16R1-T5AZ";"2";"";"25,96";"";"";"";"";"";"";"";"";"";"-";"";"-14,1";"-4,62";"";"7,24";"7,24";"11,86";"";"27,89";"156,71";"28 707";"";"13";"15,38"
"NewEleven Gifts For Aunt From Niece, Nephew - Cool Gifts For New Aunt, Auntie, Sister - Auntie Birthday Gift - Announcement, Promoted To Aunty - 16 Oz Coffee Glass COG: 2,4 / Price: 14,98";"B0CJ2CNDQT";"92-KAM5-CE6S";"2";"";"29,96";"";"";"";"";"";"";"";"";"";"-";"";"-14,06";"-4,8";"";"11,10";"11,10";"15,9";"";"37,05";"231,25";"31 055";"";"13";"15,38"
"NewEleven Birthday Gifts For Men, Women - Funny Gag Gifts Ideas For Dad, Mom, Grandpa, Grandma, Husband, Wife, Uncle, Him - 40th 50th 60th 70th 80th Birthday Gifts For Men Women – 20 Oz Tumbler COG: 3,69 / Price: 17,98";"B0CLYRNFBT";"3N-MM56-1WA4";"2";"";"31,98";"";"-6,3";"-6,3";"";"";"";"";"";"";"-";"";"-10,61";"-11,07";"";"4,00";"4,00";"15,07";"";"12,51";"36,13";"9 006";"19,70";"10";"20,00"
"NewEleven Birthday Gifts For Women - Funny Gag Gifts Ideas For Mom, Grandma, Wife, Her, Sister, Coworker - 40th 50th 60th 70th 80th Birthday Gifts For Women – 20 Oz Tumbler COG: 3,48 / Price: 15,98";"B0CT8JTMF8";"T3-8QDV-BD6U";"2";"";"31,96";"";"";"";"";"";"";"";"";"";"-";"";"-13,58";"-6,96";"";"11,42";"11,42";"18,38";"";"35,73";"164,08";"2 944";"";"25";"8,00"
"NewEleven Canvas Book Tote Bag Gifts For Readers, Novel Lovers Gift, Bookish Gifts - Gift For Book Lovers Readers Nerds Bookworm Librarian Women - Bookish Items, Reading Accessories COG: 3,17 / Price: 9,99";"B0D6NQ8KL6";"9K-KRK1-ALN8";"2";"";"19,98";"-1,4";"";"";"";"";"";"";"";"";"-";"";"-9,32";"-6,34";"";"2,92";"2,92";"9,26";"";"14,61";"46,06";"226 558";"";"1";"200,00"
"NewEleven Gifts For Mom, New Mom – 2025 Pregnancy Gifts For First Time Mother, Pregnant, Expecting Mama, Mother To Be, Mama, Mommy To Be - 16 Oz Coffee Glass COG: 1,7 / Price: 12,99";"B0DCJQ2SKV";"F5-C0C3-Z1JN";"2";"";"25,98";"";"";"";"";"";"";"";"";"";"-";"";"-14,28";"-3,4";"";"8,30";"8,30";"11,7";"";"31,95";"244,12";"7 799";"";"30";"6,67"
"NewEleven Gift For Brother - Brother Birthday Gifts, Christian Gifts For Little, Adult Bro, Sibling - Meaningful Gift For Brothers From Sister, Family - Bible Jar COG: 2,62 / Price: 18,98";"B0F7XCP31P";"JB-RJTD-OQ2R";"2";"";"37,96";"";"";"";"";"";"";"";"";"";"-";"";"-14,08";"-5,24";"";"18,64";"18,64";"23,88";"";"49,10";"355,73";"18 725";"";"40";"5,00"
"NewEleven Best Friend Birthday Gifts For Women - Best Friend Gift For Her, Him - Bestie Gift, Christian Present From Friends - Decorative Glass Inspirational Scripture Jar with 92 Bible Verse COG: 2,62 / Price: 17,98";"B0F8VPS7QN";"FY-G9UN-GE5E";"2";"";"35,96";"";"";"";"";"";"";"";"";"";"-";"";"-13,74";"-5,24";"";"16,98";"16,98";"22,22";"";"47,22";"324,05";"18 725";"";"25";"8,00"
"NewEleven Funny Boss Gifts - Appreciaton Card, Boss Birthday Card For Men, Women, Manager - Supervisor Gifts For Women From Coworker, Colleague - Greeting Card COG: 0,39 / Price: 4,99";"B0FC5TLHKZ";"RT-64X6-JD53";"2";"";"9,98";"";"";"";"";"";"";"";"";"";"-";"";"-6,24";"-0,78";"";"2,96";"2,96";"3,74";"";"29,66";"379,49";"3 015";"";"25";"8,00"
"NewEleven Teacher Thank You Cards - Teachers Appreciation Gifts, Heartfelt Messeage, Meaningful Thank You Teacher Gifts From Student, Kids - Greeting Card COG: 0,39 / Price: 4,99";"B0FC6CL2XN";"DM-O5C7-TN8L";"2";"";"9,98";"";"-2,55";"-2,55";"";"";"";"";"";"";"-";"";"-6,24";"-0,78";"";"0,41";"0,41";"1,19";"";"4,11";"52,56";"3 005";"25,55";"18";"11,11"
"NewEleven Birthday Gifts for Women - Thank You Present, Christian Gifts for Women, Mom, Teacher - Inspirational Gift for Coworker - Handmade Positive Sunflower Doll Crochet with Card COG: 0 / Price: 9,99";"B0FCLHRJ36";"0M-ATAJ-MC5Y";"2";"";"25,96";"";"-109,14";"-109,14";"";"";"";"";"";"";"-";"";"-12,1";"";"";"-95,28";"-95,28";"-95,28";"";"-367,03";"";"";"420,42";"42";"4,76"
"NewEleven Retirement Gifts For Women 2024 - Happy Retirement Gift - Coworker Leaving, Farewell, Goodbye Gifts For Coworkers, Friends - 12 Oz Tumbler COG: 3,99 / Price: 22,98";"B0B9RLH8RV";"HB-YPM1-SCJA";"1";"";"22,98";"";"";"";"";"";"";"";"";"";"-";"";"-7,95";"-3,99";"";"11,04";"11,04";"15,03";"";"48,04";"276,69";"15 726";"";"10";"10,00"
"NewEleven Gifts For Aunt From Niece, Nephew - Cool Gifts For New Aunt, Auntie, Sister - Aunts Birthday Gift - Announcement, Promoted To Aunty, Best Auntie Ever - 16 Oz Coffee Glass COG: 2,33 / Price: 12,98";"B0BC8SB3Y4";"DT-HT71-4QRG";"1";"";"12,98";"";"";"";"";"";"";"";"";"";"-";"";"-7,05";"-2,33";"";"3,60";"3,60";"5,93";"";"27,73";"154,51";"25 508";"";"13";"7,69"
"NewEleven Gifts For Wife, Her - Wife Gifts From Husband - Gift For Her - Gift Ideas For Women, Bride To Be, Fiancee, Wifey - 16 Oz Coffee Glass COG: 2,92 / Price: 13,99";"B0BDLH8KX3";"47-ZC5Z-3DOW";"1";"";"11,99";"";"";"";"";"";"";"";"";"";"-";"";"-6,97";"-2,92";"";"2,10";"2,10";"5,02";"";"17,51";"71,92";"59 866";"";"5";"20,00"
"NewEleven Gifts For Mom - Present For Mom From Daughter, Son, Kids - Unique Birthday Gifts For Mother, New Mom, Mommy, Pregnancy - 16 Oz Coffee Glass COG: 2,82 / Price: 13,99";"B0BHWDNYVL";"CW-5CAB-L7CZ";"1";"";"13,99";"";"";"";"";"";"";"";"";"";"-";"";"-7,3";"-2,82";"";"3,87";"3,87";"6,69";"";"27,66";"137,23";"28 791";"";"8";"12,50"
"NewEleven Bridal Shower Gifts - Wedding Gifts For Bride - Bachelorette Gift, Engagement Presents For Women - Gift For Bride To Be, Fiancee, Wifey, Her - 16 Oz Coffee Glass COG: 2,18 / Price: 13,98";"B0BRCCZLL8";"63-QY4L-OED4";"1";"";"13,98";"-0,98";"";"";"";"";"";"";"";"";"-";"";"-7,14";"-2,18";"";"3,68";"3,68";"5,86";"";"26,32";"168,81";"60 015";"";"5";"20,00"
"NewEleven Penguin Gifts For Women - Penguin Stuff For Pengy Lovers - Cute Funny Birthday Gift, Gift For Women, Best Friend, Sister, Daughter, Coworker - 16 Oz Coffee Glass COG: 2,17 / Price: 14,98";"B0C23Y5ZYH";"TU-6PXW-EYJS";"1";"";"14,98";"";"";"";"";"";"";"";"";"";"-";"";"-7,03";"-2,17";"";"5,78";"5,78";"7,95";"";"38,58";"266,36";"145 650";"";"1";"100,00"
"NewEleven Retirement Gifts For Woman 2025 - Happy Retirement Gifts For Coworker Leaving - Farewell, Goodbye Presents For Women, Coworkers, Friends - 20 Oz Tumbler COG: 4,02 / Price: 19,98";"B0C3CW184G";"L6-4LV1-54DE";"1";"";"19,98";"";"";"";"";"";"";"";"";"";"-";"";"-7,85";"-4,02";"";"8,11";"8,11";"12,13";"";"40,59";"201,74";"30 248";"";"7";"14,29"
"NewEleven Gifts For Aunt From Niece, Nephew - Cool Gifts For Aunt, New Auntie, Sister - Aunty Birthday Gift, Announcement, Promoted To Auntie, Best Aunty Ever - 20 Oz Tumbler COG: 3,83 / Price: 15,98";"B0C9D2PHMH";"GX-USB4-E6T8";"1";"";"15,98";"";"-4,07";"-4,07";"";"";"";"";"";"";"-";"";"-7,19";"-3,83";"";"0,89";"0,89";"4,72";"";"5,57";"23,24";"";"25,47";"6";"16,67"
"NewEleven Gifts For Book Lovers - Book Lovers Gifts For Women, Her, Friends - Book Accessories, Bookish Gifts For Writers, Readers, Librarian, Bookaholic, Bookworm – 16 Oz Coffee Glass COG: 2,03 / Price: 13,98";"B0CCDLWRTD";"68-JFET-D7YN";"1";"";"13,98";"";"";"";"";"";"";"";"";"";"-";"";"-6,86";"-2,03";"";"5,09";"5,09";"7,12";"";"36,41";"250,74";"78 389";"";"1";"100,00"
"NewEleven Fathers Day Gift For Dad, Men - Funny Birthday Gifts For Dad, Men, Car Guys - Unique Present Idea For Father, Husband, Uncle, Guys From Daughter, Son, Kids, Wife - 20 Oz Tumbler COG: 3,71 / Price: 14,98";"B0CHJ1V1RR";"0I-V2OD-GO56";"1";"";"14,98";"";"";"";"";"";"";"";"";"";"-";"";"-7,03";"-3,71";"";"4,24";"4,24";"7,95";"";"28,30";"114,29";"5 284";"";"5";"20,00"
"NewEleven Gifts For Coworker Friends – Work Bestie Gifts For Women Friendship - Unique Present Ideas For Coworker Leaving, Going Away, Goodbye, Farewell Party – 20 Oz Tumbler COG: 3,57 / Price: 17,98";"B0CHJ3W9SQ";"LA-XF5O-M492";"1";"";"19,98";"";"-9,85";"-9,85";"";"";"";"";"";"";"-";"";"-8,67";"-3,57";"";"-2,11";"-2,11";"1,46";"";"-10,56";"-59,10";"53 041";"49,30";"20";"5,00"
"NewEleven Gifts For Mom - Birthday Gifts For Mom From Daughter, Son, Kids, Husband - Wife Gift - Unique Present Ideas For Mother, Mother In Law, Wife, New Mama - 20 Oz Tumbler COG: 3,65 / Price: 19,98";"B0CJX4XSXB";"S8-FINW-47HP";"1";"";"19,98";"-1";"-5,56";"-5,56";"";"";"";"";"";"";"-";"";"-7,29";"-3,42";"";"2,71";"2,71";"6,13";"";"13,56";"79,24";"5 258";"27,83";"12";"8,33"
"NewEleven Fathers Day Gift For Dad - Birthday Gifts For Dad From Kids - Husband Gift - Birthday Present Ideas For Father, Husband, New Papa, Bonus Father From Daughter, Son - 20 Oz Tumbler COG: 3,44 / Price: 19,98";"B0CM5RJ8VD";"1J-71GS-RJFC";"1";"";"19,98";"";"";"";"";"";"";"";"";"";"-";"";"-7,45";"-3,44";"";"9,09";"9,09";"12,53";"";"45,50";"264,24";"5 309";"";"19";"5,26"
"NewEleven Fathers Day Gift For Grandpa - Grandpa Gifts From Granddaughter, Grandson - Unique Birthday Present Ideas For Grandfather, New Granddad, Promoted To Granddad, Grandchildren - 20 Oz Tumbler COG: 3,48 / Price: 19,98";"B0CQ4X98YF";"IW-TRN7-KQLA";"1";"";"19,98";"-1";"";"";"";"";"";"";"";"";"-";"";"-7,29";"-3,48";"";"8,21";"8,21";"11,69";"";"41,09";"235,92";"5 284";"";"5";"20,00"
"NewEleven Fathers Day Gift For Him - Birthday Gifts For Men, Funny Gift For Dad, Husband, Grandpa, Uncle, Old Men - Cool Gifts For Dad From Daughter, Son – 20 Oz Tumbler COG: 3,47 / Price: 19,98";"B0CRDFWF44";"A5-0R5N-261B";"1";"";"19,98";"";"";"";"";"";"";"";"";"";"-";"";"-7,45";"-3,47";"";"9,06";"9,06";"12,53";"";"45,35";"261,10";"5 284";"";"8";"12,50"
"NewEleven Retirement Gifts For Women 2025 - Happy Retirement Party Decorations - Coworker Leaving Gifts, Farewell Gift, Goodbye Gift For Coworkers, Friends - 16 Oz Wine Glass COG: 4,41 / Price: 23,98";"B0CWNTN1JN";"XL-MR6A-RPZ5";"1";"";"23,98";"";"";"";"";"";"";"";"";"";"-";"";"-9,33";"-4,41";"";"10,24";"10,24";"14,65";"";"42,70";"232,20";"12 804";"";"37";"2,70"
"NewEleven Trucker Cap for Men, Dad, Husband, Fisherman – Funny Fishing Hat, Trucker Hat Birthday Present for Him, Father, Guys Who Love Fishing COG: 2,67 / Price: 17,98";"B0CY4G9VSR";"BP-B33W-HG8K";"1";"";"19,98";"";"";"";"";"";"";"";"";"";"-";"";"-8,8";"-2,67";"";"8,51";"8,51";"11,18";"";"42,59";"318,73";"186 717";"";"30";"3,33"
"NewEleven Fathers Day Gift For Men, Dad, Husband, Him - Aprons For Men With Pockets - Funny Gifts For Men, Dad, Husband, Him - Grill Cooking BBQ Kitchen Chef Apron COG: 2,63 / Price: 15,98";"B0CY4VFW91";"7G-UBOK-AMA7";"1";"";"15,98";"";"";"";"";"";"";"";"";"";"-";"";"-7,58";"-2,63";"";"5,77";"5,77";"8,4";"";"36,11";"219,39";"20 576";"";"3";"33,33"
"NewEleven Gifts For Book Lovers - Book Lovers Gifts For Women - Book Themed Gift for Readers, Librarians, Bookaholics - Birthday Gift For Women, Her, Best Friend – 16 Oz Coffee Glass COG: 2,32 / Price: 13,98";"B0CZDV6J3V";"0B-GUIB-F6GL";"1";"";"13,98";"";"";"";"";"";"";"";"";"";"-";"";"-7,3";"-2,32";"";"4,36";"4,36";"6,68";"";"31,19";"187,93";"78 389";"";"4";"25,00"
"NewEleven Gifts For Teacher - Teacher Gifts For Women - Teachers Appreciation, Retirement, Graduation Presents - End Of Year Teachers Gift From Student - 16 Oz Coffee Glass COG: 3,53 / Price: 12,99";"B0D1GHNG9D";"DQ-DU5J-C7CQ";"1";"";"12,99";"";"";"";"";"";"";"";"";"";"-";"";"-6,7";"-3,53";"";"2,76";"2,76";"6,29";"";"21,25";"78,19";"188 942";"";"4";"25,00"
"NewEleven Gifts For Girl Mom - Gift For A Mom Of Girls, Pregnant Moms, Expecting Moms, Mama, Mother To Be, Mommy To Be, First Time Mommy - 16 Oz Coffee Glass COG: 2,46 / Price: 15,98";"B0D1K731RT";"9U-YWFQ-3O7Z";"1";"";"15,98";"";"";"";"";"";"";"";"";"";"-";"";"-7,63";"-2,46";"";"5,89";"5,89";"8,35";"";"36,86";"239,43";"7 811";"";"32";"3,13"
"NewEleven Witchy Gifts for Women, Witch Gifts, Witch Stuff, Witch Accessories - Birthday Halloween Presents for Women Witches Wiccan Her Friend Sister Daughter Female - 16 Oz Coffee Glass COG: 2,65 / Price: 15,99";"B0D5YGB4KV";"ZB-3CPZ-WSS8";"1";"";"15,99";"";"";"";"";"";"";"";"";"";"-";"";"-7,63";"-2,65";"";"5,71";"5,71";"8,36";"";"35,71";"215,47";"145 030";"";"2";"50,00"
"NewEleven 50th Birthday Gifts For Women, 50th Birthday Decorations, 50 Years Old Gifts For Her, Sister, Mom, Bestie, 1975 Birthday Gift For Women, Fifties Wine Tumbler - 12 Oz Tumbler COG: 3,84 / Price: 16,98";"B0D5YHG24C";"V3-2DHI-A0G1";"1";"4";"16,98";"";"";"";"";"";"";"";"";"400,00";"-";"-54,83";"-6,96";"-3,84";"";"-48,65";"-48,65";"-44,81";"";"-286,51";"-1 266,93";"8 993";"";"8";"12,50"
"NewEleven House Warming Gifts, New Home Ornament 2025, Dream Home Presents Ideas for Couple - Welcome Home Gifts, Housewarming Gift New Home, Best Housewarming Gift 2024 - Ceramic Ornament COG: 0,68 / Price: 7,99";"B0D6144Q48";"1Z-298F-OLVI";"1";"";"7,99";"";"";"";"";"";"";"";"";"";"-";"";"-3,61";"-0,68";"";"3,70";"3,70";"4,38";"";"46,31";"544,12";"92 809";"";"2";"50,00"
"NewEleven 30th Birthday Gifts For Women - 30s Birthday Decorations For Women - 30 Year Old Gifts For Her, Woman, Sister, Mom, Daughter, Best Friend - In My Thirties Era Wine Tumbler - 12 Oz Tumbler COG: 3,16 / Price: 12,98";"B0D79751XN";"BA-CM7Z-VMQN";"1";"";"12,98";"";"";"";"";"";"";"";"";"";"-";"";"-6,3";"-3,16";"";"3,52";"3,52";"6,68";"";"27,12";"111,39";"8 993";"";"6";"16,67"
"NewEleven Pet Memorial Gifts for Dogs, Cat Loss Gift - Dog Remembrance, Loss of Pet Sympathy Gifts, Pet Passing Away Gift, Rainbow Bridge Dog Remembrance Presents - Memorial Candle COG: 6,1 / Price: 15,98";"B0D82XJDLM";"U6-ZP01-FHVD";"1";"";"15,98";"";"";"";"";"";"";"";"";"";"-";"";"-7,63";"-6,1";"";"2,25";"2,25";"8,35";"";"14,08";"36,89";"353 299";"";"4";"25,00"
"NewEleven Retirement Candle - Funny Retirement Gift for Woman - Retired Gift Idea for Mom, Nurse, Teacher, Coworker & Friends - Scented Candle COG: 4,66 / Price: 15,98";"B0D831XY4Y";"8G-IBWS-BHP3";"1";"";"15,98";"";"";"";"";"";"";"";"";"";"-";"";"-0,65";"-4,66";"";"10,67";"10,67";"15,33";"";"66,77";"228,97";"354 576";"";"7";"14,29"
"NewEleven 50th Birthday Gifts for Men Women - 1975 Birthday Decorations for Him, Her - Gifts for People Turning 50 Year Old Mom, Dad, Wife, Husband - Retro Trucker Hat COG: 1,99 / Price: 17,98";"B0DHC2C1S4";"S1-6FQM-HSP6";"1";"";"17,98";"";"-22,4";"-22,4";"";"";"";"";"";"";"100";"1,99";"-8,58";"-1,99";"";"-13,00";"-13,00";"-13";"";"-72,30";"-653,27";"181 218";"124,58";"13";"7,69"
"NewEleven Engagement Gifts for Couples 2024 - First Christmas Engaged Gifts for Her - Engagement Gift for Newly Engaged Couples, Her, Women, Friends, Bride to Be Gift, Glass Christmas Ornaments COG: 2,09 / Price: 7,99";"B0DK16SMD9";"Q6-R02W-6Y1G";"1";"";"7,99";"";"";"";"";"";"";"";"";"";"-";"";"-4,23";"-2,09";"";"1,67";"1,67";"3,76";"";"20,90";"79,90";"92 437";"";"9";"11,11"
"NewEleven Godmother Gifts for Christmas, Godmom Proposal Gift - Will You Be My Godmother - Mom Present from Godchild - Christmas Ornament 2025 COG: 0,94 / Price: 4,99";"B0DLVRTFN9";"64-SAL7-XCWT";"1";"";"4,99";"";"";"";"";"";"";"";"";"";"-";"";"11,38";"-10,34";"";"6,03";"6,03";"16,37";"";"120,84";"58,32";"567 417";"";"3";"33,33"
"NewEleven House Warming Gifts, New Home Ornament 2025, Dream Home Gift Ideas Decor - Welcome Home Gifts, Housewarming Gift New Home, Best Housewarming Presents 2025 - Glass Ornament COG: 2,33 / Price: 9,99";"B0DPM5JXP7";"BK-7AQP-YXO7";"1";"";"9,99";"";"";"";"";"";"";"";"";"";"-";"";"-4,56";"-2,33";"";"3,10";"3,10";"5,43";"";"31,03";"133,05";"93 193";"";"11";"9,09"
"NewEleven Gifts for Women, Gift for Her, Mom, Friends, A Year of Promises of God Bible Scripture Memory Verse Cards Set of 52 - Christian, Religious, Inspirational Gifts for Women COG: 3,5 / Price: 9,98";"B0DQ42YY8T";"GQ-R013-PDDU";"1";"";"9,98";"";"";"";"";"";"";"";"";"";"-";"";"-5,43";"-3,5";"";"1,05";"1,05";"4,55";"";"10,52";"30,00";"162 799";"";"4";"25,00"
"NewEleven Class Of 2025 Graduation Gifts For Her, Friends - Funny Master Degree, College Graduation Gifts From Friends And Family - 16 Oz Coffee Glass COG: 2,3 / Price: 9,99";"B0DWMZXCZP";"UZ-8P0A-GPKD";"1";"";"11,99";"";"";"";"";"";"";"";"";"";"-";"";"-6,97";"-2,3";"";"2,72";"2,72";"5,02";"";"22,69";"118,26";"123 201";"";"5";"20,00"
"NewEleven Nurse Gifts For Women, Nursing Student, Nurses Practitioner, Registered Nurses - Nurse Appreciation Gifts For Women From Friends, Family And Coworker - 20 Oz Tumbler COG: 3,5 / Price: 12,98";"B0DWN2GX75";"P3-U5Q5-Y2JP";"1";"1";"12,98";"";"-8,34";"-8,34";"";"";"";"";"";"100,00";"-";"-8,67";"-6,3";"-3,5";"";"-13,83";"-13,83";"-10,33";"";"-106,55";"-395,14";"53 041";"64,25";"23";"4,35"
