"Product";"ASIN";"SKU";"Units";"Refunds";"Sales";"Promo";"Ads";"Sponsored products (PPC)";"Sponsored Display";"Sponsored brands (HSA)";"Sponsored Brands Video";"Google ads";"Facebook ads";"% Refunds";"Sellable Quota";"Refund сost";"Amazon fees";"Cost of Goods";"Shipping";"Gross profit";"Net profit";"Estimated payout";"Expenses";"Margin";"ROI";"BSR";"Real ACOS";"Sessions";"Unit Session Percentage"
"NewEleven Retirement Gifts For Woman 2025 - Happy Retirement Gifts For Coworker Leaving - Farewell, Goodbye Presents For Women, Coworkers, Friends - 20 Oz Tumbler COG: 5,52 / Price: 19,98";"B095S1818R";"LB-IWKF-ZPU8";"";"";"";"";"";"";"";"";"";"";"";"";"-";"";"";"";"";"";"";"";"";"";"";"30 047";"";"12";""
"NewEleven Gifts For Mom From Daughter, Son, Kids - Unique Birthday Gift For Mom Wife, New Mother, Bonus Mama, Pregnant Mama - Funny Gifts Ideas For Mum - 20 Oz Tumbler COG: 4,2 / Price: 16,98";"B097B9H21P";"YP-SEHP-8NOP";"";"";"";"";"";"";"";"";"";"";"";"";"-";"";"";"";"";"";"";"";"";"";"";"4 995";"";"18";""
"NewEleven Christmas Gift For Dad - Birthday Gifts For Dad From Daughter, Son, Kids - Husband Gifts - Birthday Present Ideas For Father, Husband, New Dad, Bonus Dad From Daughter, Son - 20 Oz Tumbler COG:  / Price: 0";"B097B9SY89";"";"";"";"";"";"";"";"";"";"";"";"";"";"-";"";"";"";"";"";"";"";"";"";"";"23 592";"";"4";""
"NewEleven Gift For Uncle From Niece, Nephew - Funny Unkie Gift, Uncle Birthday Gifts - Best Present For New Uncles, Funcle, Unky Announcement - 20 Oz Tumbler COG: 4,29 / Price: 19,98";"B097H6PJCN";"C5-L2Z6-TAT4";"";"";"";"";"";"";"";"";"";"";"";"";"-";"";"-13,75";"";"";"-13,75";"-13,75";"-13,75";"";"";"";"18 114";"";"8";""
"NewEleven Bird Watching Gifts, Gifts For Bird Lovers - Gift For Men Women - Funny Birding Gift For Birders, Birds Watchers, Birb Lovers, Men, Women, Friends - 20 Oz Tumbler COG: 4,78 / Price: 22,98";"B09S9PGL4T";"UD-JSC7-HVGH";"";"";"";"";"";"";"";"";"";"";"";"";"-";"";"-23,01";"";"";"-23,01";"-23,01";"-23,01";"";"";"";"179 675";"";"2";""
"NewEleven Retirement Gifts For Woman 2025 - Happy Retirement Gifts For Coworker Leaving - Farewell, Goodbye Presents For Women, Coworkers, Friends - 20 Oz Tumbler COG: 4,82 / Price: 19,98";"B09XDFLNR8";"74-78DN-W52B";"";"";"";"";"";"";"";"";"";"";"";"";"-";"";"-7,93";"";"";"-7,93";"-7,93";"-7,93";"";"";"";"29 939";"";"7";""
"NewEleven Coworker Leaving Gifts - Farewell Gifts, Going Away Gift For Coworker - New Job Gift, Goodbye, Good Luck Presents For Coworkers, Friends, Boss, Men, Women - 20 Oz Tumbler COG: 4,46 / Price: 19,98";"B09ZYBDMZ1";"Y3-JOZK-KF6U";"";"";"";"";"";"";"";"";"";"";"";"";"-";"";"-106,51";"";"";"-106,51";"-106,51";"-106,51";"";"";"";"43 380";"";"32";""
"NEWELEVEN 16 Oz Coffee Glass - Mama Needs Coffee - Transparent Glass - Reusable - 16 oz - Casual - Cold Drinks - Christmas, Mother's Day, Birthday - 1 Count COG: 2,55 / Price: 16,99";"B0B9SF2R4R";"SB-OEYK-4VNP";"";"";"";"";"";"";"";"";"";"";"";"";"-";"";"-40,62";"";"";"-40,62";"-40,62";"-40,62";"";"";"";"26 549";"";"6";""
"NewEleven Gifts For Aunt From Niece, Nephew - Cool Gifts For New Aunt, Auntie, Sister - Aunts Birthday Gift - Announcement, Promoted To Aunty, Best Auntie Ever - 16 Oz Coffee Glass COG: 2,33 / Price: 12,98";"B0BC8SB3Y4";"DT-HT71-4QRG";"";"";"";"";"-0,79";"-0,79";"";"";"";"";"";"";"-";"";"-12,76";"";"";"-13,55";"-13,55";"-13,55";"";"";"";"24 470";"";"9";""
"NewEleven Gifts For Sister - Unique Birthday Present For Sisters, Soul Sis, Big, Little Sister, Sisters In Law, Sibling, Bestie - 16 Oz Coffee Glass COG: 2,04 / Price: 15,98";"B0BC8WBYW7";"U3-HSBK-1RJI";"";"";"";"";"";"";"";"";"";"";"";"";"-";"";"-24,62";"";"";"-24,62";"-24,62";"-24,62";"";"";"";"55 602";"";"4";""
"NewEleven Gifts For Wife, Her - Wife Gifts From Husband - Gift For Her - Gift Ideas For Women, Bride To Be, Fiancee, Wifey - 16 Oz Coffee Glass COG: 2,92 / Price: 13,99";"B0BDLH8KX3";"47-ZC5Z-3DOW";"";"";"";"";"";"";"";"";"";"";"";"";"-";"";"-8,85";"";"";"-8,85";"-8,85";"-8,85";"";"";"";"52 421";"";"13";""
"NewEleven Gifts For Mom - Present For Mom From Daughter, Son, Kids - Unique Birthday Gifts For Mother, New Mom, Mommy, Pregnancy - 16 Oz Coffee Glass COG: 2,82 / Price: 13,99";"B0BHWDNYVL";"CW-5CAB-L7CZ";"";"";"";"";"";"";"";"";"";"";"";"";"-";"";"-11,57";"";"";"-11,57";"-11,57";"-11,57";"";"";"";"26 549";"";"2";""
"NewEleven Gifts For Women Friendship - Funny Gifts For Friends Female - Unique Friendship Present For Her, Female, Bestie, Bff, Soul Sister, Work Bestie - 16 Oz Coffee Glass COG: 2,29 / Price: 15,98";"B0BRB5SPYZ";"25-YAS2-RJHI";"";"";"";"";"";"";"";"";"";"";"";"";"-";"";"-17,1";"";"";"-17,10";"-17,10";"-17,1";"";"";"";"20 404";"";"12";""
"NewEleven Bridal Shower Gifts - Wedding Gifts For Bride - Bachelorette Gift, Engagement Presents For Women - Gift For Bride To Be, Fiancee, Wifey, Her - 16 Oz Coffee Glass COG: 2,18 / Price: 13,98";"B0BRCCZLL8";"63-QY4L-OED4";"";"";"";"";"";"";"";"";"";"";"";"";"-";"";"-3,42";"";"";"-3,42";"-3,42";"-3,42";"";"";"";"52 421";"";"11";""
"NewEleven Christmas Gifts For Women Friendship - Funny Gifts For Friends Female - Unique Friendship Gift For Women, Friend, Female, Bestie, Bff, Soul Sister, Work Bestie - 16 Oz Coffee Glass COG:  / Price: 0";"B0BRCDZRSP";"";"";"";"";"";"";"";"";"";"";"";"";"";"-";"";"-75,13";"";"";"-75,13";"-75,13";"-75,13";"";"";"";"20 404";"";"8";""
"NewEleven Gifts For Sister From Sisters, Brother - Unique Birthday Present, Soul Sister, Big Sis Little Sis, Sisters In Law, Sibling, Bestie - 16 Oz Coffee Glass COG: 2,02 / Price: 15,98";"B0BYCSHGYX";"LB-UB38-W1AN";"";"";"";"";"";"";"";"";"";"";"";"";"-";"";"-26,76";"";"";"-26,76";"-26,76";"-26,76";"";"";"";"55 602";"";"2";""
"NewEleven Cute Glass Coffee Cups With Lids And Straw – Aesthetic Cups – Iced Coffee Cup, Coffees Tumbler – Galentines Gifts For Women, Coffees Lover - 16 Oz Coffee Glass COG: 2,33 / Price: 14,98";"B0C1BS7BV8";"8N-VAIO-VFH3";"";"";"";"";"";"";"";"";"";"";"";"";"-";"";"";"";"";"";"";"";"";"";"";"20 404";"";"11";""
"NewEleven Cute Cups With Lids And Straw – Aesthetic Cups – Iced Java Cup, Coffee Tumbler, Glass Tumbler – Galentines Gifts For Women, Java Lover - 16 Oz Coffee Glass COG: 2,86 / Price: 12,34";"B0C1C1F4M4";"Z2-BJ5R-5S3M";"";"";"";"";"";"";"";"";"";"";"";"";"-";"";"-1,52";"";"";"-1,52";"-1,52";"-1,52";"";"";"";"20 475";"";"4";""
"NewEleven Gifts For Women - Stuff For Sloth Lovers - Cute Funny Birthday Gifts For Women, Best Friend, Sister, Daughter, Coworker - 16 Oz Coffee Glass COG: 2,37 / Price: 14,98";"B0C23XHCN1";"ZE-FHJ1-JZZW";"";"";"";"";"";"";"";"";"";"";"";"";"-";"";"-7,43";"";"";"-7,43";"-7,43";"-7,43";"";"";"";"176 753";"";"";""
"NewEleven Penguin Gifts For Women - Penguin Stuff For Pengy Lovers - Cute Funny Birthday Gift, Gift For Women, Best Friend, Sister, Daughter, Coworker - 16 Oz Coffee Glass COG: 2,17 / Price: 14,98";"B0C23Y5ZYH";"TU-6PXW-EYJS";"";"";"";"";"";"";"";"";"";"";"";"";"-";"";"-17,34";"";"";"-17,34";"-17,34";"-17,34";"";"";"";"176 753";"";"2";""
"NewEleven Gifts For Her - Cow Gifts For Women - Stuff For Cow Lovers - Cute Funny Birthday Gift For Women, Best Friend, Sister, Daughter, Coworker - 16 Oz Coffee COG: 2,29 / Price: 14,98";"B0C242DYT4";"OX-EHPQ-U3LT";"";"";"";"";"";"";"";"";"";"";"";"";"-";"";"-72,4";"";"";"-72,40";"-72,40";"-72,4";"";"";"";"178 184";"";"1";""
"NEWELEVEN 16 Oz Coffee Glass - Mom Birthday Gifts, Multicolor, Glass, 16 oz, Reusable, Insulated, Cylindrical, Casual, Cold Drinks, Christmas, Mother's Day, Birthday COG: 2,31 / Price: 12,98";"B0CBJSYJJS";"IV-16R1-T5AZ";"";"";"";"";"";"";"";"";"";"";"";"";"-";"";"-24,29";"";"";"-24,29";"-24,29";"-24,29";"";"";"";"26 434";"";"8";""
"NewEleven Gifts For Book Lovers - Book Lovers Gifts For Women, Her, Friends - Book Accessories, Bookish Gifts For Writers, Readers, Librarian, Bookaholic, Bookworm – 16 Oz Coffee Glass COG: 2,03 / Price: 13,98";"B0CCDLWRTD";"68-JFET-D7YN";"";"";"";"";"";"";"";"";"";"";"";"";"-";"";"";"";"";"";"";"";"";"";"";"66 667";"";"9";""
"NewEleven Valentines Gifts For Wife - Romantic Anniversary Wedding Presents From Husband - Best Ideas For Her, Women - 20 Oz Tumbler COG: 3,65 / Price: 15,98";"B0CHFDJGN6";"OJ-R1SW-8WVI";"";"";"";"";"";"";"";"";"";"";"";"";"-";"";"-2,39";"";"";"-2,39";"-2,39";"-2,39";"";"";"";"277 985";"";"";""
"NewEleven Fathers Day Gift For Dad, Men - Funny Birthday Gifts For Dad, Men, Car Guys - Unique Present Idea For Father, Husband, Uncle, Guys From Daughter, Son, Kids, Wife - 20 Oz Tumbler COG: 3,71 / Price: 14,98";"B0CHJ1V1RR";"0I-V2OD-GO56";"";"";"";"";"";"";"";"";"";"";"";"";"-";"";"";"";"";"";"";"";"";"";"";"4 995";"";"4";""
"NewEleven Birthday Gifts For Men Women – Funny Gag Gifts Ideas For Dad, Mom, Grandpa, Grandma, Husband, Wife, Uncle, Him 40th 50th 60th 70th 80th From Daughter, Son, Friends – Beer Mug COG: 0 / Price: 12,99";"B0CKYM1F5V";"23-Y740-I1UZ";"";"";"";"";"";"";"";"";"";"";"";"";"-";"";"-1,31";"";"";"-1,31";"-1,31";"-1,31";"";"";"";"231 163";"";"";""
"NEWELEVEN Christmas Book Lovers Gifts for Women, Friends - Bookshelf Cup, Accessories for Writers, Readers, Librarian, Bookaholic, Bookworm - 16 Oz Coffee Glass COG:  / Price: 0";"B0CKYMNV39";"";"";"";"";"";"";"";"";"";"";"";"";"";"-";"";"-15,65";"";"";"-15,65";"-15,65";"-15,65";"";"";"";"36 826";"";"15";""
"NewEleven Birthday Gifts For Men, Women - Funny Gag Gifts Ideas For Dad, Mom, Grandpa, Grandma, Husband, Wife, Uncle, Him - 40th 50th 60th 70th 80th Birthday Gifts For Men Women – 20 Oz Tumbler COG: 3,69 / Price: 17,98";"B0CLYRNFBT";"3N-MM56-1WA4";"";"";"";"";"-1,64";"-1,64";"";"";"";"";"";"";"-";"";"-17,68";"";"";"-19,32";"-19,32";"-19,32";"";"";"";"9 777";"";"15";""
"NewEleven Birthday Gifts For Men, Women - Funny Gag Gifts Ideas For Dad, Mom, Grandpa, Grandma, Husband, Wife, Uncle, Him - 40th 50th 60th 70th 80th Birthday Gifts For Men Women – 20 Oz Tumbler COG: 3,76 / Price: 16,99";"B0CLYSGX7Q";"OA-DGFL-ZKWU";"";"";"";"";"";"";"";"";"";"";"";"";"-";"";"-2,57";"";"";"-2,57";"-2,57";"-2,57";"";"";"";"9 777";"";"4";""
"NewEleven Fathers Day Gift For Dad - Birthday Gifts For Dad From Daughter - Husband Gifts - Unique Birthday Present Ideas For Father, Husband, New Papa, Bonus Father From Daughter - 20 Oz Tumbler COG: 3,19 / Price: 19,98";"B0CM5R5BDX";"WC-3I7C-6VN5";"";"";"";"";"";"";"";"";"";"";"";"";"-";"";"";"";"";"";"";"";"";"";"";"23 370";"";"3";""
"NewEleven Dad Gifts - Birthday Gifts For Dad From Daughter - Husband Gift - Unique Birthday Present Ideas For Father, Husband, New Papa, Bonus Father From Daughter - 20 Oz Tumbler COG: 3,19 / Price: 15,98";"B0CM5RY3QS";"J7-CYQ3-G6E8";"";"";"";"";"";"";"";"";"";"";"";"";"-";"";"";"";"";"";"";"";"";"";"";"18 114";"";"3";""
"NewEleven Gifts For Brothers From Sister, Bro - Best Birthday Gift For Big, Little Brother, Siblings, Brothers In Law, Men - 20 Oz Tumbler Navy COG: 3,69 / Price: 19,98";"B0CN926PG1";"1O-O788-ZCZU";"";"";"";"";"";"";"";"";"";"";"";"";"-";"";"";"";"";"";"";"";"";"";"";"18 114";"";"2";""
"NewEleven 50th Birthday Gifts For Men Women - 1974 50th Birthday Decorations - Gifts For Men Women Turning 50-50 Year Old Gift For Man, Woman, Mom, Dad, Wife, Husband - 20 Oz Tumbler COG: 3,65 / Price: 19,98";"B0CN93LZ5M";"RQ-VBDU-6QPJ";"";"";"";"";"";"";"";"";"";"";"";"";"100";"3,65";"";"";"";"3,65";"3,65";"";"";"";"";"3 147";"";"14";""
"NewEleven Fathers Day Gift For Dad, Men - Funny Birthday Gifts For Dad, Men, Car Guys - Unique Present Idea For Father, Papa, Husband, Uncle, Guys From Daughter, Son, Kids, Wife - 20 Oz Tumbler COG: 3,93 / Price: 19,98";"B0CNTFTNT9";"MO-1909-MXZY";"";"";"";"";"";"";"";"";"";"";"";"";"-";"";"-0,42";"";"";"-0,42";"-0,42";"-0,42";"";"";"";"4 995";"";"5";""
"NewEleven Gifts For Grandma - Grandma Gifts From Granddaughter, Grandson - Birthday Gift For Grandmother, Nana, Gigi, Mimi, Grammy From Grandchildren, Grandchild - 20 Oz Tumbler COG: 3,62 / Price: 17,98";"B0CQ2K12H3";"RR-GSRH-DCUL";"";"";"";"";"";"";"";"";"";"";"";"";"-";"";"-18,4";"";"";"-18,40";"-18,40";"-18,4";"";"";"";"4 995";"";"5";""
"NewEleven Fathers Day Gift For Grandpa - Grandpa Gifts From Granddaughter, Grandson - Unique Birthday Present Ideas For Grandfather, New Granddad, Promoted To Granddad, Grandchildren - 20 Oz Tumbler COG: 3,48 / Price: 19,98";"B0CQ4X98YF";"IW-TRN7-KQLA";"";"";"";"";"";"";"";"";"";"";"";"";"100";"3,48";"";"";"";"3,48";"3,48";"";"";"";"";"4 995";"";"6";""
"NewEleven Personalized Monogrammed Gifts For Women – Customized Birthday Gifts For Women, Friends, Girls - Galentines Gifts For Her G - 16 Oz Coffee Glass COG: 4,63 / Price: 9,99";"B0CQK4MG56";"6U-PZ7L-SI1S";"";"";"";"";"";"";"";"";"";"";"";"";"-";"";"-2,17";"";"";"-2,17";"-2,17";"-2,17";"";"";"";"336 281";"";"";""
"NewEleven Personalized Monogrammed Gift For Women - Customized Birthday Present For Friends, Girls - Galentines J - 16 Oz Coffee Glass COG: 4,63 / Price: 4,99";"B0CQK4V7V5";"CR-SIFM-P1DT";"";"";"";"";"";"";"";"";"";"";"";"";"-";"";"-9,18";"";"";"-9,18";"-9,18";"-9,18";"";"";"";"332 533";"";"";""
"NewEleven Personalized Monogrammed Gifts For Women – Customized Birthday Gifts For Women, Friends, Girls - Galentines Gifts For Her B - 16 Oz Coffee Glass COG: 4,63 / Price: 4,99";"B0CQK6DPGH";"K4-VBOP-0M2I";"";"";"";"";"";"";"";"";"";"";"";"";"-";"";"-1,57";"";"";"-1,57";"-1,57";"-1,57";"";"";"";"336 281";"";"";""
"NewEleven Birthday Gifts For Women - Funny Gag Gifts Ideas For Mom, Grandma, Wife, Her, Sister, Coworker - 40th 50th 60th 70th 80th Birthday Gifts For Women – 20 Oz Tumbler COG: 3,48 / Price: 15,98";"B0CT8JTMF8";"T3-8QDV-BD6U";"";"";"";"";"";"";"";"";"";"";"";"";"-";"";"-8,45";"";"";"-8,45";"-8,45";"-8,45";"";"";"";"3 147";"";"23";""
"NewEleven 75th Birthday Gifts For Men Women - 1949 75th Birthday Decorations For - Gifts For Men Women Turning 75-75 Year Old Gifts For Man, Woman, Mom, Dad, Wife, Husband - 20 Oz Tumbler COG: 3,61 / Price: 29,98";"B0CXXN8G72";"4P-YCOW-ED7Z";"";"";"";"";"";"";"";"";"";"";"";"";"-";"";"-0,24";"";"";"-0,24";"-0,24";"-0,24";"";"";"";"593 884";"";"1";""
"NewEleven Gifts For Him, Men - Fishing Gifts For Men, Dad, Cup Gift For Fisherman, Father - Dad Birthday Gift From Wife, Kids - 20 Oz Tumbler COG: 3,41 / Price: 17,98";"B0CY4HY9KC";"KK-1KUK-ZBSZ";"";"";"";"";"";"";"";"";"";"";"";"";"-";"";"";"";"";"";"";"";"";"";"";"18 114";"";"5";""
"NewEleven Birthday Gifts for Women, Funny Present for Best Friend Women - My Last Nerve Candle - Unique Birthday Gifts for Woman, Her, Mom, BFF, Sister - 10 Oz Candle COG: 4,3 / Price: 9,49";"B0CYSGX6DF";"U2-T22R-L5YH";"";"";"";"";"";"";"";"";"";"";"";"";"-";"";"-12,07";"";"";"-12,07";"-12,07";"-12,07";"";"";"";"165 532";"";"5";""
"NewEleven Gifts For Nurse - Nursing Graduation Gift For Women Her - Caregiver Appreciation Gifts, Nursing Student, New Nurses, Nurse Practitioner, RN - 16 Oz Coffee Glass COG: 2,68 / Price: 9,99";"B0D1GF81G8";"WJ-F0KW-EYOB";"";"";"";"";"";"";"";"";"";"";"";"";"-";"";"-2,46";"";"";"-2,46";"-2,46";"-2,46";"";"";"";"30 913";"";"17";""
"NewEleven 40th Birthday Gifts Women Men - 1985 40th Birthday Decorations For Men Women - Gifts For Men Women Turning 40-40 Year Old Gift For Man, Woman, Mom, Dad, Wife, Husband - 20 Oz Tumbler COG: 3,43 / Price: 14,98";"B0D1GH6WJ6";"ZV-XJ69-4UIW";"";"";"";"";"";"";"";"";"";"";"";"";"-";"";"-12,45";"";"";"-12,45";"-12,45";"-12,45";"";"";"";"27 581";"";"5";""
"NewEleven Gifts For Teacher - Teacher Gifts For Women - Teachers Appreciation, Retirement, Graduation Presents - End Of Year Teachers Gift From Student - 16 Oz Coffee Glass COG: 3,53 / Price: 12,99";"B0D1GHNG9D";"DQ-DU5J-C7CQ";"";"";"";"";"";"";"";"";"";"";"";"";"-";"";"";"";"";"";"";"";"";"";"";"175 574";"";"4";""
"NewEleven Gifts For Godmother - Will You Be My Godmother From GodChild - Pregnancy Announcement Gifts For Godmom, Godparents - 16 Oz Coffee Glass COG: 2,58 / Price: 17,98";"B0D2NSHWZK";"J5-EJIM-0Y8E";"";"";"";"";"-1,5";"-1,5";"";"";"";"";"";"";"-";"";"-42,52";"";"";"-44,02";"-44,02";"-44,02";"";"";"";"48 886";"";"11";""
"NewEleven 21st Birthday Gifts For Women, Her - 2004 Birthday Decorations - 21 Year Old Gifts Ideas For Women, Her, Daughter, Sister, Best Friends - 16 Coffee Glass COG: 3,66 / Price: 16,98";"B0D39T2MVK";"73-AOV6-10DJ";"";"";"";"";"";"";"";"";"";"";"";"";"-";"";"";"";"";"";"";"";"";"";"";"10 865";"";"12";""
"NewEleven Witchy Gifts for Women, Witch Gifts, Witch Stuff, Witch Accessories - Birthday Halloween Presents for Women Witches Wiccan Her Friend Sister Daughter Female - 16 Oz Coffee Glass COG: 2,65 / Price: 15,99";"B0D5YGB4KV";"ZB-3CPZ-WSS8";"";"";"";"";"";"";"";"";"";"";"";"";"-";"";"-5,31";"";"";"-5,31";"-5,31";"-5,31";"";"";"";"176 753";"";"9";""
"NewEleven House Warming Gifts, New Home Ornament 2025, Dream Home Presents Ideas for Couple - Welcome Home Gifts, Housewarming Gift New Home, Best Housewarming Gift 2024 - Ceramic Ornament COG: 0,68 / Price: 7,99";"B0D6144Q48";"1Z-298F-OLVI";"";"";"";"";"";"";"";"";"";"";"";"";"-";"";"-3,47";"";"";"-3,47";"-3,47";"-3,47";"";"";"";"72 372";"";"4";""
"NewEleven Canvas Book Tote Bag Gifts For Readers, Novel Lovers Gift, Bookish Gifts - Gift For Book Lovers Readers Nerds Bookworm Librarian Women - Bookish Items, Reading Accessories COG: 3,17 / Price: 9,99";"B0D6NQ8KL6";"9K-KRK1-ALN8";"";"";"";"";"";"";"";"";"";"";"";"";"-";"";"";"";"";"";"";"";"";"";"";"187 813";"";"1";""
"NewEleven Teacher Appreciation Gifts - Difference Maker Gift for Friend, Co-Worker, Boss - Motivational, Graduation Gifts for Women - Goodbye Gift for Coworkers - Scented Candle COG: 5,58 / Price: 15,98";"B0D72QM578";"8M-I3B0-E0CI";"";"";"";"";"";"";"";"";"";"";"";"";"-";"";"";"";"";"";"";"";"";"";"";"269 756";"";"1";""
"NewEleven Pregnancy Announcement for Husband Wife Family, Gender Reveal Gifts, Pregnancy Gifts for Expecting Mom, for New Mom, New Dad, New Parents - Ornament COG: 0,9 / Price: 7,99";"B0D72Z4996";"FB-GMDU-EXTV";"";"";"";"";"";"";"";"";"";"";"";"";"-";"";"";"";"";"";"";"";"";"";"";"72 372";"";"6";""
"NewEleven 25th Wedding 25th Anniversary Decorations, Wedding for Couple, Parents, Him, Her - Glass Christmas Ornament COG: 2,18 / Price: 5,99";"B0D7HNDG8Y";"RR-R416-X1G0";"";"";"";"";"";"";"";"";"";"";"";"";"-";"";"-0,09";"";"";"-0,09";"-0,09";"-0,09";"";"";"";"1 624 654";"";"";""
"NewEleven Nativity Christmas Ornaments 2024 - Nativity Scene Ceramic Ornaments for Christmas Tree - The Birth of Jesus Decoration - Religious Gift for Christians, Women, Friends, and Family COG: 0,96 / Price: 11,99";"B0D7MXCGWM";"ZO-U3PO-EZI9";"";"";"";"";"";"";"";"";"";"";"";"";"-";"";"";"";"";"";"";"";"";"";"";"1 807 292";"";"2";""
"NewEleven Valentines Gifts for 50th Wedding Happy for Couple, Parents, Grandparents - 50th Anniversary Ornament, 50th Anniversary Decorations Gift for Couples, Husband, Wife COG: 0,89 / Price: 7,99";"B0D7N2F66T";"HU-E4OJ-DWJ7";"";"";"";"";"";"";"";"";"";"";"";"";"-";"";"-0,23";"";"";"-0,23";"-0,23";"-0,23";"";"";"";"1 614 275";"";"";""
"NewEleven Retirement Candle - Funny Retirement Gift for Woman - Retired Gift Idea for Mom, Nurse, Teacher, Coworker & Friends - Scented Candle COG: 4,66 / Price: 15,98";"B0D831XY4Y";"8G-IBWS-BHP3";"";"1";"";"";"";"";"";"";"";"";"";"∞";"-";"-13,98";"-1,21";"";"";"-15,19";"-15,19";"-15,19";"";"";"";"269 756";"";"8";""
"NewEleven Memorial Gifts for Loss of Loved One, Condolences Bereavement Present Idea, Celebration of Life Decorations - Ceramic Christmas Ornament COG: 0,97 / Price: 6,99";"B0D9VKTY47";"0B-A1DR-X8J4";"";"";"";"";"";"";"";"";"";"";"";"";"-";"";"-0,06";"";"";"-0,06";"-0,06";"-0,06";"";"";"";"499 310";"";"";""
"NewEleven Gifts for Couple Gifts, 40 Scratch Off Date Night Ideas - Couple Games, for Boyfriend, Girlfriend - Wedding Gifts for Couples 2025 - Scratch Off Card Game COG: 4,07 / Price: 5,99";"B0DBQ2YF28";"RV-RE7W-OSYS";"";"";"";"";"";"";"";"";"";"";"";"";"-";"";"-57,91";"";"";"-57,91";"-57,91";"-57,91";"";"";"";"504 554";"";"";""
"NEWELEVEN Retirement Angel Figurine 2024 - Retirement Gift for Women, Nurse, Teacher, Doctor - Classic, Light Color COG: 3,16 / Price: 25,99";"B0DFBYSQTQ";"ZF-L7XO-E9LR";"";"";"";"";"";"";"";"";"";"";"";"";"-";"";"-0,03";"";"";"-0,03";"-0,03";"-0,03";"";"";"";"841 566";"";"";""
"NewEleven Gifts for Coworkers - Appreciation Present, Coworker Ornament - Christmas Tree Decoration Present for Colleagues, Leader, Office, Friends - Christmas Ornament COG: 1,53 / Price: 5,99";"B0DG8Y15PG";"RM-BKTR-DA1N";"";"";"";"";"";"";"";"";"";"";"";"";"-";"";"";"";"";"";"";"";"";"";"";"439 813";"";"2";""
"NewEleven 40th Birthday Gifts For Men Women - 1985 40th Birthday Decorations For Men Women - Turning 40-40 Year Old Gifts For Man, Woman, Mom, Dad, Wife, Husband - 20 Oz Tumbler COG: 3,45 / Price: 21,98";"B0DH7PQ1RX";"7N-6OBC-K7DN";"";"";"";"";"-14,82";"-14,82";"";"";"";"";"";"";"100";"3,45";"-2,67";"";"";"-14,04";"-14,04";"-17,49";"";"";"";"9 777";"";"15";""
"NewEleven 2024 Christmas Ornament, 2024 Year in Review Ornaments, Memorable 2024 Christmas Decor Gifts, Decorative Gifts for Friends, Coworker, Family - Ceramic Ornaments COG: 1,12 / Price: 5,99";"B0DH7VZ4CY";"TZ-P3U6-QGEY";"";"";"";"";"";"";"";"";"";"";"";"";"-";"";"";"";"";"";"";"";"";"";"";"442 848";"";"3";""
"NewEleven 60th Birthday Gifts For Men Women - 1965 60th Birthday Decorations For Him Her - Turning 60 Year Old Gifts For Man, Woman, Mom, Dad, Wife, Husband - 20 Oz Tumbler COG: 3,35 / Price: 21,98";"B0DHCFTYVW";"06-AGXV-L5EK";"";"";"";"";"";"";"";"";"";"";"";"";"-";"";"-2,96";"";"";"-2,96";"-2,96";"-2,96";"";"";"";"9 777";"";"7";""
"NewEleven Baby Pregnancy Announcement Ornament for Grandparents - First Time Grandparents Gifts - Promoted to Grandma Grandpa Gift- Pregnancy Announcement Decorations - Glass Christmas Ornament COG: 2,1 / Price: 5,99";"B0DJBGMLS2";"30-T498-37E5";"";"";"";"";"";"";"";"";"";"";"";"";"-";"";"-4,14";"";"";"-4,14";"-4,14";"-4,14";"";"";"";"499 310";"";"";""
"Eleven Pet Memorial Picture Frame Christmas Ornaments 2025, Pet Memorial Gifts for Loss of Pet, Pet Loss Sympathy Gift, Remembrance Present, Dog Memorial Ornament COG: 1,26 / Price: 5,99";"B0DJT5JM6T";"ID-73LU-NV4W";"";"";"";"";"";"";"";"";"";"";"";"";"-";"";"-0,12";"";"";"-0,12";"-0,12";"-0,12";"";"";"";"499 310";"";"1";""
"NewEleven Coworker Ornaments, Christmas Ornament Gifts for Coworkers - Coworker Gift for Women, Present for Coworkers, Friendship Presents for Work Bestie - Christmas Decorations COG: 1,1 / Price: 7,99";"B0DJXTHGW2";"MF-4MWG-A4QS";"";"";"";"";"";"";"";"";"";"";"";"";"-";"";"";"";"";"";"";"";"";"";"";"439 813";"";"2";""
"NewEleven Sister 2025, Sister Birthday Gifts for Women, Big Sister Gifts for Girls - Gift for Women, Soul Sister, BFF, Big Sister Gift Glass Christmas Ornaments COG: 2 / Price: 5,99";"B0DJXZ36VG";"O2-5UU0-154U";"";"";"";"";"";"";"";"";"";"";"";"";"-";"";"";"";"";"";"";"";"";"";"";"685 011";"";"1";""
"NewEleven Christmas Book Lovers Gifts, Bookshelf Decor Present for Book Lovers Women, Librarian Gifts - Bookish Items Décor - Ceramic Christmas Orrnament COG: 1,1 / Price: 3,99";"B0DJY12521";"YS-AGM5-SUV4";"";"";"";"";"";"";"";"";"";"";"";"";"-";"";"-0,89";"";"";"-0,89";"-0,89";"-0,89";"";"";"";"502 346";"";"";""
"NewEleven Family Christmas Ornaments 2025, Decorations Indoor, Mom, Dad, Sister, Brother - Family Tree Funny Decor - Ceramic Christmas Ornaments COG: 0,9 / Price: 5,99";"B0DJY14TYV";"T1-PJGN-ZDTZ";"";"";"";"";"";"";"";"";"";"";"";"";"-";"";"-0,01";"";"";"-0,01";"-0,01";"-0,01";"";"";"";"439 813";"";"3";""
"NewEleven Gifts for Friends, BFF, Coworker for Women, Appreciation Gifts, Thank You for Women - Best Friend Birthday Gift - Glass Christmas Ornament 2025 COG: 2 / Price: 7,99";"B0DJY2BVJB";"R8-Q5WC-138Q";"";"";"";"";"";"";"";"";"";"";"";"";"-";"";"11,58";"-10";"";"1,58";"1,58";"11,58";"";"";"15,80";"685 011";"";"";""
"NewEleven Grandma Gifts from Granddaughter, Grandma and Granddaughter Ceramic Ornament Gift for Nana Nanny Gigi Grandmother, Present for Grandmother Round Ceramic Ornament Keepsake COG: 1,16 / Price: 9,99";"B0DJY5K8QD";"EZ-X0G8-U3J2";"";"";"";"";"";"";"";"";"";"";"";"";"-";"";"-0,89";"";"";"-0,89";"-0,89";"-0,89";"";"";"";"499 310";"";"1";""
"NewEleven Gifts for Mom from Daughter, Gift from Mom, Mommy, Birthday Gift for Mother, Mothers Present - The Love Between Mother and Daughter - Christmas Ornaments COG: 0,95 / Price: 5,99";"B0DJY5ZSY9";"B0-97Q9-I1A3";"";"";"";"";"";"";"";"";"";"";"";"";"-";"";"-0,97";"";"";"-0,97";"-0,97";"-0,97";"";"";"";"502 346";"";"1";""
"NewEleven Thank You Gifts for Women, Nurses, Teacher, Coworker, Friends - Gift for Women, Appreciation Present for Coworkers, Farewell, BFF, Woman, Men - Glass Christmas Ornaments COG: 1,9 / Price: 5,99";"B0DJY7689G";"2F-J6P4-R5IG";"";"";"";"";"";"";"";"";"";"";"";"";"-";"";"0,2";"-1,9";"";"-1,70";"-1,70";"0,2";"";"";"-89,47";"439 813";"";"4";""
"NewEleven Pet First Christmas Ornaments 2024, for Puppy Dog Cat Pet Lovers, Cat Dog Picture Frame Ornaments for Christmas Tree COG: 1,29 / Price: 5,99";"B0DJY79JYZ";"CE-YODW-3F5U";"";"";"";"";"";"";"";"";"";"";"";"";"-";"";"-0,36";"";"";"-0,36";"-0,36";"-0,36";"";"";"";"499 310";"";"";""
"NewEleven Neighbor Thank You Gift for Christmas - Best for Friends, Women, Men, Neighborhood - Christmas Ornament 2025 COG: 1,11 / Price: 6,99";"B0DJY86YHR";"SR-B6VQ-8JH4";"";"";"";"";"";"";"";"";"";"";"";"";"-";"";"";"";"";"";"";"";"";"";"";"3 066 292";"";"1";""
"NewEleven Godparents Proposal Gift - Godparents are Blessing, Godfather Gifts - Present for Godparents, Baptism Decoration Presents - Ceramic Christmas Ornaments COG: 0,98 / Price: 5,99";"B0DJY87DG8";"K2-7N8N-8Q7Q";"";"";"";"";"";"";"";"";"";"";"";"";"-";"";"1,71";"-0,98";"";"0,73";"0,73";"1,71";"";"";"74,49";"499 310";"";"";""
