"Product";"ASIN";"SKU";"Units";"Refunds";"Sales";"Promo";"Ads";"Sponsored products (PPC)";"Sponsored Display";"Sponsored brands (HSA)";"Sponsored Brands Video";"Google ads";"Facebook ads";"% Refunds";"Sellable Quota";"Refund сost";"Amazon fees";"Cost of Goods";"Shipping";"Gross profit";"Net profit";"Estimated payout";"Expenses";"Margin";"ROI";"BSR";"Real ACOS";"Sessions";"Unit Session Percentage"
"NewEleven Father's Day Gifts For Dad - Birthday Card For Dad From Daughter, Son, Kids - Funny Present For Dads, Bonus Dads On Father's Day, Birthday - Greeting Card COG: 0,44 / Price: 7,99";"B0F59ZP32J";"MM-63UP-STVK";"";"";"";"";"";"";"";"";"";"";"";"";"-";"";"";"";"";"";"";"";"";"";"";"6 341";"";"2";""
"NewEleven Dad Gifts From Daughter - Unique Present, Dad Birthday Gift For Dads, Bonus Dads - Funny Card, Meaningful Gifts For Father - Greeting Card COG: 0,44 / Price: 7,99";"B0F5B2XGXM";"KU-S43M-BXLZ";"";"";"";"";"";"";"";"";"";"";"";"";"-";"";"";"";"";"";"";"";"";"";"";"6 341";"";"1";""
"NewEleven Father's Day Gifts, Dog Dad Gifts For Men, Unique Dads Gift For Father's Day, Cute Fathers Day Card From Dog, Puppy For Men Husband - Greeting Card COG: 0,43 / Price: 7,99";"B0F7LJYVN5";"PU-6IQ0-1725";"";"";"";"";"";"";"";"";"";"";"";"";"-";"";"";"";"";"";"";"";"";"";"";"6 341";"";"3";""
"NewEleven Funny Fathers Day Card, Cat Dad Gifts For Men, Best Cat Dad Ever For Father's Day, Cat Lover Gifts For Men, Unique Cats Father Presents - Greeting Card COG: 0,43 / Price: 7,99";"B0F7LL1VLP";"QJ-K197-WWV2";"";"";"";"";"";"";"";"";"";"";"";"";"-";"";"";"";"";"";"";"";"";"";"";"6 341";"";"2";""
"NewEleven Gift For Grandpa - Meaningful Grandpa Gifts From Granddaughter, Grandson - Grandpa Birthday Gifts For Grandfather, New Granddad, PaPa - Bible Jar COG: 2,62 / Price: 16,98";"B0F7WVKZ6F";"8O-S5PG-85KF";"";"";"";"";"";"";"";"";"";"";"";"";"-";"";"";"";"";"";"";"";"";"";"";"8 731";"";"15";""
"NewEleven Uncle Birthday Gifts - Gift For Uncle, Funcle - Meaningful Present, Birthday Gift For Uncles From Newphew, Niece, Kids - Bible Jar COG: 2,62 / Price: 17,98";"B0F7WYS1R1";"YA-B9EW-YOZ9";"";"";"";"";"";"";"";"";"";"";"";"";"-";"";"";"";"";"";"";"";"";"";"";"8 688";"";"16";""
