"Product";"ASIN";"SKU";"Units";"Refunds";"Sales";"Promo";"Ads";"Sponsored products (PPC)";"Sponsored Display";"Sponsored brands (HSA)";"Sponsored Brands Video";"Google ads";"Facebook ads";"% Refunds";"Sellable Quota";"Refund сost";"Amazon fees";"Cost of Goods";"Shipping";"Gross profit";"Net profit";"Estimated payout";"Expenses";"Margin";"ROI";"BSR";"Real ACOS";"Sessions";"Unit Session Percentage"
"NewEleven Gifts for Women, Gift for Her, Mom, Friends, A Year of Promises of God Bible Scripture Memory Verse Cards Set of 52 - Christian, Religious, Inspirational Gifts for Women COG: 3,5 / Price: 9,98";"B0DQ42YY8T";"GQ-R013-PDDU";"1";"";"9,98";"-0,7";"";"";"";"";"";"";"";"";"-";"";"-5,31";"-3,5";"";"0,47";"0,47";"3,97";"";"4,71";"13,43";"142 156";"";"2";"50,00"
"NewEleven Class Of 2025 Graduation Gifts For Her, Friends - Funny Master Degree, College Graduation Gifts From Friends And Family - 16 Oz Coffee Glass COG: 2,3 / Price: 9,99";"B0DWMZXCZP";"UZ-8P0A-GPKD";"1";"";"11,99";"";"";"";"";"";"";"";"";"";"-";"";"13,01";"-4,6";"";"20,40";"20,40";"25";"";"170,14";"443,48";"121 568";"";"4";"25,00"
"NewEleven Retirement Gift For Woman 2025 - Coworker Leaving Gift, Going Away Gifts For Friends, Her, Mom, Boss - Farewell Gifts For Coworkers Women From Friend, Family And Colleague - 16 Oz Wine Glass COG: 4,83 / Price: 23,98";"B0F13MKH7X";"ML-PHKJ-4KBU";"1";"";"23,98";"";"";"";"";"";"";"";"";"";"-";"";"-9,33";"-4,83";"";"9,82";"9,82";"14,65";"";"40,95";"203,31";"13 549";"";"40";"2,50"
"NewEleven Mothers Day Card, Cat Mom Gifts For Women, Cat Themed Gift, Best Cat Mom Ever For Mother's Day, Best Gifts For Cat Lovers Female, Unique Cats Lady Presents - Greeting Card COG: 0,42 / Price: 7,99";"B0F2TD7W6G";"1N-AZA8-HSBA";"1";"";"7,99";"";"";"";"";"";"";"";"";"";"-";"";"-3,61";"-0,42";"";"3,96";"3,96";"4,38";"";"49,56";"942,86";"47 379";"";"2";"50,00"
"NewEleven Retirement Gifts - Retirement Gift for Woman, Farewell Gift, Goodbye Present for Men, Women - Going Away, Goodbye Gifts for Coworkers - Candle COG: 3,8 / Price: 11,98";"B0F3C9BMFZ";"WY-FHPL-MTWW";"1";"";"11,98";"";"";"";"";"";"";"";"";"";"100";"3,8";"-6,53";"-3,8";"";"5,45";"5,45";"5,45";"";"45,49";"143,42";"76 796";"";"13";"7,69"
"NewEleven Gift For Grandpa - Meaningful Grandpa Gifts From Granddaughter, Grandson - Grandpa Birthday Gifts For Grandfather, New Granddad, PaPa - Bible Jar COG: 2,62 / Price: 16,98";"B0F7WVKZ6F";"8O-S5PG-85KF";"1";"";"16,98";"";"";"";"";"";"";"";"";"";"-";"";"-6,71";"-2,62";"";"7,65";"7,65";"10,27";"";"45,05";"291,98";"18 551";"";"10";"10,00"
"NewEleven Best Friend Birthday Gifts For Women - Best Friend Gift For Her, Him - Bestie Gift, Christian Present From Friends - Decorative Glass Inspirational Scripture Jar with 92 Bible Verse COG: 2,62 / Price: 17,98";"B0F8VPS7QN";"FY-G9UN-GE5E";"1";"";"17,98";"";"";"";"";"";"";"";"";"";"-";"";"-99,93";"-2,62";"";"-84,57";"-84,57";"-81,95";"";"-470,36";"-3 227,86";"18 519";"";"30";"3,33"
"NewEleven Gifts For Grandma - Christian Gift, Nana Gift, Grandma Birthday Gifts From Granddaughter, Grandson, Kids - Decorative Glass Inspirational Scripture Jar with 92 Bible Verse COG: 0 / Price: 17,98";"B0FBQZZK71";"RW-PY02-EIMY";"1";"";"17,98";"";"-16,26";"-16,26";"";"";"";"";"";"";"-";"";"-7,52";"";"";"-5,80";"-5,80";"-5,8";"";"-32,26";"";"18 551";"90,43";"12";"8,33"
"NewEleven Funny Boss Gifts - Appreciaton Card, Boss Birthday Card For Men, Women, Manager - Supervisor Gifts For Women From Coworker, Colleague - Greeting Card COG: 0,39 / Price: 4,99";"B0FC5TLHKZ";"RT-64X6-JD53";"1";"";"4,99";"";"";"";"";"";"";"";"";"";"-";"";"-3,12";"-0,39";"";"1,48";"1,48";"1,87";"";"29,66";"379,49";"3 092";"";"26";"3,85"
"NewEleven Gifts For Mom - Gifts For Mother, Women, Wife - Funny Best Birthday Gift Ideas For Wife, New Mama, Bonus Mama, Mom To Be, Mother In Law - 12 Oz Tumbler COG: 3,76 / Price: 15,98";"B07Y7ZQ265";"F1-10S9-NASK";"";"";"";"";"";"";"";"";"";"";"";"";"-";"";"";"";"";"";"";"";"";"";"";"8 717";"";"11";""
"NewEleven Fathers Day Gift For Dad From Daughter, Son, Kids - Birthday Gift For Dad, Husband, Men - Best Present Idea For Father, Husband, Bonus Father From Daughter, Son, Wife - 20 Oz Tumbler COG:  / Price: 0";"B088GX79HT";"";"";"";"";"";"";"";"";"";"";"";"";"";"-";"";"";"";"";"";"";"";"";"";"";"26 310";"";"5";""
"NewEleven Men's Apron - Black, One Size Fits All, 3 Pockets, Cotton, Funny Gift for Men, Dad, Husband, Him COG: 6,17 / Price: 19,98";"B091F4PHBQ";"EG-GNAW-VPSP";"";"";"";"";"";"";"";"";"";"";"";"";"-";"";"3,95";"-6,17";"";"-2,22";"-2,22";"3,95";"";"";"-35,98";"";"";"";""
"NewEleven Fathers Day Gift For Grandpa From Granddaughter, Grandson - Birthday Present Ideas For Grandfather, New Grampa, Promoted To Grandfather, Grandchildren, Grandkid - 20 Oz Tumbler COG: 4,77 / Price: 19,98";"B094CFGN42";"DW-NMEH-X37K";"";"1";"";"";"";"";"";"";"";"";"";"∞";"-";"-15,78";"";"";"";"-15,78";"-15,78";"-15,78";"";"";"";"26 310";"";"3";""
"NewEleven Retirement Gifts For Woman 2025 - Retired Gift For Coworker Leaving - Farewell, Goodbye Presents For Women, Coworkers, Friends - 20 Oz Tumbler COG: 5,1 / Price: 17,98";"B095S16WV3";"VG-MZ2S-KBWR";"";"";"";"";"";"";"";"";"";"";"";"";"-";"";"";"";"";"";"";"";"";"";"";"30 168";"";"7";""
"NewEleven Gifts For Him, Men - Gift For Men, Women, Dad, Husband, Friend - Thank You Gifts, Appreciation Gift, Graduation Presents For Men, Nurse, Teacher, Boss, Coworker - 20 Oz Tumbler COG: 4,04 / Price: 16,98";"B0978WGWY4";"BJ-VG4K-QQW3";"";"";"";"";"";"";"";"";"";"";"";"";"-";"";"";"";"";"";"";"";"";"";"";"5 474";"";"25";""
"NewEleven Christmas Gift For Dad - Birthday Gifts For Dad From Daughter, Son, Kids - Husband Gifts - Birthday Present Ideas For Father, Husband, New Dad, Bonus Dad From Daughter, Son - 20 Oz Tumbler COG:  / Price: 0";"B097B9SY89";"";"";"";"";"";"";"";"";"";"";"";"";"";"-";"";"";"";"";"";"";"";"";"";"";"26 478";"";"1";""
"NewEleven Bird Watching Gifts, Gifts For Bird Lovers - Gift For Men Women - Funny Birding Gift For Birders, Birds Watchers, Birb Lovers, Men, Women, Friends - 20 Oz Tumbler COG: 4,78 / Price: 22,98";"B09S9PGL4T";"UD-JSC7-HVGH";"";"";"";"";"";"";"";"";"";"";"";"";"-";"";"";"";"";"";"";"";"";"";"";"202 787";"";"1";""
"NewEleven Retirement Gifts For Woman 2025 - Happy Retirement Gifts For Coworker Leaving - Farewell, Goodbye Presents For Women, Coworkers, Friends - 20 Oz Tumbler COG: 4,82 / Price: 19,98";"B09XDFLNR8";"74-78DN-W52B";"";"";"";"";"";"";"";"";"";"";"";"";"100";"4,82";"";"";"";"4,82";"4,82";"";"";"";"";"30 000";"";"6";""
"NewEleven Retirement Gifts For Men Women 2025 - Retirement Party Decorations - Retired Presents For Coworker Leaving, Men, Retired People, Coworkers, Friends - 20 Oz Tumbler COG: 4,48 / Price: 19,98";"B09YCTFXYV";"KG-HY7Y-VD9N";"";"";"";"";"";"";"";"";"";"";"";"";"-";"";"";"";"";"";"";"";"";"";"";"30 000";"";"10";""
"NewEleven Gifts For Sister - Unique Birthday Present For Sisters, Soul Sis, Big, Little Sister, Sisters In Law, Sibling, Bestie - 16 Oz Coffee Glass COG: 2,04 / Price: 15,98";"B0BC8WBYW7";"U3-HSBK-1RJI";"";"";"";"";"";"";"";"";"";"";"";"";"-";"";"";"";"";"";"";"";"";"";"";"54 976";"";"3";""
"NewEleven Gifts For Wife, Her - Wife Gifts From Husband - Gift For Her - Gift Ideas For Women, Bride To Be, Fiancee, Wifey - 16 Oz Coffee Glass COG: 2,92 / Price: 13,99";"B0BDLH8KX3";"47-ZC5Z-3DOW";"";"";"";"";"";"";"";"";"";"";"";"";"-";"";"";"";"";"";"";"";"";"";"";"65 670";"";"10";""
"NewEleven Gifts For Women Friendship - Funny Gifts For Friends Female - Unique Friendship Present For Her, Female, Bestie, Bff, Soul Sister, Work Bestie - 16 Oz Coffee Glass COG: 2,29 / Price: 15,98";"B0BRB5SPYZ";"25-YAS2-RJHI";"";"";"";"";"";"";"";"";"";"";"";"";"-";"";"";"";"";"";"";"";"";"";"";"19 531";"";"10";""
"NewEleven Gifts For Sister - Unique Birthday Present For Soul Sister, Big, Little Sis, Sisters In Law, Sibling, Bestie - 16 Oz Coffee Glass COG: 2,03 / Price: 15,98";"B0BRB6J55H";"OW-SAUE-CM7G";"";"";"";"";"";"";"";"";"";"";"";"";"-";"";"";"";"";"";"";"";"";"";"";"54 976";"";"5";""
"NewEleven Christmas Gifts For Women Friendship - Funny Gifts For Friends Female - Unique Friendship Gift For Women, Friend, Female, Bestie, Bff, Soul Sister, Work Bestie - 16 Oz Coffee Glass COG:  / Price: 0";"B0BRCDZRSP";"";"";"";"";"";"";"";"";"";"";"";"";"";"-";"";"";"";"";"";"";"";"";"";"";"19 531";"";"4";""
"NewEleven Gifts For Sister From Sisters, Brother - Unique Birthday Present, Soul Sister, Big Sis Little Sis, Sisters In Law, Sibling, Bestie - 16 Oz Coffee Glass COG: 2,02 / Price: 15,98";"B0BYCSHGYX";"LB-UB38-W1AN";"";"";"";"";"";"";"";"";"";"";"";"";"-";"";"";"";"";"";"";"";"";"";"";"54 976";"";"1";""
"NewEleven Gifts For Nurse - Nurse Gifts For Women - Caregiver Appreciation Gift, Nursing Student, Nurses Practitioner - RN Gift For Nurses Women - 16 Oz Coffee Glass COG: 2,48 / Price: 9,99";"B0BYDBW7PH";"IP-TZ2U-AFMB";"";"";"";"";"";"";"";"";"";"";"";"";"-";"";"";"";"";"";"";"";"";"";"";"29 348";"";"10";""
"NewEleven Cute Cups With Lids And Straw – Aesthetic Cups – Iced Java Cup, Coffee Tumbler, Glass Tumbler – Galentines Gifts For Women, Java Lover - 16 Oz Coffee Glass COG: 2,86 / Price: 12,34";"B0C1C1F4M4";"Z2-BJ5R-5S3M";"";"";"";"";"";"";"";"";"";"";"";"";"-";"";"";"";"";"";"";"";"";"";"";"19 531";"";"5";""
"NewEleven Penguin Gifts For Women - Penguin Stuff For Pengy Lovers - Cute Funny Birthday Gift, Gift For Women, Best Friend, Sister, Daughter, Coworker - 16 Oz Coffee Glass COG: 2,17 / Price: 14,98";"B0C23Y5ZYH";"TU-6PXW-EYJS";"";"";"";"";"";"";"";"";"";"";"";"";"-";"";"";"";"";"";"";"";"";"";"";"162 228";"";"1";""
"NewEleven Gifts For Her - Cow Gifts For Women - Stuff For Cow Lovers - Cute Funny Birthday Gift For Women, Best Friend, Sister, Daughter, Coworker - 16 Oz Coffee COG: 2,29 / Price: 14,98";"B0C242DYT4";"OX-EHPQ-U3LT";"";"";"";"";"";"";"";"";"";"";"";"";"-";"";"";"";"";"";"";"";"";"";"";"162 228";"";"2";""
"NewEleven Gifts For Sister From Sister, Brother - Unique Birthday Present For Sisters, Soul Sis, Big, Little Sisters, Sis In Law, Sibling, Bestie - 16 Oz Coffee Glass COG: 2,13 / Price: 16,98";"B0C9C5VX7S";"T8-BRCL-CEUK";"";"";"";"";"";"";"";"";"";"";"";"";"-";"";"";"";"";"";"";"";"";"";"";"55 308";"";"9";""
"NewEleven Gifts For Friends, Bestie – Work Bestie Presents For Women Friends - Appreciation Gifts For Coworkers, Unique Present Ideas For Coworker Leaving, Farewell Party – 16 Oz Coffee Glass COG: 2,17 / Price: 14,98";"B0CBJQZCFY";"2D-H3QH-UR6F";"";"";"";"";"";"";"";"";"";"";"";"";"-";"";"";"";"";"";"";"";"";"";"";"19 531";"";"18";""
"NewEleven Gifts For Men, Dad, Husband, Friend - Birthday Gift For Women, Men - Thank You Gifts, Appreciation Gift, Graduation Presents For Men, Nurse, Teacher, Boss, Coworker – 20 Oz Tumbler COG: 3,66 / Price: 16,98";"B0CDLQFJK6";"EH-49BE-XWTF";"";"";"";"";"";"";"";"";"";"";"";"";"-";"";"";"";"";"";"";"";"";"";"";"5 441";"";"15";""
"NewEleven Gifts For Women – Chaos Coordinator Gifts For Women, Boss, Manager, Coworker, Best Friend - Appreciation, Inspirational Gift For Teacher, Nurse, Social Worker – 20 Oz Tumbler COG: 3,87 / Price: 17,98";"B0CFQ4CDD5";"7K-U1QW-2RDX";"";"";"";"";"";"";"";"";"";"";"";"";"-";"";"";"";"";"";"";"";"";"";"";"60 616";"";"5";""
"NewEleven Gifts For Mom, Wife - Gifts For Mom From Daughter, Son, Kids - Unique Birthday Present Ideas For Mother, Wife, New Mama From Daughter, Son, Husband - 20 Oz Tumbler COG: 3,71 / Price: 19,98";"B0CG8NHNWF";"2F-5232-03M8";"";"";"";"";"";"";"";"";"";"";"";"";"-";"";"-13,78";"3,71";"";"-10,07";"-10,07";"-13,78";"";"";"271,43";"5 513";"";"6";""
"NewEleven Valentines Gifts For Wife - Romantic Anniversary Wedding Presents From Husband - Best Ideas For Her, Women - 20 Oz Tumbler COG: 3,65 / Price: 15,98";"B0CHFDJGN6";"OJ-R1SW-8WVI";"";"";"";"";"";"";"";"";"";"";"";"";"-";"";"";"";"";"";"";"";"";"";"";"260 645";"";"1";""
"NewEleven Fathers Day Gift For Dad, Men - Funny Birthday Gifts For Dad, Men, Car Guys - Unique Present Idea For Father, Husband, Uncle, Guys From Daughter, Son, Kids, Wife - 20 Oz Tumbler COG: 3,71 / Price: 14,98";"B0CHJ1V1RR";"0I-V2OD-GO56";"";"";"";"";"";"";"";"";"";"";"";"";"-";"";"";"";"";"";"";"";"";"";"";"5 474";"";"7";""
"NewEleven Gifts For Coworker Friends – Work Bestie Gifts For Women Friendship - Unique Present Ideas For Coworker Leaving, Going Away, Goodbye, Farewell Party – 20 Oz Tumbler COG: 3,57 / Price: 17,98";"B0CHJ3W9SQ";"LA-XF5O-M492";"";"";"";"";"";"";"";"";"";"";"";"";"-";"";"";"";"";"";"";"";"";"";"";"60 406";"";"6";""
"NewEleven Gifts For Mom - Birthday Gifts For Mom From Daughter, Son, Kids, Husband - Wife Gift - Unique Present Ideas For Mother, Mother In Law, Wife, New Mama - 20 Oz Tumbler COG: 3,65 / Price: 19,98";"B0CJX4XSXB";"S8-FINW-47HP";"";"";"";"";"-7,33";"-7,33";"";"";"";"";"";"";"-";"";"";"";"";"-7,33";"-7,33";"-7,33";"";"";"";"5 441";"";"14";""
"NewEleven Birthday Gifts For Men, Women - Funny Gag Gifts Ideas For Dad, Mom, Grandpa, Grandma, Husband, Wife, Uncle, Him - 40th 50th 60th 70th 80th Birthday Gifts For Men Women – 20 Oz Tumbler COG: 3,76 / Price: 16,99";"B0CLYSGX7Q";"OA-DGFL-ZKWU";"";"";"";"";"";"";"";"";"";"";"";"";"-";"";"";"";"";"";"";"";"";"";"";"8 709";"";"7";""
"NewEleven Dad Gifts - Birthday Gifts For Dad From Daughter - Husband Gift - Unique Birthday Present Ideas For Father, Husband, New Papa, Bonus Father From Daughter - 20 Oz Tumbler COG: 3,19 / Price: 15,98";"B0CM5RY3QS";"J7-CYQ3-G6E8";"";"1";"";"";"";"";"";"";"";"";"";"∞";"-";"-11,09";"";"";"";"-11,09";"-11,09";"-11,09";"";"";"";"187 912";"";"6";""
"NewEleven Gifts For Brothers From Sister, Bro - Best Birthday Gift For Big, Little Brother, Siblings, Brothers In Law, Men - 20 Oz Tumbler Navy COG: 3,69 / Price: 19,98";"B0CN926PG1";"1O-O788-ZCZU";"";"";"";"";"";"";"";"";"";"";"";"";"-";"";"";"";"";"";"";"";"";"";"";"246 431";"";"4";""
"NewEleven 40th Birthday Gifts For Men Women - 1984 40th Birthday Decorations - Gift For Men Women Turning 40-40 Year Old Gifts For Man, Woman, Mom, Dad, Wife, Husband - 20 Oz Tumbler COG: 3,9 / Price: 16,98";"B0CN92WPN9";"JS-J748-15DE";"";"";"";"";"";"";"";"";"";"";"";"";"-";"";"-1,53";"";"";"-1,53";"-1,53";"-1,53";"";"";"";"168 467";"";"";""
"NewEleven 50th Birthday Gifts For Men Women - 1974 50th Birthday Decorations - Gifts For Men Women Turning 50-50 Year Old Gift For Man, Woman, Mom, Dad, Wife, Husband - 20 Oz Tumbler COG: 3,65 / Price: 19,98";"B0CN93LZ5M";"RQ-VBDU-6QPJ";"";"1";"";"";"";"";"";"";"";"";"";"∞";"-";"-17,34";"";"";"";"-17,34";"-17,34";"-17,34";"";"";"";"3 056";"";"";""
"NewEleven Fathers Day Gift For Dad, Men - Funny Birthday Gifts For Dad, Men, Car Guys - Unique Present Idea For Father, Papa, Husband, Uncle, Guys From Daughter, Son, Kids, Wife - 20 Oz Tumbler COG: 3,93 / Price: 19,98";"B0CNTFTNT9";"MO-1909-MXZY";"";"";"";"";"";"";"";"";"";"";"";"";"-";"";"";"";"";"";"";"";"";"";"";"5 441";"";"5";""
"NewEleven Gifts For Grandma - Grandma Gifts From Granddaughter, Grandson - Birthday Gift For Grandmother, Nana, Gigi, Mimi, Grammy From Grandchildren, Grandchild - 20 Oz Tumbler COG: 3,62 / Price: 17,98";"B0CQ2K12H3";"RR-GSRH-DCUL";"";"";"";"";"";"";"";"";"";"";"";"";"-";"";"";"";"";"";"";"";"";"";"";"5 441";"";"6";""
"NewEleven Fathers Day Gift For Grandpa - Grandpa Gifts From Granddaughter, Grandson - Unique Birthday Present Ideas For Grandfather, New Granddad, Promoted To Granddad, Grandchildren - 20 Oz Tumbler COG: 3,48 / Price: 19,98";"B0CQ4X98YF";"IW-TRN7-KQLA";"";"";"";"";"";"";"";"";"";"";"";"";"-";"";"";"";"";"";"";"";"";"";"";"5 513";"";"10";""
"NewEleven Fathers Day Gift For Him - Birthday Gifts For Men, Funny Gift For Dad, Husband, Grandpa, Uncle, Old Men - Cool Gifts For Dad From Daughter, Son – 20 Oz Tumbler COG: 3,47 / Price: 19,98";"B0CRDFWF44";"A5-0R5N-261B";"";"";"";"";"";"";"";"";"";"";"";"";"-";"";"";"";"";"";"";"";"";"";"";"5 441";"";"5";""
"NewEleven Gifts For Grandma - Grandmother Birthday Gifts, Gift for Grandma From Granddaughter Grandson - Presents For Nana, Gigi, Mimi, Grammy, New Grandmother - 20 Oz Tumbler COG: 3,5 / Price: 16,98";"B0CRKR75LJ";"XF-QHNV-2YN6";"";"";"";"";"";"";"";"";"";"";"";"";"-";"";"";"";"";"";"";"";"";"";"";"5 441";"";"5";""
"NewEleven 40th Birthday Gifts For Women - 40s Birthday Decorations For Women - 40 Year Old Gifts For Her, Woman, Sister, Mom, Daughter, Best Friend - In My Forties Era Glass - 16 Oz Coffee Glass COG: 2,61 / Price: 15,98";"B0CYPWBV21";"SB-QEC6-U9NU";"";"";"";"";"-13,93";"-13,93";"";"";"";"";"";"";"-";"";"";"";"";"-13,93";"-13,93";"-13,93";"";"";"";"9 309";"";"18";""
"NewEleven Fathers Day Gift For Dad From Daughter Son Kids - Gift For Dad, Father, Step Father - Funny Birthday Gifts For Father - 20 Oz Tumbler COG: 3,38 / Price: 19,98";"B0CZRZTBMT";"DJ-XD9G-NIPY";"";"";"";"";"";"";"";"";"";"";"";"";"-";"";"";"";"";"";"";"";"";"";"";"26 310";"";"2";""
"NewEleven 40th Birthday Gifts Women Men - 1985 40th Birthday Decorations For Men Women - Gifts For Men Women Turning 40-40 Year Old Gift For Man, Woman, Mom, Dad, Wife, Husband - 20 Oz Tumbler COG: 3,43 / Price: 14,98";"B0D1GH6WJ6";"ZV-XJ69-4UIW";"";"";"";"";"";"";"";"";"";"";"";"";"-";"";"";"";"";"";"";"";"";"";"";"20 932";"";"8";""
"NewEleven Gifts For Godmother - Will You Be My Godmother From GodChild - Pregnancy Announcement Gifts For Godmom, Godparents - 16 Oz Coffee Glass COG: 2,58 / Price: 17,98";"B0D2NSHWZK";"J5-EJIM-0Y8E";"";"";"";"";"";"";"";"";"";"";"";"";"-";"";"5,21";"-2,58";"";"2,63";"2,63";"5,21";"";"";"101,94";"40 383";"";"7";""
"NewEleven 21st Birthday Gifts For Women, Her - 2004 Birthday Decorations - 21 Year Old Gifts Ideas For Women, Her, Daughter, Sister, Best Friends - 16 Coffee Glass COG: 3,66 / Price: 16,98";"B0D39T2MVK";"73-AOV6-10DJ";"";"";"";"";"";"";"";"";"";"";"";"";"-";"";"";"";"";"";"";"";"";"";"";"9 314";"";"9";""
"NewEleven Witchy Gifts for Women, Witch Gifts, Witch Stuff, Witch Accessories - Birthday Halloween Presents for Women Witches Wiccan Her Friend Sister Daughter Female - 16 Oz Coffee Glass COG: 2,65 / Price: 15,99";"B0D5YGB4KV";"ZB-3CPZ-WSS8";"";"";"";"";"";"";"";"";"";"";"";"";"-";"";"";"";"";"";"";"";"";"";"";"162 228";"";"1";""
"NewEleven 50th Birthday Gifts For Women, 50th Birthday Decorations, 50 Years Old Gifts For Her, Sister, Mom, Bestie, 1975 Birthday Gift For Women, Fifties Wine Tumbler - 12 Oz Tumbler COG: 3,84 / Price: 16,98";"B0D5YHG24C";"V3-2DHI-A0G1";"";"";"";"";"";"";"";"";"";"";"";"";"-";"";"";"";"";"";"";"";"";"";"";"8 725";"";"10";""
"NewEleven House Warming Gifts, New Home Ornament 2025, Dream Home Presents Ideas for Couple - Welcome Home Gifts, Housewarming Gift New Home, Best Housewarming Gift 2024 - Ceramic Ornament COG: 0,68 / Price: 7,99";"B0D6144Q48";"1Z-298F-OLVI";"";"";"";"";"";"";"";"";"";"";"";"";"-";"";"";"";"";"";"";"";"";"";"";"83 134";"";"1";""
"NewEleven Canvas Book Tote Bag Gifts For Readers, Novel Lovers Gift, Bookish Gifts - Gift For Book Lovers Readers Nerds Bookworm Librarian Women - Bookish Items, Reading Accessories COG: 3,17 / Price: 9,99";"B0D6NQ8KL6";"9K-KRK1-ALN8";"";"";"";"";"";"";"";"";"";"";"";"";"-";"";"";"";"";"";"";"";"";"";"";"178 414";"";"3";""
"NewEleven Teacher Appreciation Gifts - Difference Maker Gift for Friend, Co-Worker, Boss - Motivational, Graduation Gifts for Women - Goodbye Gift for Coworkers - Scented Candle COG: 5,58 / Price: 15,98";"B0D72QM578";"8M-I3B0-E0CI";"";"";"";"";"";"";"";"";"";"";"";"";"-";"";"";"";"";"";"";"";"";"";"";"353 530";"";"1";""
"NewEleven Pregnancy Announcement for Husband Wife Family, Gender Reveal Gifts, Pregnancy Gifts for Expecting Mom, for New Mom, New Dad, New Parents - Ornament COG: 0,9 / Price: 7,99";"B0D72Z4996";"FB-GMDU-EXTV";"";"";"";"";"";"";"";"";"";"";"";"";"-";"";"";"";"";"";"";"";"";"";"";"83 423";"";"7";""
"NewEleven Nativity Christmas Ornaments 2024 - Nativity Scene Ceramic Ornaments for Christmas Tree - The Birth of Jesus Decoration - Religious Gift for Christians, Women, Friends, and Family COG: 0,96 / Price: 11,99";"B0D7MXCGWM";"ZO-U3PO-EZI9";"";"";"";"";"";"";"";"";"";"";"";"";"-";"";"";"";"";"";"";"";"";"";"";"1 757 184";"";"1";""
"NewEleven Baby's First Christmas Ornament 2024 - Baby Picture Frame Newborn Gift, First Time Parents Present, Family of Three First for New Parents - Double-Sided Printing Photo Frame Ornament COG: 1,34 / Price: 7,99";"B0D7MXLVWS";"4J-GBRB-06UY";"";"";"";"";"";"";"";"";"";"";"";"";"-";"";"";"";"";"";"";"";"";"";"";"574 064";"";"2";""
"NewEleven Retirement Candle - Funny Retirement Gift for Woman - Retired Gift Idea for Mom, Nurse, Teacher, Coworker & Friends - Scented Candle COG: 4,66 / Price: 15,98";"B0D831XY4Y";"8G-IBWS-BHP3";"";"";"";"";"";"";"";"";"";"";"";"";"-";"";"";"";"";"";"";"";"";"";"";"352 176";"";"3";""
"NewEleven Gifts for Coworkers - Appreciation Present, Coworker Ornament - Christmas Tree Decoration Present for Colleagues, Leader, Office, Friends - Christmas Ornament COG: 1,53 / Price: 5,99";"B0DG8Y15PG";"RM-BKTR-DA1N";"";"";"";"";"";"";"";"";"";"";"";"";"-";"";"";"";"";"";"";"";"";"";"";"360 915";"";"3";""
"NewEleven 2024 Christmas Ornament, 2024 Year in Review Ornaments, Memorable 2024 Christmas Decor Gifts, Decorative Gifts for Friends, Coworker, Family - Ceramic Ornaments COG: 1,12 / Price: 5,99";"B0DH7VZ4CY";"TZ-P3U6-QGEY";"";"";"";"";"";"";"";"";"";"";"";"";"-";"";"";"";"";"";"";"";"";"";"";"359 915";"";"1";""
"NewEleven 50th Birthday Gifts For Men Women - 1975 50th Birthday Decorations For Him Her - Present For Men Women Turning 50 Year Old Gifts For Mom, Dad, Wife, Husband - 20 Oz Tumbler COG: 3,45 / Price: 21,98";"B0DH83T7MF";"RP-GISO-TOFC";"";"";"";"";"-10";"-10";"";"";"";"";"";"";"-";"";"";"";"";"-10,00";"-10,00";"-10";"";"";"";"8 717";"";"22";""
"NewEleven 60th Birthday Gifts For Men Women - 1965 60th Birthday Decorations For Him Her - Turning 60 Year Old Gifts For Man, Woman, Mom, Dad, Wife, Husband - 20 Oz Tumbler COG: 3,35 / Price: 21,98";"B0DHCFTYVW";"06-AGXV-L5EK";"";"";"";"";"";"";"";"";"";"";"";"";"-";"";"";"";"";"";"";"";"";"";"";"8 717";"";"7";""
"NewEleven Coworker Ornaments, Christmas Ornament Gifts for Coworkers - Coworker Gift for Women, Present for Coworkers, Friendship Presents for Work Bestie - Christmas Decorations COG: 1,1 / Price: 7,99";"B0DJXTHGW2";"MF-4MWG-A4QS";"";"";"";"";"";"";"";"";"";"";"";"";"-";"";"";"";"";"";"";"";"";"";"";"359 915";"";"1";""
"NewEleven Sister 2025, Sister Birthday Gifts for Women, Big Sister Gifts for Girls - Gift for Women, Soul Sister, BFF, Big Sister Gift Glass Christmas Ornaments COG: 2 / Price: 5,99";"B0DJXZ36VG";"O2-5UU0-154U";"";"";"";"";"";"";"";"";"";"";"";"";"-";"";"";"";"";"";"";"";"";"";"";"604 245";"";"3";""
"NewEleven Gifts for Friends, BFF, Coworker for Women, Appreciation Gifts, Thank You for Women - Best Friend Birthday Gift - Glass Christmas Ornament 2025 COG: 2 / Price: 7,99";"B0DJY2BVJB";"R8-Q5WC-138Q";"";"";"";"";"";"";"";"";"";"";"";"";"-";"";"";"";"";"";"";"";"";"";"";"604 245";"";"4";""
"NewEleven Thank You Gifts for Women, Nurses, Teacher, Coworker, Friends - Gift for Women, Appreciation Present for Coworkers, Farewell, BFF, Woman, Men - Glass Christmas Ornaments COG: 1,9 / Price: 5,99";"B0DJY7689G";"2F-J6P4-R5IG";"";"";"";"";"";"";"";"";"";"";"";"";"-";"";"";"";"";"";"";"";"";"";"";"359 915";"";"2";""
"NewEleven Birthday Gifts for Women, Inspirational Gift, Little Reminder, Unique Present for Women, Encouragement Gift, Teacher Appreciation Gifts - Ceramic Christmas Ornaments COG: 0,93 / Price: 9,99";"B0DJYC5Y9Q";"9V-TCLV-MOMR";"";"";"";"";"";"";"";"";"";"";"";"";"-";"";"";"";"";"";"";"";"";"";"";"604 245";"";"1";""
"NewEleven 60th Birthday Gifts for Women, Fabulous 60th Birthday Ornaments Gifts Keepsake, Fun 60 Birth Presents Idea for Women - Ceramic Christmas Ornament COG: 0,9 / Price: 9,99";"B0DJYD117Z";"WR-VKLM-UV1J";"";"";"";"";"";"";"";"";"";"";"";"";"-";"";"";"";"";"";"";"";"";"";"";"2 979 849";"";"1";""
"NewEleven Baptism Gifts for Girl & Boy, Decorations Ornament, Baby Dedication & Godchild Gift - Ceramic Christmas Ornaments COG: 0,95 / Price: 5,99";"B0DK11YCP5";"EF-QF2X-QCI3";"";"";"";"";"";"";"";"";"";"";"";"";"-";"";"";"";"";"";"";"";"";"";"";"675 926";"";"2";""
"NewEleven Retirement Ornament, Funny Retired Gift for Woman Men, Retired Gifts for Women Mom Nurses Teacher Coworker Friends, Christmas Tree Decorations, First Retirement Christmas Ornament 2024 COG: 1,15 / Price: 5,99";"B0DK12WRBS";"48-I2ID-D1NR";"";"";"";"";"";"";"";"";"";"";"";"";"-";"";"";"";"";"";"";"";"";"";"";"675 926";"";"1";""
"NewEleven for Women, Friend Gifts for Women, for Woman - Best Friend Birthday Presents for Woman, BFF, Bestie, Soul Sister Gifts - Christmas Ornaments COG: 0,92 / Price: 4,99";"B0DK14C5XC";"VV-WPUX-6TUE";"";"";"";"";"";"";"";"";"";"";"";"";"-";"";"";"";"";"";"";"";"";"";"";"604 245";"";"1";""
"NewEleven Christmas Decorations Indoor - Family Christmas Ornaments 2025 for Mom, Dad, Sister, Brother - Funny Ceramic Tree Décor COG: 0,9 / Price: 5,99";"B0DK155YN3";"MW-Y980-J1MX";"";"";"";"";"";"";"";"";"";"";"";"";"-";"";"";"";"";"";"";"";"";"";"";"359 915";"";"1";""
"NewEleven Teacher Appreciation Christmas Ornament 2025 - Gift for Women, End of Year from Student, Retirement - Ceramic COG: 0,9 / Price: 7,99";"B0DK15Y5WB";"RN-DVIA-IJDI";"";"";"";"";"";"";"";"";"";"";"";"";"-";"";"";"";"";"";"";"";"";"";"";"679 766";"";"1";""
"NewEleven Women - Friend Gifts Ornaments 2025 - Friendship Gifts for Friends, Birthday Gift for Women, Besties, Soul Sisters - Ceramic Christmas Ornaments COG: 0,91 / Price: 4,99";"B0DK16MCXG";"JC-JJYR-OWD3";"";"";"";"";"";"";"";"";"";"";"";"";"-";"";"";"";"";"";"";"";"";"";"";"359 915";"";"7";""
