"Product";"ASIN";"SKU";"Units";"Refunds";"Sales";"Promo";"Ads";"Sponsored products (PPC)";"Sponsored Display";"Sponsored brands (HSA)";"Sponsored Brands Video";"Google ads";"Facebook ads";"% Refunds";"Sellable Quota";"Refund сost";"Amazon fees";"Cost of Goods";"Shipping";"Gross profit";"Net profit";"Estimated payout";"Expenses";"Margin";"ROI";"BSR";"Real ACOS";"Sessions";"Unit Session Percentage"
"NewEleven Gifts for Women, Friendship, Friends, Birthday Gift for Friends Female BFF Old Best Friends, Best Friend Ornament, Bestie Ornament COG: 0,93 / Price: 7,99";"B0DK2YP1FB";"JR-LLGY-N975";"";"";"";"";"";"";"";"";"";"";"";"";"-";"";"";"";"";"";"";"";"";"";"";"359 915";"";"3";""
"NewEleven for Mom - Gifts for Mama Birthday, Christmas - Birthday Gifts for Mother from Daughter, Son, Child - New Mother Gift, Mom to Be Gift - Ceramic Christmas Ornaments COG: 1,19 / Price: 6,99";"B0DLV94K7D";"LS-GUGX-Z9QL";"";"";"";"";"";"";"";"";"";"";"";"";"-";"";"";"";"";"";"";"";"";"";"";"83 134";"";"1";""
"NewEleven Gifts for Her - Inspirational Ornaments - Thank You Gift, Appreciation Present for Men, Nurse, Teacher, Boss, Coworker - Christmas Tree Decoration Glass Ornament COG: 2,17 / Price: 7,99";"B0DLV9V243";"2G-KSK7-6N0O";"";"";"";"";"";"";"";"";"";"";"";"";"-";"";"";"";"";"";"";"";"";"";"";"361 857";"";"2";""
"NewEleven Godmother Gifts for Christmas, Godmom Proposal Gift - Will You Be My Godmother - Mom Present from Godchild - Christmas Ornament 2025 COG: 0,94 / Price: 4,99";"B0DLVRTFN9";"64-SAL7-XCWT";"";"";"";"";"";"";"";"";"";"";"";"";"-";"";"";"";"";"";"";"";"";"";"";"570 916";"";"1";""
"NewEleven Retirement Ornament - Funny Retirement Gifts for Woman - Christmas Tree Decoration for Mom, Nurse, Teacher, Coworker & Friends COG: 2,17 / Price: 7,99";"B0DLVS7R7V";"O5-LD0Y-FJ4W";"";"";"";"";"";"";"";"";"";"";"";"";"-";"";"";"";"";"";"";"";"";"";"";"359 915";"";"2";""
"NewEleven Galentines Gifts for Friends, Book Ornament for Book Lovers - Book Lovers Gifts, for Readers, Nerd Gift - Glass Christmas Ornaments COG: 2,06 / Price: 5,99";"B0DLVSQM66";"89-VBMR-N64I";"";"";"";"";"";"";"";"";"";"";"";"";"-";"";"";"";"";"";"";"";"";"";"";"577 312";"";"1";""
"NewEleven Gifts For Him, Her - Valentines' Day Gifts for Men, Women, Boyfriend, Girlfriend, Husband, Wife, Birthday, Couple Presents for Him, Her - 14 Oz Self Stirring Mug COG: 8,66 / Price: 15,99";"B0DQ56WTWZ";"Y2-ATI0-B7OL";"";"";"";"";"";"";"";"";"";"";"";"";"-";"";"2,75";"-8,66";"";"-5,91";"-5,91";"2,75";"";"";"-68,24";"334 599";"";"";""
"NewEleven Engagement Gifts for Couples 2025 - Gift for Newly Engaged Couples, Happy Engagement Gifts for Her, Women, Friends, Bride to Be Gift, Glass Christmas Ornaments COG: 2,1 / Price: 9,99";"B0DR1SNKVX";"4L-EMQE-OQ2Y";"";"";"";"";"";"";"";"";"";"";"";"";"-";"";"";"";"";"";"";"";"";"";"";"83 134";"";"2";""
"NewEleven Teacher Appreciation Gifts For Women, Thank You Gift for Teachers, Inspirational School Teacher Gifts from Students for Birthday, Retirement, Bible Jar For Teachers with 92 Bible Verses COG: 2,33 / Price: 17,98";"B0DVSJLHZN";"W1-8IDB-BZ73";"";"";"";"";"";"";"";"";"";"";"";"";"100";"2,33";"8,75";"";"";"11,08";"11,08";"8,75";"";"";"";"18 551";"";"8";""
"NewEleven Nurse Gifts For Women, Nursing Student, Nurses Practitioner, Registered Nurse - Gifts For Nurses From Friend, Family And Coworker - 16 Oz Coffee Glass COG: 2,43 / Price: 9,99";"B0DWN3SH33";"C0-X5FU-OU85";"";"";"";"";"";"";"";"";"";"";"";"";"-";"";"";"";"";"";"";"";"";"";"";"29 338";"";"8";""
"NewEleven Gift For Teachers - Teacher Appreciation Gifts For Women, New Teachers - Teacher Gifts For Women From Student, Friends, Family And Coworker - 20 Oz Tumbler COG: 3,42 / Price: 12,98";"B0DYDZFRZD";"4E-EG59-NN41";"";"";"";"";"-25,53";"-25,53";"";"";"";"";"";"";"-";"";"";"";"";"-25,53";"-25,53";"-25,53";"";"";"";"60 406";"";"19";""
"NewEleven Birthday Gifts for Dad from Daughter, Son, Wife - First Time Present for Father, Men, Girl Dads Hat - Trucker Hat COG: 2,67 / Price: 17,98";"B0DYJ45P7Q";"QF-PTRY-DG2W";"";"";"";"";"";"";"";"";"";"";"";"";"-";"";"";"";"";"";"";"";"";"";"";"155 553";"";"6";""
"NewEleven Daughter Birthday Gifts - Gifts For Daughter, Daughters In Law - Daughters Birthday Gift Ideas From Mom, Dad - Decorative Glass Scripture Jar With 92 Bible Verse COG: 2,44 / Price: 17,98";"B0F13VCCMP";"CG-9LUS-K14G";"";"";"";"";"-6,6";"-6,6";"";"";"";"";"";"";"-";"";"";"";"";"-6,60";"-6,60";"-6,6";"";"";"";"18 551";"";"66";""
"NewEleven Gifts For Brother - Brother Birthday Gifts For Big, Little Brothers, Siblings, Bro In Law - Funny Brothers Gift From Sister, Bro - 20 Oz Tumbler COG: 3,42 / Price: 16,98";"B0F17BH4MM";"I2-7HVI-3WQ3";"";"";"";"";"";"";"";"";"";"";"";"";"-";"";"";"";"";"";"";"";"";"";"";"90 076";"";"1";""
"NewEleven Fathers Day Gift For Dad - Funny Present For Father, Men - Dad Birthday Gift, Unique Father Gifts From Daughter, Son, Kid, Wife - 20 Oz Tumbler Navy COG: 3,5 / Price: 16,98";"B0F17F23MZ";"R8-7X5D-8W4W";"";"";"";"";"";"";"";"";"";"";"";"";"-";"";"";"";"";"";"";"";"";"";"";"89 665";"";"3";""
"NewEleven Uncle Birthday Gifts - Funny Uncle Gifts From Niece, Newphew, Kids - Fathers Day Gift, Unique Uncles Present, Best Present For Uncles - 20 Oz Tumbler COG: 0 / Price: 14,98";"B0F17GLNKP";"EK-W8MY-0MBR";"";"";"";"";"";"";"";"";"";"";"";"";"-";"";"";"";"";"";"";"";"";"";"";"89 665";"";"1";""
"NewEleven Grandpa Gifts - Fathers Day Gift For Grandpa, Birthday Gifts For Grandfather, Papa - Grandfather Gift Ideas From Granddaughter, Grandson, Kids - 20 Oz Tumbler COG: 3,42 / Price: 16,98";"B0F17MLPQ4";"M0-BMOU-WK4K";"";"";"";"";"";"";"";"";"";"";"";"";"-";"";"";"";"";"";"";"";"";"";"";"89 665";"";"2";""
"NewEleven Gifts For Dad - Funny Present For Father, Men - Dad Birthday Gift, Unique Father Gifts From Daughter, Son, Kid, Wife - 20 Oz Tumbler Black COG:  / Price: 0";"B0F1FWGNH8";"";"";"";"";"";"";"";"";"";"";"";"";"";"-";"";"";"";"";"";"";"";"";"";"";"90 076";"";"1";""
"NewEleven Birthday Gifts For Mom, Gifts For Mom From Daughter, Birthday Card For Mommy - Cool Mothers From Daughter, Son, Kids - Greeting Card COG: 0,42 / Price: 4,99";"B0F2T9H9W8";"IH-G19E-BA1G";"";"";"";"";"";"";"";"";"";"";"";"";"-";"";"";"";"";"";"";"";"";"";"";"1 863";"";"1";""
"NewEleven Funny Gifts For Mom, Mothers Day Card For Mom From Daughter, Kids On Mother's Day - Funny Mothers Day Gifts, Birthday Present, Humorous Greeting Cards For Mother COG: 0,42 / Price: 7,99";"B0F2TC6CP7";"GI-HLHH-RG89";"";"";"";"";"";"";"";"";"";"";"";"";"-";"";"";"";"";"";"";"";"";"";"";"8 415";"";"8";""
"NewEleven Birthday Gifts For Mom, Card For Mom From Daughter, Son, Kids - Funny Mother Birthday Gifts, Humorous Greeting Cards For Mothers, Mother in Law COG: 0,42 / Price: 7,99";"B0F2TDKZ4N";"UI-34PP-1D37";"";"";"";"";"";"";"";"";"";"";"";"";"-";"";"";"";"";"";"";"";"";"";"";"47 102";"";"1";""
"NewEleven Mothers Day Card, Dog Mom Gifts For Women, Unique Moms Gift For Mother's Day, Cute Dog Mom Mother's Day Cards From Dogs, Puppy For Her Womens - Greeting Card COG: 0,42 / Price: 5,99";"B0F2TF1PWV";"EE-SVW5-ID5N";"";"";"";"";"";"";"";"";"";"";"";"";"100";"0,42";"";"";"";"0,42";"0,42";"";"";"";"";"47 102";"";"1";""
"NewEleven Birthday Card For Dad - Fathers Day Gift, Dad Gifts From Daughter, Son, Wife - Funnny Present, Dads Gift Idea For Bonus Dads, Father, Father In Law - Greeting Card COG: 0,44 / Price: 7,99";"B0F59S8H6T";"IA-GG14-LH7P";"";"";"";"";"";"";"";"";"";"";"";"";"-";"";"";"";"";"";"";"";"";"";"";"8 415";"";"2";""
"NewEleven Gifts For Dad - Fathers Day Card For Dad, Birthday Present For Dads, Bonus Dads - Fathers Day Card From Daughter, Son, Kid, Wife - Humorous Greeting Card COG: 0,44 / Price: 4,99";"B0F59S997T";"F0-2QAC-J9UH";"";"";"";"";"";"";"";"";"";"";"";"";"-";"";"";"";"";"";"";"";"";"";"";"8 436";"";"1";""
"NewEleven Birthday Card For Dad - Fathers Day Gift, Heartfelt Present For Dads, Bonus Dads, Father In Law - Dad Birthday Gift From Daughter, Son, Kid, Wife - Greeting Card COG: 0,44 / Price: 7,99";"B0F59VGXBY";"4N-OLIJ-V92Z";"";"";"";"";"";"";"";"";"";"";"";"";"-";"";"";"";"";"";"";"";"";"";"";"8 415";"";"9";""
"NewEleven Husband Gift - Romantic Gifts, Father's Day Gifts For Husband From Wife - Unique Present, Heartfelt Message, Fathers Day Card For Husbands - Greeting Card COG: 0,44 / Price: 7,99";"B0F59VYMYR";"4N-UKMX-U3ON";"";"";"";"";"";"";"";"";"";"";"";"";"-";"";"";"";"";"";"";"";"";"";"";"47 102";"";"1";""
"NewEleven Dad Birthday Gift - Meaningful Present For Dads, Bonus Dads - Cute Dad Birthday Card, Fathers Day Card From Son, Daughter, Favorite Kids - Greeting Card COG: 0,44 / Price: 7,99";"B0F59X5XB6";"BQ-8IHB-2PJV";"";"1";"";"";"";"";"";"";"";"";"";"∞";"100";"-10,93";"";"";"";"-10,93";"-10,93";"-11,37";"";"";"";"8 436";"";"3";""
"NewEleven Gifts For Son - Meaningful Fathers Day Card For Son From Mom And Dad - Unique Present, Heartfelt Messeage, Father's Day Gifts For Sons, Dad First Time - Greeting Card COG: 0,44 / Price: 7,99";"B0F59X7WSH";"H2-9Z1Y-AGEF";"";"";"";"";"";"";"";"";"";"";"";"";"-";"";"";"";"";"";"";"";"";"";"";"8 415";"";"5";""
"NewEleven Dad Birthday Gift For Dad, Bonus Dads - Fathers Day Card, Unique Present, Heartfelt Messesage For Father From Daughter, Son, Kids - Greeting Card COG: 0,44 / Price: 7,99";"B0F59XTYB6";"45-R2A7-EGYZ";"";"";"";"";"";"";"";"";"";"";"";"";"-";"";"";"";"";"";"";"";"";"";"";"8 415";"";"2";""
"NewEleven Dad Gifts - Gifts For Dad From Daughter, Son, Kid, Wife - Heartfelt Message, Fathers Day Card For Dads, Bonus Das, Step Father - Greeting Card COG: 0,44 / Price: 7,99";"B0F59Y459Y";"RZ-9XXR-XH01";"";"";"";"";"";"";"";"";"";"";"";"";"-";"";"";"";"";"";"";"";"";"";"";"8 436";"";"5";""
"NewEleven Dad Birthday Card - Gifts For Dad From Daughter, Son, Kid - Father's Day Gift Idea For Dads, Bonus Dads - Humorous Greeting Card COG: 0,44 / Price: 7,99";"B0F59YJV71";"50-79MF-SYWH";"";"";"";"";"";"";"";"";"";"";"";"";"-";"";"";"";"";"";"";"";"";"";"";"8 383";"";"5";""
"NewEleven Grandpa Gifts - Grandpa Birthday Gifts, Gift For Grandparents From Kids, Child - Birthday Gift, Heartfelt Message, Fathers Day Card For Grandpa, Papa - Greeting Card COG: 0,44 / Price: 7,99";"B0F59Z29ZR";"OQ-C9LE-D894";"";"";"";"";"";"";"";"";"";"";"";"";"-";"";"";"";"";"";"";"";"";"";"";"8 415";"";"5";""
"NewEleven Gifts For Dad - Dad Birthday Card, Funny Present, Fathers Day Card For Dads From Daughter, Son, Kids - Unique Birthday, Father's Day Gift - Humorous Greeting Cards COG: 0,44 / Price: 7,99";"B0F5B1ZFQW";"92-DVSY-QP6W";"";"";"";"";"";"";"";"";"";"";"";"";"-";"";"";"";"";"";"";"";"";"";"";"8 415";"";"4";""
"NewEleven Father's Day Gifts, Dog Dad Gifts For Men, Unique Dads Gift For Father's Day, Cute Fathers Day Card From Dog, Puppy For Men Husband - Greeting Card COG: 0,43 / Price: 7,99";"B0F7LJYVN5";"PU-6IQ0-1725";"";"";"";"";"";"";"";"";"";"";"";"";"-";"";"";"";"";"";"";"";"";"";"";"47 379";"";"1";""
"NewEleven Dog Dad Gifts For Men - Humorous Present, Cute Birthday Gifts For Dog Lovers, Husband, Him - Funny Dog Dad Card From Friend, Family - Greeting Card COG: 0,39 / Price: 6,99";"B0FC5TBFWB";"60-KN47-M9LV";"";"";"";"";"";"";"";"";"";"";"";"";"-";"";"";"";"";"";"";"";"";"";"";"8 383";"";"9";""
