"Product";"ASIN";"SKU";"Units";"Refunds";"Sales";"Promo";"Ads";"Sponsored products (PPC)";"Sponsored Display";"Sponsored brands (HSA)";"Sponsored Brands Video";"Google ads";"Facebook ads";"% Refunds";"Sellable Quota";"Refund сost";"Amazon fees";"Cost of Goods";"Shipping";"Gross profit";"Net profit";"Estimated payout";"Expenses";"Margin";"ROI";"BSR";"Real ACOS";"Sessions";"Unit Session Percentage"
"NewEleven 40th Birthday Gifts for Men Women - 1984 40 Year Old Gifts for Men, Women, Dad, Mom, Husband, Wife - Retro Trucker Hat COG:  / Price: 0";"B0CM5RLDXX";"";"";"";"";"";"";"";"";"";"";"";"";"";"-";"";"";"";"";"";"";"";"";"";"";"171 049";"";"1";""
"NewEleven Dad Gifts - Birthday Gifts For Dad From Daughter - Husband Gift - Unique Birthday Present Ideas For Father, Husband, New Papa, Bonus Father From Daughter - 20 Oz Tumbler COG: 3,19 / Price: 15,98";"B0CM5RY3QS";"J7-CYQ3-G6E8";"";"";"";"";"";"";"";"";"";"";"";"";"-";"";"";"";"";"";"";"";"";"";"";"10 946";"";"5";""
"NewEleven 60th Birthday Gifts For Women, Her - Vintage 1964 60th Birthday Decorations For Women - 60 Year Old Present Ideas For Wife, Mom, Grandma, Friends, Female - 16 Oz Wine Glass COG: 4,6 / Price: 19,98";"B0CM5SQT4T";"E3-HD9J-GXWE";"";"";"";"";"";"";"";"";"";"";"";"";"-";"";"";"";"";"";"";"";"";"";"";"45 626";"";"8";""
"NewEleven 50th Birthday Gifts for Men Women - 1974 Birthday Decorations for Men Women - Gifts for Turning 50-50 Year Old Gifts for Man, Woman, Mom, Dad, Wife, Husband - Retro Trucker Hat COG: 2,52 / Price: 14,99";"B0CM5T2F1V";"4Q-CVN5-SRBD";"";"";"";"";"";"";"";"";"";"";"";"";"-";"";"";"";"";"";"";"";"";"";"";"169 867";"";"5";""
"NewEleven Gifts For Brothers From Sister, Bro - Best Birthday Gift For Big, Little Brother, Siblings, Brothers In Law, Men - 20 Oz Tumbler Navy COG: 3,69 / Price: 19,98";"B0CN926PG1";"1O-O788-ZCZU";"";"";"";"";"";"";"";"";"";"";"";"";"-";"";"";"";"";"";"";"";"";"";"";"10 946";"";"5";""
"NewEleven 50th Birthday Gifts For Men Women - 1974 50th Birthday Decorations - Gifts For Men Women Turning 50-50 Year Old Gift For Man, Woman, Mom, Dad, Wife, Husband - 20 Oz Tumbler COG: 4,1 / Price: 18,98";"B0CN93621G";"8D-V9PG-OCNF";"";"";"";"";"";"";"";"";"";"";"";"";"-";"";"";"";"";"";"";"";"";"";"";"6 843";"";"6";""
"NewEleven 50th Birthday Gifts For Men Women - 1974 50th Birthday Decorations - Gifts For Men Women Turning 50-50 Year Old Gift For Man, Woman, Mom, Dad, Wife, Husband - 20 Oz Tumbler COG: 3,65 / Price: 19,98";"B0CN93LZ5M";"RQ-VBDU-6QPJ";"";"";"";"";"";"";"";"";"";"";"";"";"-";"";"";"";"";"";"";"";"";"";"";"2 384";"";"12";""
"NewEleven Fathers Day Gift For Dad, Men - Funny Birthday Gifts For Dad, Men, Car Guys - Unique Present Idea For Father, Papa, Husband, Uncle, Guys From Daughter, Son, Kids, Wife - 20 Oz Tumbler COG: 3,93 / Price: 19,98";"B0CNTFTNT9";"MO-1909-MXZY";"";"";"";"";"";"";"";"";"";"";"";"";"-";"";"";"";"";"";"";"";"";"";"";"2 206";"";"3";""
"NewEleven Gifts For Grandma - Grandma Gifts From Granddaughter, Grandson - Birthday Gift For Grandmother, Nana, Gigi, Mimi, Grammy From Grandchildren, Grandchild - 20 Oz Tumbler COG: 3,62 / Price: 17,98";"B0CQ2K12H3";"RR-GSRH-DCUL";"";"";"";"";"";"";"";"";"";"";"";"";"-";"";"";"";"";"";"";"";"";"";"";"2 206";"";"4";""
"NewEleven Gifts For Grandma - Grandmother Birthday Gifts, Gift for Grandma From Granddaughter Grandson - Presents For Nana, Gigi, Mimi, Grammy, New Grandmother - 20 Oz Tumbler COG: 3,5 / Price: 16,98";"B0CRKR75LJ";"XF-QHNV-2YN6";"";"";"";"";"";"";"";"";"";"";"";"";"-";"";"";"";"";"";"";"";"";"";"";"2 206";"";"7";""
"NewEleven Gifts For Aunt From Niece, Nephew - Cool Gifts For Aunt, New Aunts, Sister - Aunts Birthday Gift, Auntie Announcement, Promoted To Auntie, Best Aunties Ever - 20 Oz Tumbler COG: 3,56 / Price: 14,98";"B0CWTR4RFZ";"KH-DRF5-O4UX";"";"";"";"";"";"";"";"";"";"";"";"";"-";"";"";"";"";"";"";"";"";"";"";"10 946";"";"4";""
"NewEleven Fathers Day Gift For Dad, Men - Funny Birthday Gifts For Father, Husband - Gifts For Father, New Dad, Bonus Papa, Husband, Uncle From Daughter, Son Mug with Lid - 14 Oz Tumbler COG: 4,17 / Price: 22,98";"B0CXXG46HR";"TF-FGX1-1AVQ";"";"";"";"";"";"";"";"";"";"";"";"";"-";"";"";"";"";"";"";"";"";"";"";"2 206";"";"9";""
"NewEleven Gifts For Him, Men - Fishing Gifts For Men, Dad, Cup Gift For Fisherman, Father - Dad Birthday Gift From Wife, Kids - 20 Oz Tumbler COG: 3,41 / Price: 17,98";"B0CY4HY9KC";"KK-1KUK-ZBSZ";"";"1";"";"";"";"";"";"";"";"";"";"∞";"100";"-17,57";"";"";"";"-17,57";"-17,57";"-20,98";"";"";"";"10 946";"";"5";""
"NewEleven Birthday Gifts for Women, Funny Present for Best Friend Women - My Last Nerve Candle - Unique Birthday Gifts for Woman, Her, Mom, BFF, Sister - 10 Oz Candle COG: 4,3 / Price: 9,49";"B0CYSGX6DF";"U2-T22R-L5YH";"";"";"";"";"";"";"";"";"";"";"";"";"-";"";"";"";"";"";"";"";"";"";"";"215 126";"";"1";""
"NewEleven 40th Birthday Gifts Women Men - 1985 40th Birthday Decorations For Men Women - Gifts For Men Women Turning 40-40 Year Old Gift For Man, Woman, Mom, Dad, Wife, Husband - 20 Oz Tumbler COG: 3,43 / Price: 14,98";"B0D1GH6WJ6";"ZV-XJ69-4UIW";"";"";"";"";"";"";"";"";"";"";"";"";"-";"";"";"";"";"";"";"";"";"";"";"17 883";"";"6";""
"NewEleven Gifts For Teacher - Teacher Gifts For Women - Teachers Appreciation, Retirement, Graduation Presents - End Of Year Teachers Gift From Student - 16 Oz Coffee Glass COG: 3,53 / Price: 12,99";"B0D1GHNG9D";"DQ-DU5J-C7CQ";"";"";"";"";"";"";"";"";"";"";"";"";"-";"";"";"";"";"";"";"";"";"";"";"104 364";"";"2";""
"NewEleven 21st Birthday Gifts For Women, Her - 2004 Birthday Decorations - 21 Year Old Gifts Ideas For Women, Her, Daughter, Sister, Best Friends - 16 Coffee Glass COG: 3,66 / Price: 16,98";"B0D39T2MVK";"73-AOV6-10DJ";"";"";"";"";"";"";"";"";"";"";"";"";"-";"";"";"";"";"";"";"";"";"";"";"8 917";"";"3";""
"NewEleven Witchy Gifts for Women, Witch Gifts, Witch Stuff, Witch Accessories - Birthday Halloween Presents for Women Witches Wiccan Her Friend Sister Daughter Female - 16 Oz Coffee Glass COG: 2,65 / Price: 15,99";"B0D5YGB4KV";"ZB-3CPZ-WSS8";"";"";"";"";"";"";"";"";"";"";"";"";"-";"";"";"";"";"";"";"";"";"";"";"108 588";"";"2";""
"NewEleven 50th Birthday Gifts For Women, 50th Birthday Decorations, 50 Years Old Gifts For Her, Sister, Mom, Bestie, 1975 Birthday Gift For Women, Fifties Wine Tumbler - 12 Oz Tumbler COG: 3,84 / Price: 16,98";"B0D5YHG24C";"V3-2DHI-A0G1";"";"";"";"";"";"";"";"";"";"";"";"";"-";"";"";"";"";"";"";"";"";"";"";"6 843";"";"5";""
"NewEleven House Warming Gifts, New Home Ornament 2025, Dream Home Presents Ideas for Couple - Welcome Home Gifts, Housewarming Gift New Home, Best Housewarming Gift 2024 - Ceramic Ornament COG: 0,68 / Price: 7,99";"B0D6144Q48";"1Z-298F-OLVI";"";"";"";"";"";"";"";"";"";"";"";"";"-";"";"2,32";"-0,68";"";"1,64";"1,64";"2,32";"";"";"241,18";"67 029";"";"2";""
"NewEleven Gifts New Home - Best Housewarming Gifts 2025, Housewarming Gift - Presents for Homeowners, First House Gift - New Home Candle COG: 4,7 / Price: 15,98";"B0D6GGZ5TL";"IV-JPRM-B4VI";"";"";"";"";"";"";"";"";"";"";"";"";"-";"";"";"";"";"";"";"";"";"";"";"222 021";"";"5";""
"NewEleven Canvas Book Tote Bag Gifts For Readers, Novel Lovers Gift, Bookish Gifts - Gift For Book Lovers Readers Nerds Bookworm Librarian Women - Bookish Items, Reading Accessories COG: 3,17 / Price: 9,99";"B0D6NQ8KL6";"9K-KRK1-ALN8";"";"";"";"";"";"";"";"";"";"";"";"";"-";"";"";"";"";"";"";"";"";"";"";"198 157";"";"3";""
"NewEleven Pregnancy Announcement for Husband Wife Family, Gender Reveal Gifts, Pregnancy Gifts for Expecting Mom, for New Mom, New Dad, New Parents - Ornament COG: 0,9 / Price: 7,99";"B0D72Z4996";"FB-GMDU-EXTV";"";"";"";"";"";"";"";"";"";"";"";"";"-";"";"-20,21";"1,8";"";"-18,41";"-18,41";"-20,21";"";"";"1 022,78";"66 626";"";"7";""
"NewEleven Baby's First Christmas Ornament 2024 - Baby Picture Frame Newborn Gift, First Time Parents Present, Family of Three First for New Parents - Double-Sided Printing Photo Frame Ornament COG: 1,34 / Price: 7,99";"B0D7MXLVWS";"4J-GBRB-06UY";"";"";"";"";"";"";"";"";"";"";"";"";"-";"";"";"";"";"";"";"";"";"";"";"491 688";"";"2";""
"NewEleven Pet Memorial Gifts for Dogs, Cat Loss Gift - Dog Remembrance, Loss of Pet Sympathy Gifts, Pet Passing Away Gift, Rainbow Bridge Dog Remembrance Presents - Memorial Candle COG: 6,1 / Price: 15,98";"B0D82XJDLM";"U6-ZP01-FHVD";"";"";"";"";"";"";"";"";"";"";"";"";"-";"";"";"";"";"";"";"";"";"";"";"222 021";"";"3";""
"NewEleven Retirement Candle - Funny Retirement Gift for Woman - Retired Gift Idea for Mom, Nurse, Teacher, Coworker & Friends - Scented Candle COG: 4,66 / Price: 15,98";"B0D831XY4Y";"8G-IBWS-BHP3";"";"";"";"";"-3,38";"-3,38";"";"";"";"";"";"";"100";"4,66";"";"";"";"1,28";"1,28";"-3,38";"";"";"";"222 021";"";"8";""
"NewEleven 1 Year Anni Gifts for Boyfriend, One Year Anniversary Candle for Men, Him, Husband - Happy Anniversary for Couple Bf Gifts - 8 Oz Cedar Candle COG: 4,89 / Price: 14,99";"B0DFBX61CJ";"V8-5K55-AR6R";"";"";"";"";"";"";"";"";"";"";"";"";"-";"";"";"";"";"";"";"";"";"";"";"51 535";"";"4";""
"NewEleven 2024 Christmas Ornament, 2024 Year in Review Ornaments, Memorable 2024 Christmas Decor Gifts, Decorative Gifts for Friends, Coworker, Family - Ceramic Ornaments COG: 1,12 / Price: 5,99";"B0DH7VZ4CY";"TZ-P3U6-QGEY";"";"";"";"";"";"";"";"";"";"";"";"";"-";"";"";"";"";"";"";"";"";"";"";"290 413";"";"1";""
"NewEleven 50th Birthday Gifts For Men Women - 1975 50th Birthday Decorations For Him Her - Present For Men Women Turning 50 Year Old Gifts For Mom, Dad, Wife, Husband - 20 Oz Tumbler COG: 3,45 / Price: 21,98";"B0DH83T7MF";"RP-GISO-TOFC";"";"";"";"";"-21,96";"-21,96";"";"";"";"";"";"";"-";"";"";"";"";"-21,96";"-21,96";"-21,96";"";"";"";"6 843";"";"13";""
"NewEleven 60th Birthday Gifts For Men Women - 1965 60th Birthday Decorations For Him Her - Turning 60 Year Old Gifts For Man, Woman, Mom, Dad, Wife, Husband - 20 Oz Tumbler COG: 3,35 / Price: 21,98";"B0DHCFTYVW";"06-AGXV-L5EK";"";"";"";"";"-8,52";"-8,52";"";"";"";"";"";"";"-";"";"";"";"";"-8,52";"-8,52";"-8,52";"";"";"";"6 843";"";"7";""
"NewEleven Baby Pregnancy Announcement Ornament for Grandparents - First Time Grandparents Gifts - Promoted to Grandma Grandpa Gift- Pregnancy Announcement Decorations - Glass Christmas Ornament COG: 2,1 / Price: 5,99";"B0DJBGMLS2";"30-T498-37E5";"";"";"";"";"";"";"";"";"";"";"";"";"-";"";"-41,6";"27,3";"";"-14,30";"-14,30";"-41,6";"";"";"52,38";"491 688";"";"";""
"NewEleven My First Christmas, Picture Frame for New Parents Gifts, Babys First Christmas Ornament 2024 Girl Boy - New Baby Double Sided Picture Frame Ornament COG: 1,38 / Price: 6,99";"B0DJT47X1F";"AT-3DYE-H0LB";"";"";"";"";"";"";"";"";"";"";"";"";"-";"";"";"";"";"";"";"";"";"";"";"1 514 355";"";"1";""
"NewEleven Coworker Ornaments, Christmas Ornament Gifts for Coworkers - Coworker Gift for Women, Present for Coworkers, Friendship Presents for Work Bestie - Christmas Decorations COG: 1,1 / Price: 7,99";"B0DJXTHGW2";"MF-4MWG-A4QS";"";"";"";"";"";"";"";"";"";"";"";"";"-";"";"";"";"";"";"";"";"";"";"";"290 413";"";"1";""
"NewEleven Sister 2025, Sister Birthday Gifts for Women, Big Sister Gifts for Girls - Gift for Women, Soul Sister, BFF, Big Sister Gift Glass Christmas Ornaments COG: 2 / Price: 5,99";"B0DJXZ36VG";"O2-5UU0-154U";"";"";"";"";"";"";"";"";"";"";"";"";"-";"";"";"";"";"";"";"";"";"";"";"577 947";"";"1";""
"NewEleven Family Christmas Ornaments 2025, Decorations Indoor, Mom, Dad, Sister, Brother - Family Tree Funny Decor - Ceramic Christmas Ornaments COG: 0,9 / Price: 5,99";"B0DJY14TYV";"T1-PJGN-ZDTZ";"";"";"";"";"";"";"";"";"";"";"";"";"-";"";"";"";"";"";"";"";"";"";"";"290 413";"";"1";""
"NewEleven Gifts for Mom from Daughter, Gift from Mom, Mommy, Birthday Gift for Mother, Mothers Present - The Love Between Mother and Daughter - Christmas Ornaments COG: 0,95 / Price: 5,99";"B0DJY5ZSY9";"B0-97Q9-I1A3";"";"";"";"";"";"";"";"";"";"";"";"";"-";"";"";"";"";"";"";"";"";"";"";"491 688";"";"2";""
"NewEleven Birthday Gifts for Women, Inspirational Gift, Little Reminder, Unique Present for Women, Encouragement Gift, Teacher Appreciation Gifts - Ceramic Christmas Ornaments COG: 0,93 / Price: 9,99";"B0DJYC5Y9Q";"9V-TCLV-MOMR";"";"";"";"";"";"";"";"";"";"";"";"";"-";"";"1,93";"-0,93";"";"1,00";"1,00";"1,93";"";"";"107,53";"577 947";"";"1";""
"NewEleven Gifts for Dad, Love You Dad Gift Keepsake, Father Birthday Gift, Fun Birthday Gifts for Papa from Daughter, Son - Glass Heart Christmas Ornament COG: 2,16 / Price: 7,99";"B0DJZ5B6YZ";"X7-HY6C-XQAD";"";"";"";"";"";"";"";"";"";"";"";"";"-";"";"";"";"";"";"";"";"";"";"";"66 626";"";"3";""
"NewEleven Christmas Decorations Indoor - Family Christmas Ornaments 2025 for Mom, Dad, Sister, Brother - Funny Ceramic Tree Décor COG: 0,9 / Price: 5,99";"B0DK155YN3";"MW-Y980-J1MX";"";"";"";"";"";"";"";"";"";"";"";"";"-";"";"";"";"";"";"";"";"";"";"";"290 413";"";"1";""
"NewEleven for Boy Mom - Pregnancy Gifts, Gender Reveal Idea for Pregnant, Expecting Mother, Mama, Mom to Be, Mommy to Be - Baby Boy Announcement Gift Ceramic Ornament COG: 0,94 / Price: 6,99";"B0DLT3SDLB";"E4-PNYA-O0P7";"";"";"";"";"";"";"";"";"";"";"";"";"-";"";"";"";"";"";"";"";"";"";"";"66 626";"";"1";""
"NewEleven for Aunt from Niece, Nephew for Auntie, Sister - Auntie Announcement, Promoted to Aunt, Best Aunts Ever Gift - Christmas Tree Decoration Ceramic Ornament COG: 0,94 / Price: 6,99";"B0DLV7X769";"DH-DI42-NMFV";"";"";"";"";"";"";"";"";"";"";"";"";"-";"";"";"";"";"";"";"";"";"";"";"66 783";"";"2";""
"NewEleven for Aunt from Niece, Nephew - Ornament for Aunt, New Auntie - Aunts Birthday Gift, Aunts Announcement, in My Auntie Era - Ceramic Christmas Ornaments COG: 1,19 / Price: 6,99";"B0DLV9CFVS";"F8-F46H-JKVQ";"";"";"";"";"";"";"";"";"";"";"";"";"-";"";"";"";"";"";"";"";"";"";"";"66 626";"";"1";""
"NewEleven Godmother Gifts for Christmas, Godmom Proposal Gift - Will You Be My Godmother - Mom Present from Godchild - Christmas Ornament 2025 COG: 0,94 / Price: 4,99";"B0DLVRTFN9";"64-SAL7-XCWT";"";"";"";"";"";"";"";"";"";"";"";"";"-";"";"";"";"";"";"";"";"";"";"";"491 688";"";"1";""
"NewEleven Retirement Ornament - Funny Retirement Gifts for Woman - Christmas Tree Decoration for Mom, Nurse, Teacher, Coworker & Friends COG: 2,17 / Price: 7,99";"B0DLVS7R7V";"O5-LD0Y-FJ4W";"";"";"";"";"";"";"";"";"";"";"";"";"-";"";"";"";"";"";"";"";"";"";"";"290 413";"";"2";""
"NewEleven for Girl Mom - Pregnancy Gifts, Gender Reveal Idea for Pregnant, Expecting Mother, Mama, Mom to Be, Mommy to Be, First Time Mama - Ceramic Christmas Ornaments COG: 0,94 / Price: 6,99";"B0DLVSLFY6";"RZ-LTWM-2Q4L";"";"";"";"";"-0,75";"-0,75";"";"";"";"";"";"";"-";"";"";"";"";"-0,75";"-0,75";"-0,75";"";"";"";"66 626";"";"2";""
"NewEleven Gifts for Women, Gift for Her, Mom, Friends, A Year of Promises of God Bible Scripture Memory Verse Cards Set of 52 - Christian, Religious, Inspirational Gifts for Women COG: 3,5 / Price: 9,98";"B0DQ42YY8T";"GQ-R013-PDDU";"";"";"";"";"";"";"";"";"";"";"";"";"-";"";"";"";"";"";"";"";"";"";"";"208 186";"";"3";""
"NewEleven Gifts For Him, Her - Valentines' Day Gifts for Men, Women, Boyfriend, Girlfriend, Husband, Wife, Birthday, Couple Presents for Him, Her - 14 Oz Self Stirring Mug COG: 8,66 / Price: 15,99";"B0DQ56WTWZ";"Y2-ATI0-B7OL";"";"";"";"";"";"";"";"";"";"";"";"";"-";"";"";"";"";"";"";"";"";"";"";"176 855";"";"2";""
"NewEleven Gifts For Him, Her - Gift For Men, Dad, Husband, Friend - Thank You, Appreciation, Graduation Present For Men, Boss, Coworker, Teacher - 14 Oz Self Stirring Mug COG: 8,36 / Price: 15,99";"B0DQ59YSW3";"YB-7AHW-E7CH";"";"";"";"";"";"";"";"";"";"";"";"";"100";"8,36";"";"";"";"8,36";"8,36";"";"";"";"";"176 855";"";"2";""
"NewEleven 50th Birthday Gifts for Her COG: 2,2 / Price: 4,99";"B0DQ8L1DQW";"5L-JJQW-3R4J";"";"";"";"";"";"";"";"";"";"";"";"";"-";"";"";"";"";"";"";"";"";"";"";"577 947";"";"2";""
"NewEleven Engagement Gifts for Couples 2025 - Gift for Newly Engaged Couples, Happy Engagement Gifts for Her, Women, Friends, Bride to Be Gift, Glass Christmas Ornaments COG: 2,1 / Price: 9,99";"B0DR1SNKVX";"4L-EMQE-OQ2Y";"";"";"";"";"";"";"";"";"";"";"";"";"-";"";"";"";"";"";"";"";"";"";"";"67 029";"";"2";""
"NewEleven Wedding Gifts - Mr and Mrs, Bridal Shower Decorations - Wedding Gifts for Couples 2025, Bride Gift for Friends - Just Married Glass 2025 Ornament COG: 1,81 / Price: 9,99";"B0DRT2D2ZB";"GU-M8AT-5NTK";"";"";"";"";"";"";"";"";"";"";"";"";"-";"";"";"";"";"";"";"";"";"";"";"66 626";"";"11";""
"NewEleven Teacher Appreciation Gifts For Women, Thank You Gift for Teachers, Inspirational School Teacher Gifts from Students for Birthday, Retirement, Bible Jar For Teachers with 92 Bible Verses COG: 2,33 / Price: 17,98";"B0DVSJLHZN";"W1-8IDB-BZ73";"";"";"";"";"";"";"";"";"";"";"";"";"-";"";"";"";"";"";"";"";"";"";"";"8 688";"";"12";""
"NewEleven Class Of 2025 Graduation Gifts For Her, Friends - Funny Master Degree, College Graduation Gifts From Friends And Family - 16 Oz Coffee Glass COG: 2,3 / Price: 9,99";"B0DWMZXCZP";"UZ-8P0A-GPKD";"";"";"";"";"";"";"";"";"";"";"";"";"100";"2,3";"";"";"";"2,30";"2,30";"";"";"";"";"91 203";"";"1";""
"NewEleven Nurse Gifts For Women, Nursing Student, Nurses Practitioner, Registered Nurse - Gifts For Nurses From Friend, Family And Coworker - 16 Oz Coffee Glass COG: 2,43 / Price: 9,99";"B0DWN3SH33";"C0-X5FU-OU85";"";"";"";"";"";"";"";"";"";"";"";"";"-";"";"";"";"";"";"";"";"";"";"";"37 448";"";"10";""
"NewEleven Gifts For Mom From Husband Daughter, Son - Mom Birthday Gifts, Unique Present For Wife, Mama, Women - 20 Oz Tumbler COG: 3,5 / Price: 16,98";"B0DXVPDSJK";"KE-3OXS-UDHH";"";"";"";"";"";"";"";"";"";"";"";"";"-";"";"";"";"";"";"";"";"";"";"";"37 147";"";"1";""
"NewEleven Gift For Teachers - Teacher Appreciation Gifts For Women, New Teachers - Teacher Gifts For Women From Student, Friends, Family And Coworker - 20 Oz Tumbler COG: 3,42 / Price: 12,98";"B0DYDZFRZD";"4E-EG59-NN41";"";"";"";"";"";"";"";"";"";"";"";"";"-";"";"";"";"";"";"";"";"";"";"";"40 657";"";"3";""
"NewEleven Retirement Gift For Woman 2025 - Coworker Leaving Gift, Going Away Gifts For Friends, Her, Mom, Boss - Farewell Gifts For Coworkers Women From Friend, Family And Colleague - 16 Oz Wine Glass COG: 4,83 / Price: 23,98";"B0F13MKH7X";"ML-PHKJ-4KBU";"";"";"";"";"";"";"";"";"";"";"";"";"100";"4,83";"";"";"";"4,83";"4,83";"";"";"";"";"8 143";"";"17";""
"NewEleven Gifts For Brother - Brother Birthday Gifts For Big, Little Brothers, Siblings, Bro In Law - Funny Brothers Gift From Sister, Bro - 20 Oz Tumbler COG: 3,42 / Price: 16,98";"B0F17BH4MM";"I2-7HVI-3WQ3";"";"";"";"";"";"";"";"";"";"";"";"";"-";"";"";"";"";"";"";"";"";"";"";"37 568";"";"2";""
"NewEleven Fathers Day Gift For Dad - Funny Present For Father, Men - Dad Birthday Gift, Unique Father Gifts From Daughter, Son, Kid, Wife - 20 Oz Tumbler Navy COG: 3,5 / Price: 16,98";"B0F17F23MZ";"R8-7X5D-8W4W";"";"";"";"";"";"";"";"";"";"";"";"";"-";"";"";"";"";"";"";"";"";"";"";"37 568";"";"7";""
"NewEleven Father's Day Gift For Husband - Husband Birthday Gifts, Anniversary Romantic Love Present Ideas For Him - Funny Present For Hubby, Him From Wife - 20 Oz Tumbler COG: 3,42 / Price: 16,98";"B0F17N58SN";"FN-TDOG-NQ7Z";"";"";"";"";"";"";"";"";"";"";"";"";"-";"";"";"";"";"";"";"";"";"";"";"37 568";"";"2";""
"NewEleven Retirement Gift For Woman 2025 - Farewell Gifts For Coworkers, Boss, Friend, Teacher, Grandma - Coworker Leaving Gifts For Women From Friend, Family - Tumbler 12 Oz COG: 3,4 / Price: 22,98";"B0F189PXWB";"L4-F4C9-QOS5";"";"";"";"";"-1,5";"-1,5";"";"";"";"";"";"";"-";"";"";"";"";"-1,50";"-1,50";"-1,5";"";"";"";"64 493";"";"5";""
"NewEleven Birthday Gifts For Mom, Funny Card Gifts For Mom, Awesome Mommy Present From Daughter, Best Mother's Day Gift Idea For Wife, Sister - Humorous Greeting Card COG: 0,45 / Price: 9,99";"B0F2T4JDF7";"AU-GMLU-KG6Z";"";"";"";"";"";"";"";"";"";"";"";"";"-";"";"";"";"";"";"";"";"";"";"";"6 341";"";"174";""
"NewEleven Gifts For Mom, Gifts Cards For Mommy From Daughter, Son, Kids - Funny Present For Birthday, Humorous Mom Greeting Card COG: 0,42 / Price: 7,99";"B0F2T6J36X";"JU-SXX5-LD1M";"";"";"";"";"";"";"";"";"";"";"";"";"-";"";"";"";"";"";"";"";"";"";"";"6 341";"";"2";""
"NewEleven Birthday Gifts For Mom, Gifts For Mom From Daughter, Birthday Card For Mommy - Cool Mothers From Daughter, Son, Kids - Greeting Card COG: 0,42 / Price: 4,99";"B0F2T9H9W8";"IH-G19E-BA1G";"";"";"";"";"";"";"";"";"";"";"";"";"-";"";"";"";"";"";"";"";"";"";"";"1 670";"";"1";""
"NewEleven Gifts For Mom From Daughter, Birthday Card For Mommy, Bonus Mom, Mother In Law - Cool Gifts For Mama From Daughter, Heartfelt Message To Mother - Greeting Card COG: 0,42 / Price: 7,99";"B0F2TB3Q7Q";"WZ-FOQA-VOQC";"";"";"";"";"";"";"";"";"";"";"";"";"-";"";"2,8";"";"";"2,80";"2,80";"2,8";"";"";"";"6 341";"";"2";""
"NewEleven Funny Gifts For Mom, Mothers Day Card For Mom From Daughter, Kids On Mother's Day - Funny Mothers Day Gifts, Birthday Present, Humorous Greeting Cards For Mother COG: 0,42 / Price: 7,99";"B0F2TC6CP7";"GI-HLHH-RG89";"";"";"";"";"";"";"";"";"";"";"";"";"-";"";"";"";"";"";"";"";"";"";"";"6 341";"";"7";""
"NewEleven Mothers Day Card, Cat Mom Gifts For Women, Cat Themed Gift, Best Cat Mom Ever For Mother's Day, Best Gifts For Cat Lovers Female, Unique Cats Lady Presents - Greeting Card COG: 0,42 / Price: 7,99";"B0F2TD7W6G";"1N-AZA8-HSBA";"";"";"";"";"";"";"";"";"";"";"";"";"-";"";"";"";"";"";"";"";"";"";"";"6 341";"";"2";""
"NewEleven Mothers Day Card, Dog Mom Gifts For Women, Unique Moms Gift For Mother's Day, Cute Dog Mom Mother's Day Cards From Dogs, Puppy For Her Womens - Greeting Card COG: 0,42 / Price: 5,99";"B0F2TF1PWV";"EE-SVW5-ID5N";"";"";"";"";"";"";"";"";"";"";"";"";"-";"";"";"";"";"";"";"";"";"";"";"6 341";"";"1";""
"NewEleven Gifts For Dad, Dad Birthday Gift For Father From Daughter, Son, Kid, Wife - Birthday Card, Unique Gifts, Funny Present For Dads, Humorous Greeting Card COG: 0,44 / Price: 7,99";"B0F59PXL1F";"7G-FTQK-LHH4";"";"";"";"";"";"";"";"";"";"";"";"";"-";"";"";"";"";"";"";"";"";"";"";"6 341";"";"3";""
"NewEleven Birthday Card For Dad - Fathers Day Gift, Dad Gifts From Daughter, Son, Wife - Funnny Present, Dads Gift Idea For Bonus Dads, Father, Father In Law - Greeting Card COG: 0,44 / Price: 7,99";"B0F59S8H6T";"IA-GG14-LH7P";"";"";"";"";"";"";"";"";"";"";"";"";"-";"";"";"";"";"";"";"";"";"";"";"6 412";"";"1";""
"NewEleven Gifts For Dad Birhtday - Gifts For Dad, Funny Present From Kids, Daughter, Son - Unique Gift, Birthday Card For Father, Step Father - Greeting Card COG: 0,44 / Price: 7,99";"B0F59VGSY3";"P2-IYY6-4I6R";"";"";"";"";"";"";"";"";"";"";"";"";"-";"";"";"";"";"";"";"";"";"";"";"6 341";"";"1";""
"NewEleven Step Dad Gifts - Father's Day Gifts From Stepson, Daughter - Bonus Dad Card Fathers Day, Funny Gift For Step Dads, Bonus Dads - Humorous Greeting Card COG: 0,44 / Price: 7,99";"B0F59VQYH5";"7S-2VCY-1SM3";"";"";"";"";"";"";"";"";"";"";"";"";"-";"";"";"";"";"";"";"";"";"";"";"6 341";"";"2";""
"NewEleven Father's Day Gifts - Gifts For Dad, Birthday Gift, Funny Present For Dads, Bonus Dads - Dad Birthday Card From Daugther, Son, Kid - Humorous Greeting Card COG: 0,44 / Price: 7,99";"B0F59VRD37";"NB-CCIF-JJB6";"";"";"";"";"";"";"";"";"";"";"";"";"-";"";"";"";"";"";"";"";"";"";"";"6 341";"";"2";""
"NewEleven Husband Gift - Romantic Gifts, Father's Day Gifts For Husband From Wife - Unique Present, Heartfelt Message, Fathers Day Card For Husbands - Greeting Card COG: 0,44 / Price: 7,99";"B0F59VYMYR";"4N-UKMX-U3ON";"";"";"";"";"";"";"";"";"";"";"";"";"-";"";"";"";"";"";"";"";"";"";"";"6 341";"";"2";""
"NewEleven New Dad Gifts First Time - Fathers Day Card, First Fathers Day Gift For New Dad - Heartfelt Messesage, Unique Present For Husband From Wife, Family - Greeting Card COG: 0,44 / Price: 7,99";"B0F59WGVDP";"9F-QK3Z-J55J";"";"";"";"";"";"";"";"";"";"";"";"";"-";"";"";"";"";"";"";"";"";"";"";"6 341";"";"2";""
"NewEleven Dad Birthday Gift - Meaningful Present For Dads, Bonus Dads - Cute Dad Birthday Card, Fathers Day Card From Son, Daughter, Favorite Kids - Greeting Card COG: 0,44 / Price: 7,99";"B0F59X5XB6";"BQ-8IHB-2PJV";"";"";"";"";"";"";"";"";"";"";"";"";"100";"0,44";"";"";"";"0,44";"0,44";"";"";"";"";"6 341";"";"1";""
"NewEleven Gifts For Son - Meaningful Fathers Day Card For Son From Mom And Dad - Unique Present, Heartfelt Messeage, Father's Day Gifts For Sons, Dad First Time - Greeting Card COG: 0,44 / Price: 7,99";"B0F59X7WSH";"H2-9Z1Y-AGEF";"";"";"";"";"";"";"";"";"";"";"";"";"-";"";"";"";"";"";"";"";"";"";"";"6 341";"";"4";""
"NewEleven Dad Gifts - Gifts For Dad From Daughter, Son, Kid, Wife - Heartfelt Message, Fathers Day Card For Dads, Bonus Das, Step Father - Greeting Card COG: 0,44 / Price: 7,99";"B0F59Y459Y";"RZ-9XXR-XH01";"";"";"";"";"";"";"";"";"";"";"";"";"-";"";"";"";"";"";"";"";"";"";"";"6 341";"";"6";""
"NewEleven Dad Birthday Card - Gifts For Dad From Daughter, Son, Kid - Father's Day Gift Idea For Dads, Bonus Dads - Humorous Greeting Card COG: 0,44 / Price: 7,99";"B0F59YJV71";"50-79MF-SYWH";"";"";"";"";"-4,14";"-4,14";"";"";"";"";"";"";"-";"";"";"";"";"-4,14";"-4,14";"-4,14";"";"";"";"6 341";"";"14";""
"NewEleven Funny Dad Birthday Gift from Daughter, Son, Kids – Humorous Card for Daddy, Bonus Dad, Father-in-Law – Great for Father’s Day, Birthday, Just Because – Sentimental Greeting Card COG: 0,44 / Price: 7,99";"B0F59YVGWG";"8P-L50D-6IVR";"";"";"";"";"";"";"";"";"";"";"";"";"100";"0,44";"";"";"";"0,44";"0,44";"";"";"";"";"6 341";"";"1";""
"NewEleven Grandpa Gifts - Grandpa Birthday Gifts, Gift For Grandparents From Kids, Child - Birthday Gift, Heartfelt Message, Fathers Day Card For Grandpa, Papa - Greeting Card COG: 0,44 / Price: 7,99";"B0F59Z29ZR";"OQ-C9LE-D894";"";"";"";"";"";"";"";"";"";"";"";"";"-";"";"";"";"";"";"";"";"";"";"";"6 341";"";"4";""
