"Product";"ASIN";"SKU";"Units";"Refunds";"Sales";"Promo";"Ads";"Sponsored products (PPC)";"Sponsored Display";"Sponsored brands (HSA)";"Sponsored Brands Video";"Google ads";"Facebook ads";"% Refunds";"Sellable Quota";"Refund сost";"Amazon fees";"Cost of Goods";"Shipping";"Gross profit";"Net profit";"Estimated payout";"Expenses";"Margin";"ROI";"BSR";"Real ACOS";"Sessions";"Unit Session Percentage"
"NewEleven Dad Birthday Gift For Dad, Bonus Dads - Fathers Day Card, Unique Present, Heartfelt Messesage For Father From Daughter, Son, Kids - Greeting Card COG: 0,44 / Price: 7,99";"B0F59XTYB6";"45-R2A7-EGYZ";"";"";"";"";"";"";"";"";"";"";"";"";"-";"";"";"";"";"";"";"";"";"";"";"";"";"2";""
"NewEleven Dad Gifts - Gifts For Dad From Daughter, Son, Kid, Wife - Heartfelt Message, Fathers Day Card For Dads, Bonus Das, Step Father - Greeting Card COG: 0,44 / Price: 7,99";"B0F59Y459Y";"RZ-9XXR-XH01";"";"";"";"";"";"";"";"";"";"";"";"";"-";"";"";"";"";"";"";"";"";"";"";"";"";"4";""
"NewEleven Dad Birthday Card - Gifts For Dad From Daughter, Son, Kid - Father's Day Gift Idea For Dads, Bonus Dads - Humorous Greeting Card COG: 0,44 / Price: 7,99";"B0F59YJV71";"50-79MF-SYWH";"";"";"";"";"";"";"";"";"";"";"";"";"-";"";"";"";"";"";"";"";"";"";"";"";"";"2";""
"NewEleven Funny Dad Birthday Gift from Daughter, Son, Kids – Humorous Card for Daddy, Bonus Dad, Father-in-Law – Great for Father’s Day, Birthday, Just Because – Sentimental Greeting Card COG: 0,44 / Price: 7,99";"B0F59YVGWG";"8P-L50D-6IVR";"";"";"";"";"";"";"";"";"";"";"";"";"-";"";"";"";"";"";"";"";"";"";"";"";"";"6";""
"NewEleven Father's Day Gifts, Dog Dad Gifts For Men, Unique Dads Gift For Father's Day, Cute Fathers Day Card From Dog, Puppy For Men Husband - Greeting Card COG: 0,43 / Price: 7,99";"B0F7LJYVN5";"PU-6IQ0-1725";"";"";"";"";"";"";"";"";"";"";"";"";"-";"";"";"";"";"";"";"";"";"";"";"";"";"3";""
"NewEleven Gift For Grandpa - Meaningful Grandpa Gifts From Granddaughter, Grandson - Grandpa Birthday Gifts For Grandfather, New Granddad, PaPa - Bible Jar COG: 2,62 / Price: 16,98";"B0F7WVKZ6F";"8O-S5PG-85KF";"";"";"";"";"";"";"";"";"";"";"";"";"-";"";"";"";"";"";"";"";"";"";"";"";"";"16";""
"NewEleven Uncle Birthday Gifts - Gift For Uncle, Funcle - Meaningful Present, Birthday Gift For Uncles From Newphew, Niece, Kids - Bible Jar COG: 2,62 / Price: 17,98";"B0F7WYS1R1";"YA-B9EW-YOZ9";"";"";"";"";"";"";"";"";"";"";"";"";"-";"";"";"";"";"";"";"";"";"";"";"";"";"13";""
"NewEleven Birthday Gifts For Women - Humorous Message, Funny Birthday Gift Card For Men, Women, Dad, Mom, Brother, Sister, Friends, Family - Greeting Card COG: 0,39 / Price: 5,99";"B0FC5MVV3Q";"H4-ZU99-Z57Y";"";"";"";"";"-7,48";"-7,48";"";"";"";"";"";"";"-";"";"";"";"";"-7,48";"-7,48";"-7,48";"";"";"";"";"";"7";""
"NewEleven Teacher Thank You Cards - Teachers Appreciation Gifts, Heartfelt Messeage, Meaningful Thank You Teacher Gifts From Student, Kids - Greeting Card COG: 0,39 / Price: 4,99";"B0FC6CL2XN";"DM-O5C7-TN8L";"";"";"";"";"";"";"";"";"";"";"";"";"-";"";"";"";"";"";"";"";"";"";"";"";"";"15";""
"NewEleven Thank You Cards - Teacher Appreciation Gifts, Thanks You Present For Friend, Teacher, Boss - Thank You Gifts For Women, Men From Bestie, Family, Colleague - Greeting Card COG: 0,39 / Price: 4,99";"B0FC6CNPQK";"4R-QNTR-6X4P";"";"";"";"";"";"";"";"";"";"";"";"";"-";"";"";"";"";"";"";"";"";"";"";"";"";"27";""
