"Product";"ASIN";"SKU";"Units";"Refunds";"Sales";"Promo";"Ads";"Sponsored products (PPC)";"Sponsored Display";"Sponsored brands (HSA)";"Sponsored Brands Video";"Google ads";"Facebook ads";"% Refunds";"Sellable Quota";"Refund сost";"Amazon fees";"Cost of Goods";"Shipping";"Gross profit";"Net profit";"Estimated payout";"Expenses";"Margin";"ROI";"BSR";"Real ACOS";"Sessions";"Unit Session Percentage"
"NewEleven Gifts For Mom - Gifts For Mother, Women, Wife - Funny Best Birthday Gift Ideas For Wife, New Mama, Bonus Mama, Mom To Be, Mother In Law - 12 Oz Tumbler COG: 3,76 / Price: 15,98";"B07Y7ZQ265";"F1-10S9-NASK";"";"";"";"";"";"";"";"";"";"";"";"";"-";"";"";"";"";"";"";"";"";"";"";"";"";"5";""
"NewEleven Fathers Day Gift For Dad From Daughter, Son, Kids - Birthday Gift For Dad, Husband, Men - Best Present Idea For Father, Husband, Bonus Father From Daughter, Son, Wife - 20 Oz Tumbler COG:  / Price: 0";"B088GX79HT";"";"";"";"";"";"";"";"";"";"";"";"";"";"-";"";"";"";"";"";"";"";"";"";"";"";"";"6";""
"NewEleven 20 Oz Tumbler - Christmas Gifts for Dad from Kids COG:  / Price: 0";"B08ZKZ1FJK";"";"";"";"";"";"";"";"";"";"";"";"";"";"-";"";"";"";"";"";"";"";"";"";"";"";"";"2";""
"NewEleven Fathers Day Gift For Men, Dad, Husband, Him - Aprons For Men With Pockets - Funny Gifts For Men, Dad, Husband, Him COG: 6,14 / Price: 19,98";"B091F544N7";"XM-V41I-3KAW";"";"";"";"";"";"";"";"";"";"";"";"";"-";"";"-5,29";"6,14";"";"0,85";"0,85";"-5,29";"";"";"-13,84";"";"";"";""
"NewEleven Retirement Gifts For Woman 2025 - Retired Gift For Coworker Leaving - Farewell, Goodbye Presents For Women, Coworkers, Friends - 20 Oz Tumbler COG: 5,1 / Price: 17,98";"B095S16WV3";"VG-MZ2S-KBWR";"";"";"";"";"";"";"";"";"";"";"";"";"100";"10,2";"";"";"";"10,20";"10,20";"";"";"";"";"";"";"7";""
"NewEleven Gifts For Mom From Daughter, Son, Kids - Unique Birthday Gift For Mom Wife, New Mother, Bonus Mama, Pregnant Mama - Funny Gifts Ideas For Mum - 20 Oz Tumbler COG: 4,2 / Price: 16,98";"B097B9H21P";"YP-SEHP-8NOP";"";"1";"";"";"";"";"";"";"";"";"";"∞";"-";"-14,73";"";"";"";"-14,73";"-14,73";"-14,73";"";"";"";"";"";"15";""
"NewEleven Christmas Gift For Dad - Birthday Gifts For Dad From Daughter, Son, Kids - Husband Gifts - Birthday Present Ideas For Father, Husband, New Dad, Bonus Dad From Daughter, Son - 20 Oz Tumbler COG:  / Price: 0";"B097B9SY89";"";"";"";"";"";"";"";"";"";"";"";"";"";"-";"";"";"";"";"";"";"";"";"";"";"";"";"1";""
"NewEleven Gift For Uncle From Niece, Nephew - Funny Unkie Gift, Uncle Birthday Gifts - Best Present For New Uncles, Funcle, Unky Announcement - 20 Oz Tumbler COG: 4,29 / Price: 19,98";"B097H6PJCN";"C5-L2Z6-TAT4";"";"";"";"";"";"";"";"";"";"";"";"";"-";"";"";"";"";"";"";"";"";"";"";"";"";"12";""
"NewEleven Retirement Gifts For Men Women 2025 - Retirement Party Decorations - Retired Presents For Coworker Leaving, Men, Retired People, Coworkers, Friends - 20 Oz Tumbler COG: 4,48 / Price: 19,98";"B09YCTFXYV";"KG-HY7Y-VD9N";"";"";"";"";"";"";"";"";"";"";"";"";"-";"";"";"";"";"";"";"";"";"";"";"";"";"17";""
"NewEleven Gifts For Aunt From Niece, Nephew - Cool Gifts For New Aunt, Auntie, Sister - Aunts Birthday Gift - Announcement, Promoted To Aunty, Best Auntie Ever - 16 Oz Coffee Glass COG: 2,33 / Price: 12,98";"B0BC8SB3Y4";"DT-HT71-4QRG";"";"";"";"";"";"";"";"";"";"";"";"";"-";"";"";"";"";"";"";"";"";"";"";"";"";"9";""
"NewEleven Gifts For Sister - Unique Birthday Present For Sisters, Soul Sis, Big, Little Sister, Sisters In Law, Sibling, Bestie - 16 Oz Coffee Glass COG: 2,04 / Price: 15,98";"B0BC8WBYW7";"U3-HSBK-1RJI";"";"";"";"";"";"";"";"";"";"";"";"";"-";"";"";"";"";"";"";"";"";"";"";"";"";"3";""
"NewEleven Gifts For Wife, Her - Wife Gifts From Husband - Gift For Her - Gift Ideas For Women, Bride To Be, Fiancee, Wifey - 16 Oz Coffee Glass COG: 2,92 / Price: 13,99";"B0BDLH8KX3";"47-ZC5Z-3DOW";"";"";"";"";"";"";"";"";"";"";"";"";"-";"";"";"";"";"";"";"";"";"";"";"";"";"7";""
"NewEleven Gifts For Mom - Present For Mom From Daughter, Son, Kids - Unique Birthday Gifts For Mother, New Mom, Mommy, Pregnancy - 16 Oz Coffee Glass COG: 2,82 / Price: 13,99";"B0BHWDNYVL";"CW-5CAB-L7CZ";"";"";"";"";"";"";"";"";"";"";"";"";"-";"";"";"";"";"";"";"";"";"";"";"";"";"4";""
"NewEleven Gifts For Women Friendship - Funny Gifts For Friends Female - Unique Friendship Present For Her, Female, Bestie, Bff, Soul Sister, Work Bestie - 16 Oz Coffee Glass COG: 2,29 / Price: 15,98";"B0BRB5SPYZ";"25-YAS2-RJHI";"";"";"";"";"";"";"";"";"";"";"";"";"-";"";"";"";"";"";"";"";"";"";"";"";"";"5";""
"NewEleven Gifts For Sister - Unique Birthday Present For Soul Sister, Big, Little Sis, Sisters In Law, Sibling, Bestie - 16 Oz Coffee Glass COG: 2,03 / Price: 15,98";"B0BRB6J55H";"OW-SAUE-CM7G";"";"";"";"";"";"";"";"";"";"";"";"";"-";"";"";"";"";"";"";"";"";"";"";"";"";"7";""
"NewEleven Bridal Shower Gifts - Wedding Gifts For Bride - Bachelorette Gift, Engagement Presents For Women - Gift For Bride To Be, Fiancee, Wifey, Her - 16 Oz Coffee Glass COG: 2,18 / Price: 13,98";"B0BRCCZLL8";"63-QY4L-OED4";"";"";"";"";"";"";"";"";"";"";"";"";"-";"";"";"";"";"";"";"";"";"";"";"";"";"5";""
"NewEleven Christmas Gifts For Women Friendship - Funny Gifts For Friends Female - Unique Friendship Gift For Women, Friend, Female, Bestie, Bff, Soul Sister, Work Bestie - 16 Oz Coffee Glass COG:  / Price: 0";"B0BRCDZRSP";"";"";"";"";"";"";"";"";"";"";"";"";"";"-";"";"";"";"";"";"";"";"";"";"";"";"";"17";""
"NewEleven Cute Cups With Lids And Straw – Aesthetic Cups – Iced Java Cup, Coffee Tumbler, Glass Tumbler – Galentines Gifts For Women, Java Lover - 16 Oz Coffee Glass COG: 2,86 / Price: 12,34";"B0C1C1F4M4";"Z2-BJ5R-5S3M";"";"";"";"";"";"";"";"";"";"";"";"";"-";"";"";"";"";"";"";"";"";"";"";"";"";"5";""
"NewEleven Gifts For Her - Cow Gifts For Women - Stuff For Cow Lovers - Cute Funny Birthday Gift For Women, Best Friend, Sister, Daughter, Coworker - 16 Oz Coffee COG: 2,29 / Price: 14,98";"B0C242DYT4";"OX-EHPQ-U3LT";"";"";"";"";"";"";"";"";"";"";"";"";"-";"";"";"";"";"";"";"";"";"";"";"";"";"1";""
"NEWELEVEN 16 Oz Coffee Glass - Mom Birthday Gifts, Multicolor, Glass, 16 oz, Reusable, Insulated, Cylindrical, Casual, Cold Drinks, Christmas, Mother's Day, Birthday COG: 2,31 / Price: 12,98";"B0CBJSYJJS";"IV-16R1-T5AZ";"";"";"";"";"";"";"";"";"";"";"";"";"-";"";"";"";"";"";"";"";"";"";"";"";"";"7";""
"NewEleven Gifts For Book Lovers - Book Lovers Gifts For Women, Her, Friends - Book Accessories, Bookish Gifts For Writers, Readers, Librarian, Bookaholic, Bookworm – 16 Oz Coffee Glass COG: 2,03 / Price: 13,98";"B0CCDLWRTD";"68-JFET-D7YN";"";"";"";"";"";"";"";"";"";"";"";"";"-";"";"";"";"";"";"";"";"";"";"";"";"";"14";""
"NewEleven Coworker Leaving Gifts - Farewell, Going Away Gift For Coworker - New Job, Goodbye, Good Luck Gifts For Coworkers, Colleagues, Boss, Men, Women, Friends - 20 Oz Tumbler COG: 3,71 / Price: 19,98";"B0CDLPSMGF";"CO-C7X6-C1NV";"";"";"";"";"";"";"";"";"";"";"";"";"-";"";"";"";"";"";"";"";"";"";"";"";"";"13";""
"NewEleven Gifts For Men, Dad, Husband, Friend - Birthday Gift For Women, Men - Thank You Gifts, Appreciation Gift, Graduation Presents For Men, Nurse, Teacher, Boss, Coworker – 20 Oz Tumbler COG: 3,66 / Price: 16,98";"B0CDLQFJK6";"EH-49BE-XWTF";"";"";"";"";"";"";"";"";"";"";"";"";"-";"";"";"";"";"";"";"";"";"";"";"";"";"8";""
"NewEleven Gifts For Women – Chaos Coordinator Gifts For Women, Boss, Manager, Coworker, Best Friend - Appreciation, Inspirational Gift For Teacher, Nurse, Social Worker – 20 Oz Tumbler COG: 3,87 / Price: 17,98";"B0CFQ4CDD5";"7K-U1QW-2RDX";"";"";"";"";"";"";"";"";"";"";"";"";"-";"";"";"";"";"";"";"";"";"";"";"";"";"2";""
"NewEleven Gifts For Mom, Wife - Gifts For Mom From Daughter, Son, Kids - Unique Birthday Present Ideas For Mother, Wife, New Mama From Daughter, Son, Husband - 20 Oz Tumbler COG: 3,71 / Price: 19,98";"B0CG8NHNWF";"2F-5232-03M8";"";"";"";"";"";"";"";"";"";"";"";"";"-";"";"";"";"";"";"";"";"";"";"";"";"";"9";""
"NewEleven Fathers Day Gift For Dad, Men - Funny Birthday Gifts For Dad, Men, Car Guys - Unique Present Idea For Father, Husband, Uncle, Guys From Daughter, Son, Kids, Wife - 20 Oz Tumbler COG: 3,71 / Price: 14,98";"B0CHJ1V1RR";"0I-V2OD-GO56";"";"";"";"";"";"";"";"";"";"";"";"";"-";"";"";"";"";"";"";"";"";"";"";"";"";"11";""
"NewEleven Gifts For Coworker Friends – Work Bestie Gifts For Women Friendship - Unique Present Ideas For Coworker Leaving, Going Away, Goodbye, Farewell Party – 20 Oz Tumbler COG: 3,57 / Price: 17,98";"B0CHJ3W9SQ";"LA-XF5O-M492";"";"";"";"";"-6,98";"-6,98";"";"";"";"";"";"";"-";"";"11,58";"-7,14";"";"-2,54";"-2,54";"4,6";"";"";"-35,57";"";"";"10";""
"NewEleven Fathers Day Gift For Dad - Cool Dad Gifts From Daughter - Unique Birthday Present Ideas For Father, Husband, Bonus Papa, Step Father, New Papa From Daughter - 20 Oz Tumbler COG: 3,63 / Price: 19,98";"B0CJLM3SV5";"5B-L34H-TU17";"";"";"";"";"";"";"";"";"";"";"";"";"-";"";"";"";"";"";"";"";"";"";"";"";"";"2";""
"NewEleven Birthday Gifts For Men, Women - Funny Gag Gifts Ideas For Dad, Mom, Grandpa, Grandma, Husband, Wife, Uncle, Him - 40th 50th 60th 70th 80th Birthday Gifts For Men Women – 20 Oz Tumbler COG: 3,76 / Price: 16,99";"B0CLYSGX7Q";"OA-DGFL-ZKWU";"";"";"";"";"";"";"";"";"";"";"";"";"-";"";"";"";"";"";"";"";"";"";"";"";"";"4";""
"NewEleven Fathers Day Gift For Dad - Birthday Gifts For Dad From Daughter - Husband Gifts - Unique Birthday Present Ideas For Father, Husband, New Papa, Bonus Father From Daughter - 20 Oz Tumbler COG: 3,19 / Price: 19,98";"B0CM5R5BDX";"WC-3I7C-6VN5";"";"";"";"";"";"";"";"";"";"";"";"";"-";"";"";"";"";"";"";"";"";"";"";"";"";"2";""
"NewEleven Dad Gifts - Birthday Gifts For Dad From Daughter - Husband Gift - Unique Birthday Present Ideas For Father, Husband, New Papa, Bonus Father From Daughter - 20 Oz Tumbler COG: 3,19 / Price: 15,98";"B0CM5RY3QS";"J7-CYQ3-G6E8";"";"";"";"";"";"";"";"";"";"";"";"";"-";"";"";"";"";"";"";"";"";"";"";"";"";"2";""
"NewEleven 50th Birthday Gifts For Men Women - 1974 50th Birthday Decorations - Gifts For Men Women Turning 50-50 Year Old Gift For Man, Woman, Mom, Dad, Wife, Husband - 20 Oz Tumbler COG: 3,65 / Price: 19,98";"B0CN93LZ5M";"RQ-VBDU-6QPJ";"";"";"";"";"";"";"";"";"";"";"";"";"-";"";"";"";"";"";"";"";"";"";"";"";"";"8";""
"NewEleven Fathers Day Gift For Dad, Men - Funny Birthday Gifts For Dad, Men, Car Guys - Unique Present Idea For Father, Papa, Husband, Uncle, Guys From Daughter, Son, Kids, Wife - 20 Oz Tumbler COG: 3,93 / Price: 19,98";"B0CNTFTNT9";"MO-1909-MXZY";"";"";"";"";"";"";"";"";"";"";"";"";"-";"";"";"";"";"";"";"";"";"";"";"";"";"6";""
"NewEleven Gifts For Grandma - Grandma Gifts From Granddaughter, Grandson - Birthday Gift For Grandmother, Nana, Gigi, Mimi, Grammy From Grandchildren, Grandchild - 20 Oz Tumbler COG: 3,62 / Price: 17,98";"B0CQ2K12H3";"RR-GSRH-DCUL";"";"";"";"";"";"";"";"";"";"";"";"";"-";"";"";"";"";"";"";"";"";"";"";"";"";"11";""
"NewEleven Gifts For Grandma - Grandmother Birthday Gifts, Gift for Grandma From Granddaughter Grandson - Presents For Nana, Gigi, Mimi, Grammy, New Grandmother - 20 Oz Tumbler COG: 3,5 / Price: 16,98";"B0CRKR75LJ";"XF-QHNV-2YN6";"";"";"";"";"";"";"";"";"";"";"";"";"-";"";"";"";"";"";"";"";"";"";"";"";"";"8";""
"NewEleven Gifts For Aunt From Niece, Nephew - Cool Gifts For Aunt, New Aunts, Sister - Aunts Birthday Gift, Auntie Announcement, Promoted To Auntie, Best Aunties Ever - 20 Oz Tumbler COG: 3,56 / Price: 14,98";"B0CWTR4RFZ";"KH-DRF5-O4UX";"";"";"";"";"";"";"";"";"";"";"";"";"-";"";"";"";"";"";"";"";"";"";"";"";"";"1";""
"NewEleven Fathers Day Gift For Dad, Men - Funny Birthday Gifts For Father, Husband - Gifts For Father, New Dad, Bonus Papa, Husband, Uncle From Daughter, Son Mug with Lid - 14 Oz Tumbler COG: 4,17 / Price: 22,98";"B0CXXG46HR";"TF-FGX1-1AVQ";"";"";"";"";"";"";"";"";"";"";"";"";"-";"";"";"";"";"";"";"";"";"";"";"";"";"11";""
"NewEleven Gifts For Nurse - Nursing Graduation Gift For Women Her - Caregiver Appreciation Gifts, Nursing Student, New Nurses, Nurse Practitioner, RN - 16 Oz Coffee Glass COG: 2,68 / Price: 9,99";"B0D1GF81G8";"WJ-F0KW-EYOB";"";"";"";"";"";"";"";"";"";"";"";"";"-";"";"";"";"";"";"";"";"";"";"";"";"";"13";""
"NewEleven Gifts For Godmother - Will You Be My Godmother From GodChild - Pregnancy Announcement Gifts For Godmom, Godparents - 16 Oz Coffee Glass COG: 2,58 / Price: 17,98";"B0D2NSHWZK";"J5-EJIM-0Y8E";"";"";"";"";"";"";"";"";"";"";"";"";"-";"";"";"";"";"";"";"";"";"";"";"";"";"11";""
"NewEleven 21st Birthday Gifts For Women, Her - 2004 Birthday Decorations - 21 Year Old Gifts Ideas For Women, Her, Daughter, Sister, Best Friends - 16 Coffee Glass COG: 3,66 / Price: 16,98";"B0D39T2MVK";"73-AOV6-10DJ";"";"";"";"";"";"";"";"";"";"";"";"";"-";"";"";"";"";"";"";"";"";"";"";"";"";"14";""
"NewEleven Witchy Gifts for Women, Witch Gifts, Witch Stuff, Witch Accessories - Birthday Halloween Presents for Women Witches Wiccan Her Friend Sister Daughter Female - 16 Oz Coffee Glass COG: 2,65 / Price: 15,99";"B0D5YGB4KV";"ZB-3CPZ-WSS8";"";"";"";"";"";"";"";"";"";"";"";"";"-";"";"";"";"";"";"";"";"";"";"";"";"";"4";""
"NewEleven 50th Birthday Gifts For Women, 50th Birthday Decorations, 50 Years Old Gifts For Her, Sister, Mom, Bestie, 1975 Birthday Gift For Women, Fifties Wine Tumbler - 12 Oz Tumbler COG: 3,84 / Price: 16,98";"B0D5YHG24C";"V3-2DHI-A0G1";"";"";"";"";"";"";"";"";"";"";"";"";"-";"";"";"";"";"";"";"";"";"";"";"";"";"7";""
"NewEleven House Warming Gifts, New Home Ornament 2025, Dream Home Presents Ideas for Couple - Welcome Home Gifts, Housewarming Gift New Home, Best Housewarming Gift 2024 - Ceramic Ornament COG: 0,68 / Price: 7,99";"B0D6144Q48";"1Z-298F-OLVI";"";"";"";"";"";"";"";"";"";"";"";"";"-";"";"";"";"";"";"";"";"";"";"";"";"";"5";""
"NewEleven Canvas Book Tote Bag Gifts For Readers, Novel Lovers Gift, Bookish Gifts - Gift For Book Lovers Readers Nerds Bookworm Librarian Women - Bookish Items, Reading Accessories COG: 3,17 / Price: 9,99";"B0D6NQ8KL6";"9K-KRK1-ALN8";"";"";"";"";"";"";"";"";"";"";"";"";"-";"";"";"";"";"";"";"";"";"";"";"";"";"1";""
"NewEleven Teacher Appreciation Gifts - Difference Maker Gift for Friend, Co-Worker, Boss - Motivational, Graduation Gifts for Women - Goodbye Gift for Coworkers - Scented Candle COG: 5,58 / Price: 15,98";"B0D72QM578";"8M-I3B0-E0CI";"";"";"";"";"";"";"";"";"";"";"";"";"-";"";"";"";"";"";"";"";"";"";"";"";"";"1";""
"NewEleven Thank You Gifts Difference Maker - Christmas, Birthday Gifts for Women, Men - Teacher Appreciation Gift, Graduation Gift, Retirement Present for Woman, Ceramic Ornament COG: 1,07 / Price: 6,99";"B0D739JLH2";"6K-L9YU-Z8JE";"";"";"";"";"";"";"";"";"";"";"";"";"-";"";"";"";"";"";"";"";"";"";"";"";"";"1";""
"NewEleven Retirement Candle - Funny Retirement Gift for Woman - Retired Gift Idea for Mom, Nurse, Teacher, Coworker & Friends - Scented Candle COG: 4,66 / Price: 15,98";"B0D831XY4Y";"8G-IBWS-BHP3";"";"";"";"";"";"";"";"";"";"";"";"";"";"";"";"";"";"";"";"";"";"";"";"";"";"4";""
"NewEleven Gifts for Book Lovers, Reading Accessories Gift, Bookish Gifts Candles for Women Her, Books Club Gift, Bookish Items Presents for Readers Librarians Bookworm - Reading Book Candle COG: 6,74 / Price: 17,98";"B0D83SHR3X";"G3-8OQB-7E7S";"";"";"";"";"";"";"";"";"";"";"";"";"-";"";"";"";"";"";"";"";"";"";"";"";"";"8";""
"NEWELEVEN Retirement Angel Figurine 2024 - Retirement Gift for Women, Nurse, Teacher, Doctor - Classic, Light Color COG: 3,16 / Price: 25,99";"B0DFBYSQTQ";"ZF-L7XO-E9LR";"";"";"";"";"";"";"";"";"";"";"";"";"-";"";"";"";"";"";"";"";"";"";"";"";"";"2";""
"NewEleven 40th Birthday Gifts For Men Women - 1985 40th Birthday Decorations For Men Women - Turning 40-40 Year Old Gifts For Man, Woman, Mom, Dad, Wife, Husband - 20 Oz Tumbler COG: 3,45 / Price: 21,98";"B0DH7PQ1RX";"7N-6OBC-K7DN";"";"";"";"";"-1,87";"-1,87";"";"";"";"";"";"";"-";"";"";"";"";"-1,87";"-1,87";"-1,87";"";"";"";"";"";"14";""
"NewEleven Pet First Christmas Ornaments 2024, for Puppy Dog Cat Pet Lovers, Cat Dog Picture Frame Ornaments for Christmas Tree COG: 1,29 / Price: 5,99";"B0DJY79JYZ";"CE-YODW-3F5U";"";"";"";"";"";"";"";"";"";"";"";"";"-";"";"";"";"";"";"";"";"";"";"";"";"";"1";""
"NewEleven Birthday Gifts for Women, Inspirational Gift, Little Reminder, Unique Present for Women, Encouragement Gift, Teacher Appreciation Gifts - Ceramic Christmas Ornaments COG: 0,93 / Price: 9,99";"B0DJYC5Y9Q";"9V-TCLV-MOMR";"";"";"";"";"";"";"";"";"";"";"";"";"-";"";"";"";"";"";"";"";"";"";"";"";"";"1";""
"NewEleven Baptized 2024 Ornament, Baptism Gifts for Girl & Boy, Baptism Decorations - Ceramic Christmas Ornaments COG: 0,9 / Price: 5,99";"B0DJYCPNR6";"L5-SE7H-JXVG";"";"";"";"";"";"";"";"";"";"";"";"";"-";"";"";"";"";"";"";"";"";"";"";"";"";"1";""
"NewEleven Gifts for Dad, Love You Dad Gift Keepsake, Father Birthday Gift, Fun Birthday Gifts for Papa from Daughter, Son - Glass Heart Christmas Ornament COG: 2,16 / Price: 7,99";"B0DJZ5B6YZ";"X7-HY6C-XQAD";"";"";"";"";"";"";"";"";"";"";"";"";"-";"";"";"";"";"";"";"";"";"";"";"";"";"1";""
"NewEleven Nativity Ornament 2025 - Christian Christmas Ornament, Religious Gifts for Women, Men, Family - Ceramic COG: 0,95 / Price: 5,99";"B0DK15B6KL";"IT-Y89T-YP7U";"";"";"";"";"";"";"";"";"";"";"";"";"-";"";"";"";"";"";"";"";"";"";"";"";"";"1";""
"NewEleven Women - Friend Gifts Ornaments 2025 - Friendship Gifts for Friends, Birthday Gift for Women, Besties, Soul Sisters - Ceramic Christmas Ornaments COG: 0,91 / Price: 4,99";"B0DK16MCXG";"JC-JJYR-OWD3";"";"";"";"";"";"";"";"";"";"";"";"";"-";"";"";"";"";"";"";"";"";"";"";"";"";"6";""
"NewEleven Best Friend Birthday Gifts for Women, Friends - Thank You Gift for Friend, Bestie, BFF for Her, Him - Christmas Ornaments COG: 2 / Price: 5,99";"B0DK16RQ6J";"KG-02VI-0ANH";"";"";"";"";"";"";"";"";"";"";"";"";"-";"";"";"";"";"";"";"";"";"";"";"";"";"2";""
"NewEleven Engagement Gifts for Couples 2024 - First Christmas Engaged Gifts for Her - Engagement Gift for Newly Engaged Couples, Her, Women, Friends, Bride to Be Gift, Glass Christmas Ornaments COG: 2,09 / Price: 7,99";"B0DK16SMD9";"Q6-R02W-6Y1G";"";"";"";"";"";"";"";"";"";"";"";"";"-";"";"";"";"";"";"";"";"";"";"";"";"";"14";""
"NewEleven Gifts for Women, Friendship, Friends, Birthday Gift for Friends Female BFF Old Best Friends, Best Friend Ornament, Bestie Ornament COG: 0,93 / Price: 7,99";"B0DK2YP1FB";"JR-LLGY-N975";"";"";"";"";"";"";"";"";"";"";"";"";"-";"";"";"";"";"";"";"";"";"";"";"";"";"2";""
"NewEleven for Aunt from Niece, Nephew for Auntie, Sister - Auntie Announcement, Promoted to Aunt, Best Aunts Ever Gift - Christmas Tree Decoration Ceramic Ornament COG: 0,94 / Price: 6,99";"B0DLV7X769";"DH-DI42-NMFV";"";"";"";"";"";"";"";"";"";"";"";"";"-";"";"";"";"";"";"";"";"";"";"";"";"";"1";""
"NewEleven for Mom - Gifts for Mama Birthday, Christmas - Birthday Gifts for Mother from Daughter, Son, Child - New Mother Gift, Mom to Be Gift - Ceramic Christmas Ornaments COG: 1,19 / Price: 6,99";"B0DLV94K7D";"LS-GUGX-Z9QL";"";"";"";"";"";"";"";"";"";"";"";"";"-";"";"";"";"";"";"";"";"";"";"";"";"";"1";""
"NewEleven Retirement Ornament - Funny Retirement Gifts for Woman - Christmas Tree Decoration for Mom, Nurse, Teacher, Coworker & Friends COG: 2,17 / Price: 7,99";"B0DLVS7R7V";"O5-LD0Y-FJ4W";"";"";"";"";"";"";"";"";"";"";"";"";"-";"";"";"";"";"";"";"";"";"";"";"";"";"1";""
"NewEleven for Girl Mom - Pregnancy Gifts, Gender Reveal Idea for Pregnant, Expecting Mother, Mama, Mom to Be, Mommy to Be, First Time Mama - Ceramic Christmas Ornaments COG: 0,94 / Price: 6,99";"B0DLVSLFY6";"RZ-LTWM-2Q4L";"";"";"";"";"";"";"";"";"";"";"";"";"-";"";"10,15";"-4,7";"";"5,45";"5,45";"10,15";"";"";"115,96";"";"";"";""
"NewEleven House Warming Gifts, New Home Ornament 2025, Dream Home Gift Ideas Decor - Welcome Home Gifts, Housewarming Gift New Home, Best Housewarming Presents 2025 - Glass Ornament COG: 2,33 / Price: 9,99";"B0DPM5JXP7";"BK-7AQP-YXO7";"";"";"";"";"";"";"";"";"";"";"";"";"-";"";"";"";"";"";"";"";"";"";"";"";"";"6";""
"NewEleven Gifts For Him, Her - Gift For Men, Dad, Husband, Friend - Thank You, Appreciation, Graduation Present For Men, Boss, Coworker, Teacher - 14 Oz Self Stirring Mug COG: 8,36 / Price: 15,99";"B0DQ59YSW3";"YB-7AHW-E7CH";"";"";"";"";"";"";"";"";"";"";"";"";"100";"8,36";"";"";"";"8,36";"8,36";"";"";"";"";"";"";"1";""
"NewEleven 50th Birthday Gifts for Her COG: 2,2 / Price: 4,99";"B0DQ8L1DQW";"5L-JJQW-3R4J";"";"";"";"";"";"";"";"";"";"";"";"";"-";"";"";"";"";"";"";"";"";"";"";"";"";"1";""
"NewEleven Engagement Gifts for Couples 2025 - Gift for Newly Engaged Couples, Happy Engagement Gifts for Her, Women, Friends, Bride to Be Gift, Glass Christmas Ornaments COG: 2,1 / Price: 9,99";"B0DR1SNKVX";"4L-EMQE-OQ2Y";"";"";"";"";"";"";"";"";"";"";"";"";"-";"";"";"";"";"";"";"";"";"";"";"";"";"11";""
"NewEleven Wedding Gifts - Mr and Mrs, Bridal Shower Decorations - Wedding Gifts for Couples 2025, Bride Gift for Friends - Just Married Glass 2025 Ornament COG: 1,81 / Price: 9,99";"B0DRT2D2ZB";"GU-M8AT-5NTK";"";"";"";"";"";"";"";"";"";"";"";"";"-";"";"";"";"";"";"";"";"";"";"";"";"";"12";""
"NewEleven Nurse Gifts For Women, Nursing Student, Nurses Practitioner, Registered Nurses - Nurse Appreciation Gifts For Women From Friends, Family And Coworker - 20 Oz Tumbler COG: 3,5 / Price: 12,98";"B0DWN2GX75";"P3-U5Q5-Y2JP";"";"";"";"";"";"";"";"";"";"";"";"";"-";"";"";"";"";"";"";"";"";"";"";"";"";"6";""
"NewEleven Nurse Gifts For Women, Nursing Student, Nurses Practitioner, Registered Nurse - Gifts For Nurses From Friend, Family And Coworker - 16 Oz Coffee Glass COG: 2,43 / Price: 9,99";"B0DWN3SH33";"C0-X5FU-OU85";"";"";"";"";"";"";"";"";"";"";"";"";"-";"";"";"";"";"";"";"";"";"";"";"";"";"16";""
"NewEleven Gifts For Mom From Husband Daughter, Son - Mom Birthday Gifts, Unique Present For Wife, Mama, Women - 20 Oz Tumbler COG: 3,5 / Price: 16,98";"B0DXVPDSJK";"KE-3OXS-UDHH";"";"";"";"";"";"";"";"";"";"";"";"";"-";"";"";"";"";"";"";"";"";"";"";"";"";"49";""
"NewEleven Gift For Teachers - Teacher Appreciation Gifts For Women, New Teachers - Teacher Gifts For Women From Student, Friends, Family And Coworker - 20 Oz Tumbler COG: 3,42 / Price: 12,98";"B0DYDZFRZD";"4E-EG59-NN41";"";"";"";"";"-4,32";"-4,32";"";"";"";"";"";"";"-";"";"";"";"";"-4,32";"-4,32";"-4,32";"";"";"";"";"";"8";""
"NewEleven Birthday Gifts for Dad from Daughter, Son, Wife - First Time Present for Father, Men, Girl Dads Hat - Trucker Hat COG: 2,67 / Price: 17,98";"B0DYJ45P7Q";"QF-PTRY-DG2W";"";"";"";"";"";"";"";"";"";"";"";"";"-";"";"";"";"";"";"";"";"";"";"";"";"";"6";""
"NewEleven Fathers Day Gift For Dad - Funny Present For Father, Men - Dad Birthday Gift, Unique Father Gifts From Daughter, Son, Kid, Wife - 20 Oz Tumbler Navy COG: 3,5 / Price: 16,98";"B0F17F23MZ";"R8-7X5D-8W4W";"";"";"";"";"";"";"";"";"";"";"";"";"-";"";"";"";"";"";"";"";"";"";"";"";"";"1";""
"NewEleven Grandpa Gifts - Fathers Day Gift For Grandpa, Birthday Gifts For Grandfather, Papa - Grandfather Gift Ideas From Granddaughter, Grandson, Kids - 20 Oz Tumbler COG: 3,42 / Price: 16,98";"B0F17MLPQ4";"M0-BMOU-WK4K";"";"";"";"";"";"";"";"";"";"";"";"";"-";"";"";"";"";"";"";"";"";"";"";"";"";"4";""
"NewEleven Gifts For Dad - Funny Present For Father, Men - Dad Birthday Gift, Unique Father Gifts From Daughter, Son, Kid, Wife - 20 Oz Tumbler Black COG:  / Price: 0";"B0F1FWGNH8";"";"";"";"";"";"";"";"";"";"";"";"";"";"-";"";"";"";"";"";"";"";"";"";"";"";"";"3";""
"NewEleven Mothers Day Card, Cat Mom Gifts For Women, Cat Themed Gift, Best Cat Mom Ever For Mother's Day, Best Gifts For Cat Lovers Female, Unique Cats Lady Presents - Greeting Card COG: 0,42 / Price: 7,99";"B0F2TD7W6G";"1N-AZA8-HSBA";"";"";"";"";"";"";"";"";"";"";"";"";"-";"";"";"";"";"";"";"";"";"";"";"";"";"1";""
"NewEleven Birthday Card For Dad - Fathers Day Gift, Dad Gifts From Daughter, Son, Wife - Funnny Present, Dads Gift Idea For Bonus Dads, Father, Father In Law - Greeting Card COG: 0,44 / Price: 7,99";"B0F59S8H6T";"IA-GG14-LH7P";"";"";"";"";"";"";"";"";"";"";"";"";"-";"";"";"";"";"";"";"";"";"";"";"";"";"1";""
"NewEleven Gifts For Dad - Fathers Day Card For Dad, Birthday Present For Dads, Bonus Dads - Fathers Day Card From Daughter, Son, Kid, Wife - Humorous Greeting Card COG: 0,44 / Price: 4,99";"B0F59S997T";"F0-2QAC-J9UH";"";"";"";"";"";"";"";"";"";"";"";"";"-";"";"-4,12";"0,44";"";"-3,68";"-3,68";"-4,12";"";"";"836,36";"";"";"1";""
"NewEleven Birthday Card For Dad - Fathers Day Gift, Heartfelt Present For Dads, Bonus Dads, Father In Law - Dad Birthday Gift From Daughter, Son, Kid, Wife - Greeting Card COG: 0,44 / Price: 7,99";"B0F59VGXBY";"4N-OLIJ-V92Z";"";"";"";"";"";"";"";"";"";"";"";"";"-";"";"";"";"";"";"";"";"";"";"";"";"";"3";""
"NewEleven Step Dad Gifts - Father's Day Gifts From Stepson, Daughter - Bonus Dad Card Fathers Day, Funny Gift For Step Dads, Bonus Dads - Humorous Greeting Card COG: 0,44 / Price: 7,99";"B0F59VQYH5";"7S-2VCY-1SM3";"";"";"";"";"";"";"";"";"";"";"";"";"-";"";"";"";"";"";"";"";"";"";"";"";"";"1";""
"NewEleven Husband Gift - Romantic Gifts, Father's Day Gifts For Husband From Wife - Unique Present, Heartfelt Message, Fathers Day Card For Husbands - Greeting Card COG: 0,44 / Price: 7,99";"B0F59VYMYR";"4N-UKMX-U3ON";"";"";"";"";"";"";"";"";"";"";"";"";"-";"";"";"";"";"";"";"";"";"";"";"";"";"1";""
"NewEleven Dad Birthday Gift - Meaningful Present For Dads, Bonus Dads - Cute Dad Birthday Card, Fathers Day Card From Son, Daughter, Favorite Kids - Greeting Card COG: 0,44 / Price: 7,99";"B0F59X5XB6";"BQ-8IHB-2PJV";"";"";"";"";"";"";"";"";"";"";"";"";"-";"";"";"";"";"";"";"";"";"";"";"";"";"2";""
"NewEleven Gifts For Son - Meaningful Fathers Day Card For Son From Mom And Dad - Unique Present, Heartfelt Messeage, Father's Day Gifts For Sons, Dad First Time - Greeting Card COG: 0,44 / Price: 7,99";"B0F59X7WSH";"H2-9Z1Y-AGEF";"";"";"";"";"";"";"";"";"";"";"";"";"-";"";"";"";"";"";"";"";"";"";"";"";"";"2";""
