"Product";"ASIN";"SKU";"Units";"Refunds";"Sales";"Promo";"Ads";"Sponsored products (PPC)";"Sponsored Display";"Sponsored brands (HSA)";"Sponsored Brands Video";"Google ads";"Facebook ads";"% Refunds";"Sellable Quota";"Refund сost";"Amazon fees";"Cost of Goods";"Shipping";"Gross profit";"Net profit";"Estimated payout";"Expenses";"Margin";"ROI";"BSR";"Real ACOS";"Sessions";"Unit Session Percentage"
"NewEleven Nurse Gifts For Women, Nursing Student, Nurses Practitioner, Registered Nurse - Gifts For Nurses From Friend, Family And Coworker - 16 Oz Coffee Glass COG: 2,43 / Price: 9,99";"B0DWN3SH33";"C0-X5FU-OU85";"1";"";"14,99";"";"";"";"";"";"";"";"";"";"-";"";"-7,47";"-2,43";"";"5,09";"5,09";"7,52";"";"33,96";"209,47";"30 797";"";"20";"5,00"
"NewEleven Gifts For Mom, Gifts Cards For Mommy From Daughter, Son, Kids - Funny Present For Birthday, Humorous Mom Greeting Card COG: 0,42 / Price: 7,99";"B0F2T6J36X";"JU-SXX5-LD1M";"1";"";"7,99";"";"";"";"";"";"";"";"";"";"-";"";"-3,61";"-0,42";"";"3,96";"3,96";"4,38";"";"49,56";"942,86";"49 720";"";"2";"50,00"
"NewEleven Dad Birthday Gift - Meaningful Present For Dads, Bonus Dads - Cute Dad Birthday Card, Fathers Day Card From Son, Daughter, Favorite Kids - Greeting Card COG: 0,44 / Price: 7,99";"B0F59X5XB6";"BQ-8IHB-2PJV";"1";"";"7,99";"";"";"";"";"";"";"";"";"";"-";"";"-3,61";"-0,44";"";"3,94";"3,94";"4,38";"";"49,31";"895,45";"10 818";"";"5";"20,00"
"NewEleven Dad Birthday Card - Gifts For Dad From Daughter, Son, Kid - Father's Day Gift Idea For Dads, Bonus Dads - Humorous Greeting Card COG: 0,44 / Price: 7,99";"B0F59YJV71";"50-79MF-SYWH";"1";"";"7,99";"-0,4";"-22,76";"-22,76";"";"";"";"";"";"";"-";"";"-3,54";"-0,44";"";"-19,15";"-19,15";"-18,71";"";"-239,67";"-4 352,27";"10 801";"284,86";"31";"3,23"
"NewEleven Uncle Birthday Gifts - Gift For Uncle, Funcle - Meaningful Present, Birthday Gift For Uncles From Newphew, Niece, Kids - Bible Jar COG: 2,62 / Price: 17,98";"B0F7WYS1R1";"YA-B9EW-YOZ9";"1";"";"18,98";"";"";"";"";"";"";"";"";"";"-";"";"-7,04";"-2,62";"";"9,32";"9,32";"11,94";"";"49,10";"355,73";"18 725";"";"13";"7,69"
"NewEleven Gifts For Grandma - Christian Gift, Nana Gift, Grandma Birthday Gifts From Granddaughter, Grandson, Kids - Decorative Glass Inspirational Scripture Jar with 92 Bible Verse COG: 0 / Price: 17,98";"B0FBQZZK71";"RW-PY02-EIMY";"1";"";"17,98";"";"";"";"";"";"";"";"";"";"-";"";"-7,52";"";"";"10,46";"10,46";"10,46";"";"58,18";"";"";"";"4";"25,00"
"NewEleven Dog Dad Gifts For Men - Humorous Present, Cute Birthday Gifts For Dog Lovers, Husband, Him - Funny Dog Dad Card From Friend, Family - Greeting Card COG: 0,39 / Price: 6,99";"B0FC5TBFWB";"60-KN47-M9LV";"1";"";"6,99";"-0,35";"";"";"";"";"";"";"";"";"-";"";"-3,39";"-0,39";"";"2,86";"2,86";"3,25";"";"40,92";"733,33";"10 801";"";"10";"10,00"
"NewEleven Boss Gifts For Women, Men - Boss Birthday Card, Thank You Gift, Heartfelt Message For Leader - Appreciation Present For Manager Form Colleague, Coworker - Greeting Card COG: 0,39 / Price: 4,99";"B0FC5W1QX7";"SS-6UAT-LTMJ";"1";"";"4,99";"";"-6,57";"-6,57";"";"";"";"";"";"";"-";"";"-3,12";"-0,39";"";"-5,09";"-5,09";"-4,7";"";"-102,00";"-1 305,13";"3 015";"131,66";"25";"4,00"
"NewEleven Thank You Cards - Teacher Appreciation Gifts, Thanks You Present For Friend, Teacher, Boss - Thank You Gifts For Women, Men From Bestie, Family, Colleague - Greeting Card COG: 0,39 / Price: 4,99";"B0FC6CNPQK";"4R-QNTR-6X4P";"1";"";"4,99";"";"";"";"";"";"";"";"";"";"-";"";"-3,12";"-0,39";"";"1,48";"1,48";"1,87";"";"29,66";"379,49";"3 005";"";"27";"3,70"
"NewEleven Gifts For Mom - Gifts For Mother, Women, Wife - Funny Best Birthday Gift Ideas For Wife, New Mama, Bonus Mama, Mom To Be, Mother In Law - 12 Oz Tumbler COG: 3,76 / Price: 15,98";"B07Y7ZQ265";"F1-10S9-NASK";"";"";"";"";"";"";"";"";"";"";"";"";"-";"";"";"";"";"";"";"";"";"";"";"9 016";"";"9";""
"NewEleven Fathers Day Gift For Dad From Daughter, Son, Kids - Birthday Gift For Dad, Husband, Men - Best Present Idea For Father, Husband, Bonus Father From Daughter, Son, Wife - 20 Oz Tumbler COG:  / Price: 0";"B088GX79HT";"";"";"";"";"";"";"";"";"";"";"";"";"";"-";"";"";"";"";"";"";"";"";"";"";"25 757";"";"3";""
"NewEleven 50th Birthday Gifts For Men Women - 1975 50th Birthday Decorations For Men Women - Gifts For Women Turning 50-50 Year Old Gift For Men, Woman, Mom, Dad, Wife, Husband - 20 Oz Tumbler COG: 4,65 / Price: 14,99";"B08R8SW1NM";"IW-9AEL-FYY3";"";"";"";"";"";"";"";"";"";"";"";"";"-";"";"";"";"";"";"";"";"";"";"";"23 809";"";"9";""
"NEWELEVEN Coworker Leaving Gift - Farewell, Going Away, New Job, Goodbye, Good Luck for Colleagues, Boss, Men, Women, Friends - 20 Oz Tumbler COG: 4,76 / Price: 19,98";"B08Y8RZRHG";"31-PNFY-F78S";"";"";"";"";"";"";"";"";"";"";"";"";"-";"";"";"";"";"";"";"";"";"";"";"25 000";"";"12";""
"NewEleven 20 Oz Tumbler - Christmas Gifts for Dad from Kids COG:  / Price: 0";"B08ZKZ1FJK";"";"";"";"";"";"";"";"";"";"";"";"";"";"-";"";"";"";"";"";"";"";"";"";"";"25 757";"";"6";""
"NewEleven Fathers Day Gift For Grandpa From Granddaughter, Grandson - Birthday Present Ideas For Grandfather, New Grampa, Promoted To Grandfather, Grandchildren, Grandkid - 20 Oz Tumbler COG: 4,77 / Price: 19,98";"B094CFGN42";"DW-NMEH-X37K";"";"";"";"";"";"";"";"";"";"";"";"";"-";"";"";"";"";"";"";"";"";"";"";"25 916";"";"3";""
"NewEleven Retirement Gifts For Woman 2025 - Retired Gift For Coworker Leaving - Farewell, Goodbye Presents For Women, Coworkers, Friends - 20 Oz Tumbler COG: 5,1 / Price: 17,98";"B095S16WV3";"VG-MZ2S-KBWR";"";"";"";"";"";"";"";"";"";"";"";"";"-";"";"";"";"";"";"";"";"";"";"";"30 248";"";"7";""
"NewEleven Gifts For Mom From Daughter, Son, Kids - Unique Birthday Gift For Mom Wife, New Mother, Bonus Mama, Pregnant Mama - Funny Gifts Ideas For Mum - 20 Oz Tumbler COG: 4,2 / Price: 16,98";"B097B9H21P";"YP-SEHP-8NOP";"";"";"";"";"";"";"";"";"";"";"";"";"-";"";"";"";"";"";"";"";"";"";"";"5 309";"";"9";""
"NewEleven Christmas Gift For Dad - Birthday Gifts For Dad From Daughter, Son, Kids - Husband Gifts - Birthday Present Ideas For Father, Husband, New Dad, Bonus Dad From Daughter, Son - 20 Oz Tumbler COG:  / Price: 0";"B097B9SY89";"";"";"";"";"";"";"";"";"";"";"";"";"";"-";"";"";"";"";"";"";"";"";"";"";"25 916";"";"3";""
"NewEleven Gift For Uncle From Niece, Nephew - Funny Unkie Gift, Uncle Birthday Gifts - Best Present For New Uncles, Funcle, Unky Announcement - 20 Oz Tumbler COG: 4,29 / Price: 19,98";"B097H6PJCN";"C5-L2Z6-TAT4";"";"";"";"";"";"";"";"";"";"";"";"";"-";"";"";"";"";"";"";"";"";"";"";"";"";"4";""
"Neweleven Replacement Lid For 20 Oz NewEleven Tumbler - Pack of 2 lids COG: 0,96 / Price: 9,98";"B0995JRMHP";"O1-FU7J-W72I";"";"";"";"";"";"";"";"";"";"";"";"";"-";"";"";"";"";"";"";"";"";"";"";"162 258";"";"2";""
"NewEleven Retirement Gifts For Woman 2025 - Happy Retirement Gifts For Coworker Leaving - Farewell, Goodbye Presents For Women, Coworkers, Friends - 20 Oz Tumbler COG: 4,82 / Price: 19,98";"B09XDFLNR8";"74-78DN-W52B";"";"";"";"";"";"";"";"";"";"";"";"";"-";"";"";"";"";"";"";"";"";"";"";"30 327";"";"5";""
"NewEleven Retirement Gifts For Men Women 2025 - Retirement Party Decorations - Retired Presents For Coworker Leaving, Men, Retired People, Coworkers, Friends - 20 Oz Tumbler COG: 4,48 / Price: 19,98";"B09YCTFXYV";"KG-HY7Y-VD9N";"";"";"";"";"";"";"";"";"";"";"";"";"-";"";"";"";"";"";"";"";"";"";"";"30 173";"";"10";""
"NEWELEVEN 16 Oz Coffee Glass - Mama Needs Coffee - Transparent Glass - Reusable - 16 oz - Casual - Cold Drinks - Christmas, Mother's Day, Birthday - 1 Count COG: 2,55 / Price: 16,99";"B0B9SF2R4R";"SB-OEYK-4VNP";"";"";"";"";"";"";"";"";"";"";"";"";"-";"";"";"";"";"";"";"";"";"";"";"28 707";"";"11";""
"NewEleven Gifts For Sister - Unique Birthday Present For Sisters, Soul Sis, Big, Little Sister, Sisters In Law, Sibling, Bestie - 16 Oz Coffee Glass COG: 2,04 / Price: 15,98";"B0BC8WBYW7";"U3-HSBK-1RJI";"";"";"";"";"";"";"";"";"";"";"";"";"-";"";"";"";"";"";"";"";"";"";"";"46 788";"";"1";""
"NewEleven Gifts For Women Friendship - Funny Gifts For Friends Female - Unique Friendship Present For Her, Female, Bestie, Bff, Soul Sister, Work Bestie - 16 Oz Coffee Glass COG: 2,29 / Price: 15,98";"B0BRB5SPYZ";"25-YAS2-RJHI";"";"";"";"";"";"";"";"";"";"";"";"";"-";"";"";"";"";"";"";"";"";"";"";"19 619";"";"5";""
"NewEleven Gifts For Sister - Unique Birthday Present For Soul Sister, Big, Little Sis, Sisters In Law, Sibling, Bestie - 16 Oz Coffee Glass COG: 2,03 / Price: 15,98";"B0BRB6J55H";"OW-SAUE-CM7G";"";"";"";"";"";"";"";"";"";"";"";"";"-";"";"";"";"";"";"";"";"";"";"";"46 788";"";"2";""
"NewEleven Christmas Gifts For Women Friendship - Funny Gifts For Friends Female - Unique Friendship Gift For Women, Friend, Female, Bestie, Bff, Soul Sister, Work Bestie - 16 Oz Coffee Glass COG:  / Price: 0";"B0BRCDZRSP";"";"";"";"";"";"";"";"";"";"";"";"";"";"-";"";"";"";"";"";"";"";"";"";"";"19 543";"";"11";""
"NewEleven Gifts For Sister From Sisters, Brother - Unique Birthday Present, Soul Sister, Big Sis Little Sis, Sisters In Law, Sibling, Bestie - 16 Oz Coffee Glass COG: 2,02 / Price: 15,98";"B0BYCSHGYX";"LB-UB38-W1AN";"";"";"";"";"";"";"";"";"";"";"";"";"-";"";"";"";"";"";"";"";"";"";"";"46 788";"";"2";""
"NewEleven Cute Glass Coffee Cups With Lids And Straw – Aesthetic Cups – Iced Coffee Cup, Coffees Tumbler – Galentines Gifts For Women, Coffees Lover - 16 Oz Coffee Glass COG: 2,33 / Price: 14,98";"B0C1BS7BV8";"8N-VAIO-VFH3";"";"";"";"";"";"";"";"";"";"";"";"";"-";"";"";"";"";"";"";"";"";"";"";"19 577";"";"15";""
"NewEleven Cute Cups With Lids And Straw – Aesthetic Cups – Iced Java Cup, Coffee Tumbler, Glass Tumbler – Galentines Gifts For Women, Java Lover - 16 Oz Coffee Glass COG: 2,86 / Price: 12,34";"B0C1C1F4M4";"Z2-BJ5R-5S3M";"";"";"";"";"";"";"";"";"";"";"";"";"-";"";"";"";"";"";"";"";"";"";"";"19 543";"";"4";""
"NewEleven Gifts For Her - Cow Gifts For Women - Stuff For Cow Lovers - Cute Funny Birthday Gift For Women, Best Friend, Sister, Daughter, Coworker - 16 Oz Coffee COG: 2,29 / Price: 14,98";"B0C242DYT4";"OX-EHPQ-U3LT";"";"";"";"";"";"";"";"";"";"";"";"";"-";"";"";"";"";"";"";"";"";"";"";"145 030";"";"1";""
"NewEleven Gifts For Sister From Sister, Brother - Unique Birthday Present For Sisters, Soul Sis, Big, Little Sisters, Sis In Law, Sibling, Bestie - 16 Oz Coffee Glass COG: 2,13 / Price: 16,98";"B0C9C5VX7S";"T8-BRCL-CEUK";"";"";"";"";"";"";"";"";"";"";"";"";"-";"";"";"";"";"";"";"";"";"";"";"46 788";"";"7";""
"NewEleven Gifts For Friends, Bestie – Work Bestie Presents For Women Friends - Appreciation Gifts For Coworkers, Unique Present Ideas For Coworker Leaving, Farewell Party – 16 Oz Coffee Glass COG: 2,17 / Price: 14,98";"B0CBJQZCFY";"2D-H3QH-UR6F";"";"";"";"";"";"";"";"";"";"";"";"";"-";"";"";"";"";"";"";"";"";"";"";"19 577";"";"9";""
"NewEleven Coworker Leaving Gifts - Farewell, Going Away Gift For Coworker - New Job, Goodbye, Good Luck Gifts For Coworkers, Colleagues, Boss, Men, Women, Friends - 20 Oz Tumbler COG: 3,71 / Price: 19,98";"B0CDLPSMGF";"CO-C7X6-C1NV";"";"";"";"";"";"";"";"";"";"";"";"";"-";"";"";"";"";"";"";"";"";"";"";"25 000";"";"12";""
"NewEleven Gifts For Men, Dad, Husband, Friend - Birthday Gift For Women, Men - Thank You Gifts, Appreciation Gift, Graduation Presents For Men, Nurse, Teacher, Boss, Coworker – 20 Oz Tumbler COG: 3,66 / Price: 16,98";"B0CDLQFJK6";"EH-49BE-XWTF";"";"";"";"";"";"";"";"";"";"";"";"";"-";"";"";"";"";"";"";"";"";"";"";"5 258";"";"8";""
"NewEleven Gifts For Women – Chaos Coordinator Gifts For Women, Boss, Manager, Coworker, Best Friend - Appreciation, Inspirational Gift For Teacher, Nurse, Social Worker – 20 Oz Tumbler COG: 3,87 / Price: 17,98";"B0CFQ4CDD5";"7K-U1QW-2RDX";"";"";"";"";"";"";"";"";"";"";"";"";"-";"";"";"";"";"";"";"";"";"";"";"53 171";"";"4";""
"NewEleven Fathers Day Gift For Dad - Cool Dad Gifts From Daughter - Unique Birthday Present Ideas For Father, Husband, Bonus Father, Step Papa, New Papa From Daughter - 20 Oz Tumbler COG: 3,56 / Price: 17,98";"B0CJLF7CW6";"JY-5OP2-ZVFB";"";"";"";"";"-4";"-4";"";"";"";"";"";"";"-";"";"";"";"";"-4,00";"-4,00";"-4";"";"";"";"25 916";"";"5";""
"NewEleven Fathers Day Gift For Dad - Cool Dad Gifts From Daughter - Unique Birthday Present Ideas For Father, Husband, Bonus Papa, Step Father, New Papa From Daughter - 20 Oz Tumbler COG: 3,63 / Price: 19,98";"B0CJLM3SV5";"5B-L34H-TU17";"";"";"";"";"";"";"";"";"";"";"";"";"-";"";"";"";"";"";"";"";"";"";"";"26 059";"";"2";""
"NewEleven Birthday Gifts For Men, Women - Gifts For Dad, Grandpa, Husband - Thank You Gift, Appreciation Gift, Best Birthday Present For Dad, Father, Boss, Coworker, Teacher - Beer Mug COG: 0 / Price: 12,99";"B0CKYL86S1";"TQ-XEIJ-MYZO";"";"";"";"";"";"";"";"";"";"";"";"";"-";"";"";"";"";"";"";"";"";"";"";"275 030";"";"2";""
"NEWELEVEN Christmas Book Lovers Gifts for Women, Friends - Bookshelf Cup, Accessories for Writers, Readers, Librarian, Bookaholic, Bookworm - 16 Oz Coffee Glass COG:  / Price: 0";"B0CKYMNV39";"";"";"";"";"";"";"";"";"";"";"";"";"";"-";"";"";"";"";"";"";"";"";"";"";"39 267";"";"17";""
"NewEleven Birthday Gifts For Men, Women - Funny Gag Gifts Ideas For Dad, Mom, Grandpa, Grandma, Husband, Wife, Uncle, Him - 40th 50th 60th 70th 80th Birthday Gifts For Men Women – 20 Oz Tumbler COG: 3,76 / Price: 16,99";"B0CLYSGX7Q";"OA-DGFL-ZKWU";"";"";"";"";"";"";"";"";"";"";"";"";"-";"";"";"";"";"";"";"";"";"";"";"8 993";"";"2";""
"NewEleven Fathers Day Gift For Dad - Birthday Gifts For Dad From Daughter - Husband Gifts - Unique Birthday Present Ideas For Father, Husband, New Papa, Bonus Father From Daughter - 20 Oz Tumbler COG: 3,19 / Price: 19,98";"B0CM5R5BDX";"WC-3I7C-6VN5";"";"";"";"";"";"";"";"";"";"";"";"";"-";"";"";"";"";"";"";"";"";"";"";"25 757";"";"2";""
"NewEleven Dad Gifts - Birthday Gifts For Dad From Daughter - Husband Gift - Unique Birthday Present Ideas For Father, Husband, New Papa, Bonus Father From Daughter - 20 Oz Tumbler COG: 3,19 / Price: 15,98";"B0CM5RY3QS";"J7-CYQ3-G6E8";"";"";"";"";"";"";"";"";"";"";"";"";"-";"";"";"";"";"";"";"";"";"";"";"";"";"1";""
"NewEleven Fathers Day Gift For Dad, Men - Funny Birthday Gifts For Dad, Men, Car Guys - Unique Present Idea For Father, Papa, Husband, Uncle, Guys From Daughter, Son, Kids, Wife - 20 Oz Tumbler COG: 3,93 / Price: 19,98";"B0CNTFTNT9";"MO-1909-MXZY";"";"";"";"";"";"";"";"";"";"";"";"";"-";"";"";"";"";"";"";"";"";"";"";"5 284";"";"1";""
"NewEleven Gifts For Grandma - Grandma Gifts From Granddaughter, Grandson - Birthday Gift For Grandmother, Nana, Gigi, Mimi, Grammy From Grandchildren, Grandchild - 20 Oz Tumbler COG: 3,62 / Price: 17,98";"B0CQ2K12H3";"RR-GSRH-DCUL";"";"";"";"";"";"";"";"";"";"";"";"";"-";"";"";"";"";"";"";"";"";"";"";"5 284";"";"7";""
"NewEleven Gifts For Grandma - Grandmother Birthday Gifts, Gift for Grandma From Granddaughter Grandson - Presents For Nana, Gigi, Mimi, Grammy, New Grandmother - 20 Oz Tumbler COG: 3,5 / Price: 16,98";"B0CRKR75LJ";"XF-QHNV-2YN6";"";"";"";"";"";"";"";"";"";"";"";"";"-";"";"";"";"";"";"";"";"";"";"";"5 258";"";"5";""
"NewEleven Gifts For Aunt From Niece, Nephew - Cool Gifts For Aunt, New Aunts, Sister - Aunts Birthday Gift, Auntie Announcement, Promoted To Auntie, Best Aunties Ever - 20 Oz Tumbler COG: 3,56 / Price: 14,98";"B0CWTR4RFZ";"KH-DRF5-O4UX";"";"";"";"";"";"";"";"";"";"";"";"";"-";"";"";"";"";"";"";"";"";"";"";"";"";"1";""
"NewEleven Gifts For Him, Men - Fishing Gifts For Men, Dad, Cup Gift For Fisherman, Father - Dad Birthday Gift From Wife, Kids - 20 Oz Tumbler COG: 3,41 / Price: 17,98";"B0CY4HY9KC";"KK-1KUK-ZBSZ";"";"";"";"";"";"";"";"";"";"";"";"";"-";"";"";"";"";"";"";"";"";"";"";"";"";"3";""
"NewEleven 40th Birthday Gifts For Women - 40s Birthday Decorations For Women - 40 Year Old Gifts For Her, Woman, Sister, Mom, Daughter, Best Friend - In My Forties Era Glass - 16 Oz Coffee Glass COG: 2,61 / Price: 15,98";"B0CYPWBV21";"SB-QEC6-U9NU";"";"";"";"";"-10,7";"-10,7";"";"";"";"";"";"";"-";"";"";"";"";"-10,70";"-10,70";"-10,7";"";"";"";"9 050";"";"18";""
"NewEleven Fathers Day Gift For Dad From Daughter Son Kids - Gift For Dad, Father, Step Father - Funny Birthday Gifts For Father - 20 Oz Tumbler COG: 3,38 / Price: 19,98";"B0CZRZTBMT";"DJ-XD9G-NIPY";"";"";"";"";"";"";"";"";"";"";"";"";"-";"";"";"";"";"";"";"";"";"";"";"25 757";"";"2";""
"NewEleven Gifts For Nurse - Nursing Graduation Gift For Women Her - Caregiver Appreciation Gifts, Nursing Student, New Nurses, Nurse Practitioner, RN - 16 Oz Coffee Glass COG: 2,68 / Price: 9,99";"B0D1GF81G8";"WJ-F0KW-EYOB";"";"";"";"";"";"";"";"";"";"";"";"";"-";"";"4,27";"";"";"4,27";"4,27";"4,27";"";"";"";"30 790";"";"14";""
"NewEleven 40th Birthday Gifts Women Men - 1985 40th Birthday Decorations For Men Women - Gifts For Men Women Turning 40-40 Year Old Gift For Man, Woman, Mom, Dad, Wife, Husband - 20 Oz Tumbler COG: 3,43 / Price: 14,98";"B0D1GH6WJ6";"ZV-XJ69-4UIW";"";"";"";"";"";"";"";"";"";"";"";"";"-";"";"";"";"";"";"";"";"";"";"";"23 809";"";"8";""
"NewEleven Gifts For Godmother - Will You Be My Godmother From GodChild - Pregnancy Announcement Gifts For Godmom, Godparents - 16 Oz Coffee Glass COG: 2,58 / Price: 17,98";"B0D2NSHWZK";"J5-EJIM-0Y8E";"";"";"";"";"";"";"";"";"";"";"";"";"-";"";"";"";"";"";"";"";"";"";"";"53 457";"";"5";""
"NewEleven 21st Birthday Gifts For Women, Her - 2004 Birthday Decorations - 21 Year Old Gifts Ideas For Women, Her, Daughter, Sister, Best Friends - 16 Coffee Glass COG: 3,66 / Price: 16,98";"B0D39T2MVK";"73-AOV6-10DJ";"";"";"";"";"";"";"";"";"";"";"";"";"-";"";"";"";"";"";"";"";"";"";"";"9 056";"";"10";""
"NewEleven Thank You Gifts for Women Men - Teachers Appreciation Gift, Employee Appreciation Present for Coworker Boss Mentor Teacher Nurse Retirement Birthday, Motivational Presents - Ceramic Ornament COG: 0,85 / Price: 7,99";"B0D5ZVC8SM";"C3-ASG0-0I4S";"";"";"";"";"";"";"";"";"";"";"";"";"-";"";"4,06";"-1,7";"";"2,36";"2,36";"4,06";"";"";"138,82";"348 501";"";"";""
"NewEleven Teacher Appreciation Gifts - Difference Maker Gift for Friend, Co-Worker, Boss - Motivational, Graduation Gifts for Women - Goodbye Gift for Coworkers - Scented Candle COG: 5,58 / Price: 15,98";"B0D72QM578";"8M-I3B0-E0CI";"";"";"";"";"";"";"";"";"";"";"";"";"-";"";"";"";"";"";"";"";"";"";"";"353 299";"";"2";""
"NewEleven Pregnancy Announcement for Husband Wife Family, Gender Reveal Gifts, Pregnancy Gifts for Expecting Mom, for New Mom, New Dad, New Parents - Ornament COG: 0,9 / Price: 7,99";"B0D72Z4996";"FB-GMDU-EXTV";"";"";"";"";"";"";"";"";"";"";"";"";"-";"";"";"";"";"";"";"";"";"";"";"92 809";"";"3";""
"NewEleven 25th Wedding 25th Anniversary Decorations, Wedding for Couple, Parents, Him, Her - Glass Christmas Ornament COG: 2,18 / Price: 5,99";"B0D7HNDG8Y";"RR-R416-X1G0";"";"";"";"";"";"";"";"";"";"";"";"";"-";"";"";"";"";"";"";"";"";"";"";"1 596 136";"";"1";""
"NewEleven Baby's First Christmas Ornament 2024 - Baby Picture Frame Newborn Gift, First Time Parents Present, Family of Three First for New Parents - Double-Sided Printing Photo Frame Ornament COG: 1,34 / Price: 7,99";"B0D7MXLVWS";"4J-GBRB-06UY";"";"";"";"";"";"";"";"";"";"";"";"";"-";"";"";"";"";"";"";"";"";"";"";"567 417";"";"1";""
"NewEleven Gifts for Book Lovers, Reading Accessories Gift, Bookish Gifts Candles for Women Her, Books Club Gift, Bookish Items Presents for Readers Librarians Bookworm - Reading Book Candle COG: 6,74 / Price: 17,98";"B0D83SHR3X";"G3-8OQB-7E7S";"";"";"";"";"";"";"";"";"";"";"";"";"-";"";"";"";"";"";"";"";"";"";"";"175 059";"";"1";""
"NEWELEVEN Retirement Angel Figurine 2024 - Retirement Gift for Women, Nurse, Teacher, Doctor - Classic, Light Color COG: 3,16 / Price: 25,99";"B0DFBYSQTQ";"ZF-L7XO-E9LR";"";"";"";"";"";"";"";"";"";"";"";"";"-";"";"";"";"";"";"";"";"";"";"";"844 925";"";"2";""
"NewEleven 50th Birthday Gifts For Men Women - 1975 50th Birthday Decorations For Him Her - Present For Men Women Turning 50 Year Old Gifts For Mom, Dad, Wife, Husband - 20 Oz Tumbler COG: 3,45 / Price: 21,98";"B0DH83T7MF";"RP-GISO-TOFC";"";"1";"";"";"-9,61";"-9,61";"";"";"";"";"";"∞";"50";"-13,89";"";"";"";"-23,50";"-23,50";"-26,95";"";"";"";"9 006";"";"23";""
"NewEleven Sister 2025, Sister Birthday Gifts for Women, Big Sister Gifts for Girls - Gift for Women, Soul Sister, BFF, Big Sister Gift Glass Christmas Ornaments COG: 2 / Price: 5,99";"B0DJXZ36VG";"O2-5UU0-154U";"";"";"";"";"";"";"";"";"";"";"";"";"-";"";"";"";"";"";"";"";"";"";"";"528 437";"";"1";""
"NewEleven Christmas Book Lovers Gifts, Bookshelf Decor Present for Book Lovers Women, Librarian Gifts - Bookish Items Décor - Ceramic Christmas Orrnament COG: 1,1 / Price: 3,99";"B0DJY12521";"YS-AGM5-SUV4";"";"";"";"";"";"";"";"";"";"";"";"";"-";"";"";"";"";"";"";"";"";"";"";"564 474";"";"1";""
"NewEleven Gifts for Friends, BFF, Coworker for Women, Appreciation Gifts, Thank You for Women - Best Friend Birthday Gift - Glass Christmas Ornament 2025 COG: 2 / Price: 7,99";"B0DJY2BVJB";"R8-Q5WC-138Q";"";"";"";"";"";"";"";"";"";"";"";"";"-";"";"";"";"";"";"";"";"";"";"";"527 444";"";"1";""
"NewEleven Thank You Gifts for Women, Nurses, Teacher, Coworker, Friends - Gift for Women, Appreciation Present for Coworkers, Farewell, BFF, Woman, Men - Glass Christmas Ornaments COG: 1,9 / Price: 5,99";"B0DJY7689G";"2F-J6P4-R5IG";"";"";"";"";"";"";"";"";"";"";"";"";"-";"";"";"";"";"";"";"";"";"";"";"348 501";"";"2";""
"NewEleven Pet First Christmas Ornaments 2024, for Puppy Dog Cat Pet Lovers, Cat Dog Picture Frame Ornaments for Christmas Tree COG: 1,29 / Price: 5,99";"B0DJY79JYZ";"CE-YODW-3F5U";"";"";"";"";"";"";"";"";"";"";"";"";"-";"";"";"";"";"";"";"";"";"";"";"567 417";"";"1";""
"NewEleven Gifts for Dad, Love You Dad Gift Keepsake, Father Birthday Gift, Fun Birthday Gifts for Papa from Daughter, Son - Glass Heart Christmas Ornament COG: 2,16 / Price: 7,99";"B0DJZ5B6YZ";"X7-HY6C-XQAD";"";"";"";"";"";"";"";"";"";"";"";"";"-";"";"";"";"";"";"";"";"";"";"";"93 193";"";"2";""
"NewEleven Baptism Gifts for Girl & Boy, Decorations Ornament, Baby Dedication & Godchild Gift - Ceramic Christmas Ornaments COG: 0,95 / Price: 5,99";"B0DK11YCP5";"EF-QF2X-QCI3";"";"";"";"";"";"";"";"";"";"";"";"";"-";"";"";"";"";"";"";"";"";"";"";"677 079";"";"1";""
"NewEleven 40th Birthday Gifts Women, 1985 Gift, 40th Birthday Decorations for Women, Friends, Daughter, Sister Mom - 40 Ornament Keepsake - Ceramic Ornament COG: 0,9 / Price: 4,99";"B0DK11YM64";"02-HL2A-BSQP";"";"";"";"";"";"";"";"";"";"";"";"";"-";"";"-5,2";"";"";"-5,20";"-5,20";"-5,2";"";"";"";"3 494 192";"";"";""
"NewEleven Retirement Ornament, Funny Retired Gift for Woman Men, Retired Gifts for Women Mom Nurses Teacher Coworker Friends, Christmas Tree Decorations, First Retirement Christmas Ornament 2024 COG: 1,15 / Price: 5,99";"B0DK12WRBS";"48-I2ID-D1NR";"";"";"";"";"";"";"";"";"";"";"";"";"-";"";"";"";"";"";"";"";"";"";"";"680 673";"";"1";""
"NewEleven for Women, Friend Gifts for Women, for Woman - Best Friend Birthday Presents for Woman, BFF, Bestie, Soul Sister Gifts - Christmas Ornaments COG: 0,92 / Price: 4,99";"B0DK14C5XC";"VV-WPUX-6TUE";"";"";"";"";"";"";"";"";"";"";"";"";"-";"";"20,88";"-8,28";"";"12,60";"12,60";"20,88";"";"";"152,17";"527 444";"";"";""
"NewEleven Christmas Decorations Indoor - Family Christmas Ornaments 2025 for Mom, Dad, Sister, Brother - Funny Ceramic Tree Décor COG: 0,9 / Price: 5,99";"B0DK155YN3";"MW-Y980-J1MX";"";"";"";"";"";"";"";"";"";"";"";"";"-";"";"";"";"";"";"";"";"";"";"";"348 501";"";"1";""
"NewEleven Gifts for Women, Friendship, Friends, Birthday Gift for Friends Female BFF Old Best Friends, Best Friend Ornament, Bestie Ornament COG: 0,93 / Price: 7,99";"B0DK2YP1FB";"JR-LLGY-N975";"";"";"";"";"";"";"";"";"";"";"";"";"-";"";"";"";"";"";"";"";"";"";"";"347 746";"";"1";""
"NewEleven for Boy Mom - Pregnancy Gifts, Gender Reveal Idea for Pregnant, Expecting Mother, Mama, Mom to Be, Mommy to Be - Baby Boy Announcement Gift Ceramic Ornament COG: 0,94 / Price: 6,99";"B0DLT3SDLB";"E4-PNYA-O0P7";"";"";"";"";"";"";"";"";"";"";"";"";"-";"";"";"";"";"";"";"";"";"";"";"92 437";"";"1";""
"NewEleven for Aunt from Niece, Nephew for Auntie, Sister - Auntie Announcement, Promoted to Aunt, Best Aunts Ever Gift - Christmas Tree Decoration Ceramic Ornament COG: 0,94 / Price: 6,99";"B0DLV7X769";"DH-DI42-NMFV";"";"";"";"";"-0,6";"-0,6";"";"";"";"";"";"";"-";"";"";"";"";"-0,60";"-0,60";"-0,6";"";"";"";"92 437";"";"";""
"NewEleven for Aunt from Niece, Nephew - Ornament for Aunt, New Auntie - Aunts Birthday Gift, Aunts Announcement, in My Auntie Era - Ceramic Christmas Ornaments COG: 1,19 / Price: 6,99";"B0DLV9CFVS";"F8-F46H-JKVQ";"";"";"";"";"-0,39";"-0,39";"";"";"";"";"";"";"-";"";"";"";"";"-0,39";"-0,39";"-0,39";"";"";"";"92 809";"";"";""
"NewEleven for Girl Mom - Pregnancy Gifts, Gender Reveal Idea for Pregnant, Expecting Mother, Mama, Mom to Be, Mommy to Be, First Time Mama - Ceramic Christmas Ornaments COG: 0,94 / Price: 6,99";"B0DLVSLFY6";"RZ-LTWM-2Q4L";"";"";"";"";"";"";"";"";"";"";"";"";"-";"";"";"";"";"";"";"";"";"";"";"92 437";"";"2";""
"NewEleven 1985 40th Birthday Gifts For Women - 40 Year Old Birthday Gifts Idea For Women, Her, Mom, Wife - Turning 40 Gift For Woman - 20 Oz Tumbler COG: 3,58 / Price: 21,98";"B0DM61B4F2";"1Y-PY2P-6Q4W";"";"";"";"";"-21,3";"-21,3";"";"";"";"";"";"";"100";"3,58";"";"";"";"-17,72";"-17,72";"-21,3";"";"";"";"2 947";"";"28";""
"NewEleven Gifts For Him, Her - Gift For Men, Dad, Husband, Friend - Thank You, Appreciation, Graduation Present For Men, Boss, Coworker, Teacher - 14 Oz Self Stirring Mug COG: 8,36 / Price: 15,99";"B0DQ59YSW3";"YB-7AHW-E7CH";"";"";"";"";"";"";"";"";"";"";"";"";"-";"";"";"";"";"";"";"";"";"";"";"331 412";"";"2";""
