"Product";"ASIN";"SKU";"Units";"Refunds";"Sales";"Promo";"Ads";"Sponsored products (PPC)";"Sponsored Display";"Sponsored brands (HSA)";"Sponsored Brands Video";"Google ads";"Facebook ads";"% Refunds";"Sellable Quota";"Refund сost";"Amazon fees";"Cost of Goods";"Shipping";"Gross profit";"Net profit";"Estimated payout";"Expenses";"Margin";"ROI";"BSR";"Real ACOS";"Sessions";"Unit Session Percentage"
"NewEleven Godmother Proposal Gift - Will You Be My Godmother - Present from Godchild - Glass Christmas Ornaments COG: 1,9 / Price: 4,99";"B0DJY9BWQ4";"8M-N6Y2-Z802";"";"";"";"";"";"";"";"";"";"";"";"";"-";"";"";"";"";"";"";"";"";"";"";"499 310";"";"1";""
"NewEleven Gifts for Friends Women, Birthday Gift, Friendship Present for Women, Best Friend, Bestie, BFF, Soul Sister - Present for Sister - Ceramic Christmas Ornaments COG: 1,14 / Price: 3,99";"B0DJY9X9SX";"E6-1EAW-03X5";"";"";"";"";"";"";"";"";"";"";"";"";"-";"";"-0,21";"";"";"-0,21";"-0,21";"-0,21";"";"";"";"502 346";"";"";""
"NewEleven Birthday Gifts for Women, Inspirational Gift, Little Reminder, Unique Present for Women, Encouragement Gift, Teacher Appreciation Gifts - Ceramic Christmas Ornaments COG: 0,93 / Price: 9,99";"B0DJYC5Y9Q";"9V-TCLV-MOMR";"";"";"";"";"";"";"";"";"";"";"";"";"-";"";"-0,04";"";"";"-0,04";"-0,04";"-0,04";"";"";"";"680 923";"";"";""
"NewEleven Baptized 2024 Ornament, Baptism Gifts for Girl & Boy, Baptism Decorations - Ceramic Christmas Ornaments COG: 0,9 / Price: 5,99";"B0DJYCPNR6";"L5-SE7H-JXVG";"";"";"";"";"";"";"";"";"";"";"";"";"-";"";"";"";"";"";"";"";"";"";"";"3 727 012";"";"1";""
"NewEleven Wedding Gifts - Mr and Mrs Bridal Shower Decorations - Gifts for Couples 2024 - Just Married Glass Christmas Ornaments COG: 1,9 / Price: 9,99";"B0DJYZSQXT";"IV-T4XA-F1XT";"";"";"";"";"";"";"";"";"";"";"";"";"-";"";"";"";"";"";"";"";"";"";"";"502 346";"";"2";""
"NewEleven Gifts for Dad, Love You Dad Gift Keepsake, Father Birthday Gift, Fun Birthday Gifts for Papa from Daughter, Son - Glass Heart Christmas Ornament COG: 2,16 / Price: 7,99";"B0DJZ5B6YZ";"X7-HY6C-XQAD";"";"";"";"";"";"";"";"";"";"";"";"";"-";"";"-4,17";"";"";"-4,17";"-4,17";"-4,17";"";"";"";"72 691";"";"";""
"NewEleven Baptism Gifts for Girl & Boy, Decorations Ornament, Baby Dedication & Godchild Gift - Ceramic Christmas Ornaments COG: 0,95 / Price: 5,99";"B0DK11YCP5";"EF-QF2X-QCI3";"";"";"";"";"";"";"";"";"";"";"";"";"-";"";"-0,01";"";"";"-0,01";"-0,01";"-0,01";"";"";"";"696 027";"";"1";""
"NewEleven for Women, Friend Gifts for Women, for Woman - Best Friend Birthday Presents for Woman, BFF, Bestie, Soul Sister Gifts - Christmas Ornaments COG: 0,92 / Price: 4,99";"B0DK14C5XC";"VV-WPUX-6TUE";"";"";"";"";"";"";"";"";"";"";"";"";"-";"";"-0,93";"";"";"-0,93";"-0,93";"-0,93";"";"";"";"680 923";"";"1";""
"NewEleven Christmas Decorations Indoor - Family Christmas Ornaments 2025 for Mom, Dad, Sister, Brother - Funny Ceramic Tree Décor COG: 0,9 / Price: 5,99";"B0DK155YN3";"MW-Y980-J1MX";"";"";"";"";"";"";"";"";"";"";"";"";"-";"";"";"";"";"";"";"";"";"";"";"442 848";"";"2";""
"NewEleven Nativity Ornament 2025 - Christian Christmas Ornament, Religious Gifts for Women, Men, Family - Ceramic COG: 0,95 / Price: 5,99";"B0DK15B6KL";"IT-Y89T-YP7U";"";"";"";"";"";"";"";"";"";"";"";"";"-";"";"-0,65";"";"";"-0,65";"-0,65";"-0,65";"";"";"";"696 027";"";"";""
"NewEleven Baseball Gifts Ceramic Christmas Tree Ornament for Lovers - Some Boy Funny Ornament - Present for Boys, Decor - 2025 Christmas Ornaments COG: 0,9 / Price: 5,99";"B0DK16QK9D";"8R-DG4G-C218";"";"";"";"";"";"";"";"";"";"";"";"";"-";"";"-0,01";"";"";"-0,01";"-0,01";"-0,01";"";"";"";"499 310";"";"";""
"NewEleven Religious Christmas Ornament - Bible Verse, Prayers, Jesus Ornaments for Tree Decorations - Inspirational Christian Gifts for Women and Men COG: 1,16 / Price: 4,99";"B0DK16QYNP";"AB-FW99-GJX7";"";"";"";"";"";"";"";"";"";"";"";"";"-";"";"1,46";"-1,16";"";"0,30";"0,30";"1,46";"";"";"25,86";"2 535 654";"";"";""
"NewEleven Best Friend Birthday Gifts for Women, Friends - Thank You Gift for Friend, Bestie, BFF for Her, Him - Christmas Ornaments COG: 2 / Price: 5,99";"B0DK16RQ6J";"KG-02VI-0ANH";"";"";"";"";"";"";"";"";"";"";"";"";"-";"";"10,44";"-12";"";"-1,56";"-1,56";"10,44";"";"";"-13,00";"72 691";"";"";""
"NewEleven Sympathy Gifts for Loss of Loved One, Memorial Ornament - in Loving Memory Ornament - Bereavement Gift Idea, Memorial Gifts, Remembrance Gifts for Men, Women - Ceramic Christmas Ornaments COG: 1,13 / Price: 6,99";"B0DK16ZQYT";"C8-4M65-1A1C";"";"";"";"";"";"";"";"";"";"";"";"";"-";"";"-0,02";"";"";"-0,02";"-0,02";"-0,02";"";"";"";"4 482 575";"";"";""
"NewEleven Gifts for Women, Friendship, Friends, Birthday Gift for Friends Female BFF Old Best Friends, Best Friend Ornament, Bestie Ornament COG: 0,93 / Price: 7,99";"B0DK2YP1FB";"JR-LLGY-N975";"";"";"";"";"";"";"";"";"";"";"";"";"-";"";"-0,24";"";"";"-0,24";"-0,24";"-0,24";"";"";"";"442 848";"";"6";""
"NewEleven for Aunt from Niece, Nephew for Auntie, Sister - Auntie Announcement, Promoted to Aunt, Best Aunts Ever Gift - Christmas Tree Decoration Ceramic Ornament COG: 0,94 / Price: 6,99";"B0DLV7X769";"DH-DI42-NMFV";"";"";"";"";"";"";"";"";"";"";"";"";"-";"";"3,9";"-2,82";"";"1,08";"1,08";"3,9";"";"";"38,30";"72 372";"";"";""
"NewEleven for Mom - Gifts for Mama Birthday, Christmas - Birthday Gifts for Mother from Daughter, Son, Child - New Mother Gift, Mom to Be Gift - Ceramic Christmas Ornaments COG: 1,19 / Price: 6,99";"B0DLV94K7D";"LS-GUGX-Z9QL";"";"";"";"";"";"";"";"";"";"";"";"";"-";"";"-0,41";"";"";"-0,41";"-0,41";"-0,41";"";"";"";"72 691";"";"";""
"NewEleven for Aunt from Niece, Nephew - Ornament for Aunt, New Auntie - Aunts Birthday Gift, Aunts Announcement, in My Auntie Era - Ceramic Christmas Ornaments COG: 1,19 / Price: 6,99";"B0DLV9CFVS";"F8-F46H-JKVQ";"";"";"";"";"";"";"";"";"";"";"";"";"-";"";"-0,77";"";"";"-0,77";"-0,77";"-0,77";"";"";"";"72 372";"";"2";""
"NewEleven Gifts for Her - Inspirational Ornaments - Thank You Gift, Appreciation Present for Men, Nurse, Teacher, Boss, Coworker - Christmas Tree Decoration Glass Ornament COG: 2,17 / Price: 7,99";"B0DLV9V243";"2G-KSK7-6N0O";"";"";"";"";"";"";"";"";"";"";"";"";"-";"";"-0,03";"";"";"-0,03";"-0,03";"-0,03";"";"";"";"439 813";"";"2";""
"NewEleven Galentines Gifts for Coworkers Women, Work Bestie Gifts for Women Friendship, Coworker Gift for Woman, Friendship Presents for Work Bestie - Glass Christmas Ornaments COG: 2,17 / Price: 4,99";"B0DLVRL4C1";"94-H7ZL-H2BO";"";"";"";"";"";"";"";"";"";"";"";"";"-";"";"-0,01";"";"";"-0,01";"-0,01";"-0,01";"";"";"";"696 027";"";"";""
"NewEleven Godmother Gifts for Christmas, Godmom Proposal Gift - Will You Be My Godmother - Mom Present from Godchild - Christmas Ornament 2025 COG: 0,94 / Price: 4,99";"B0DLVRTFN9";"64-SAL7-XCWT";"";"";"";"";"";"";"";"";"";"";"";"";"-";"";"-0,06";"";"";"-0,06";"-0,06";"-0,06";"";"";"";"499 310";"";"1";""
"NewEleven Retirement Ornament - Funny Retirement Gifts for Woman - Christmas Tree Decoration for Mom, Nurse, Teacher, Coworker & Friends COG: 2,17 / Price: 7,99";"B0DLVS7R7V";"O5-LD0Y-FJ4W";"";"";"";"";"";"";"";"";"";"";"";"";"-";"";"";"";"";"";"";"";"";"";"";"442 848";"";"1";""
"NewEleven for Girl Mom - Pregnancy Gifts, Gender Reveal Idea for Pregnant, Expecting Mother, Mama, Mom to Be, Mommy to Be, First Time Mama - Ceramic Christmas Ornaments COG: 0,94 / Price: 6,99";"B0DLVSLFY6";"RZ-LTWM-2Q4L";"";"";"";"";"";"";"";"";"";"";"";"";"-";"";"-0,17";"";"";"-0,17";"-0,17";"-0,17";"";"";"";"72 691";"";"1";""
"NewEleven Galentines Gifts for Friends, Book Ornament for Book Lovers - Book Lovers Gifts, for Readers, Nerd Gift - Glass Christmas Ornaments COG: 2,06 / Price: 5,99";"B0DLVSQM66";"89-VBMR-N64I";"";"";"";"";"";"";"";"";"";"";"";"";"-";"";"";"";"";"";"";"";"";"";"";"499 310";"";"2";""
"NewEleven Gifts for Women, Gift for Her, Mom, Friends, A Year of Promises of God Bible Scripture Memory Verse Cards Set of 52 - Christian, Religious, Inspirational Gifts for Women COG: 3,5 / Price: 9,98";"B0DQ42YY8T";"GQ-R013-PDDU";"";"";"";"";"";"";"";"";"";"";"";"";"-";"";"";"";"";"";"";"";"";"";"";"227 460";"";"1";""
"NewEleven Gifts For Him, Her - Valentines' Day Gifts for Men, Women, Boyfriend, Girlfriend, Husband, Wife, Birthday, Couple Presents for Him, Her - 14 Oz Self Stirring Mug COG: 8,66 / Price: 15,99";"B0DQ56WTWZ";"Y2-ATI0-B7OL";"";"";"";"";"";"";"";"";"";"";"";"";"-";"";"5,5";"-17,32";"";"-11,82";"-11,82";"5,5";"";"";"-68,24";"314 875";"";"";""
"NewEleven Gifts For Him, Her - Gift For Men, Dad, Husband, Friend - Thank You, Appreciation, Graduation Present For Men, Boss, Coworker, Teacher - 14 Oz Self Stirring Mug COG: 8,36 / Price: 15,99";"B0DQ59YSW3";"YB-7AHW-E7CH";"";"";"";"";"";"";"";"";"";"";"";"";"-";"";"-3,67";"";"";"-3,67";"-3,67";"-3,67";"";"";"";"314 875";"";"2";""
"NewEleven 50th Birthday Gifts for Her COG: 2,2 / Price: 4,99";"B0DQ8L1DQW";"5L-JJQW-3R4J";"";"";"";"";"";"";"";"";"";"";"";"";"-";"";"";"";"";"";"";"";"";"";"";"685 011";"";"2";""
"NewEleven Engagement Gifts for Couples 2025 - Gift for Newly Engaged Couples, Happy Engagement Gifts for Her, Women, Friends, Bride to Be Gift, Glass Christmas Ornaments COG: 2,1 / Price: 9,99";"B0DR1SNKVX";"4L-EMQE-OQ2Y";"";"";"";"";"";"";"";"";"";"";"";"";"-";"";"";"";"";"";"";"";"";"";"";"72 372";"";"4";""
"NewEleven Wedding Gifts - Mr and Mrs, Bridal Shower Decorations - Wedding Gifts for Couples 2025, Bride Gift for Friends - Just Married Glass 2025 Ornament COG: 1,81 / Price: 9,99";"B0DRT2D2ZB";"GU-M8AT-5NTK";"";"";"";"";"";"";"";"";"";"";"";"";"-";"";"";"";"";"";"";"";"";"";"";"72 372";"";"5";""
"NewEleven Teacher Appreciation Gifts For Women, Thank You Gift for Teachers, Inspirational School Teacher Gifts from Students for Birthday, Retirement, Bible Jar For Teachers with 92 Bible Verses COG: 2,33 / Price: 17,98";"B0DVSJLHZN";"W1-8IDB-BZ73";"";"";"";"";"";"";"";"";"";"";"";"";"-";"";"";"";"";"";"";"";"";"";"";"15 910";"";"9";""
"NewEleven Class Of 2025 Graduation Gifts For Her, Friends - Funny Master Degree, College Graduation Gifts From Friends And Family - 16 Oz Coffee Glass COG: 2,3 / Price: 9,99";"B0DWMZXCZP";"UZ-8P0A-GPKD";"";"";"";"";"-8,25";"-8,25";"";"";"";"";"";"";"-";"";"";"";"";"-8,25";"-8,25";"-8,25";"";"";"";"86 606";"";"14";""
"NewEleven Gift For Teachers - Teacher Appreciation Gifts For Women, New Teachers - Teacher Gifts For Women From Student, Friends, Family And Coworker - 20 Oz Tumbler COG: 3,42 / Price: 12,98";"B0DYDZFRZD";"4E-EG59-NN41";"";"";"";"";"";"";"";"";"";"";"";"";"-";"";"5,5";"-3,42";"";"2,08";"2,08";"5,5";"";"";"60,82";"48 866";"";"3";""
"NewEleven Birthday Gifts for Dad from Daughter, Son, Wife - First Time Present for Father, Men, Girl Dads Hat - Trucker Hat COG: 2,67 / Price: 17,98";"B0DYJ45P7Q";"QF-PTRY-DG2W";"";"";"";"";"";"";"";"";"";"";"";"";"-";"";"";"";"";"";"";"";"";"";"";"187 509";"";"1";""
"NewEleven Fathers Day Gift For Dad - Funny Present For Father, Men - Dad Birthday Gift, Unique Father Gifts From Daughter, Son, Kid, Wife - 20 Oz Tumbler Navy COG: 3,5 / Price: 16,98";"B0F17F23MZ";"R8-7X5D-8W4W";"";"";"";"";"";"";"";"";"";"";"";"";"-";"";"";"";"";"";"";"";"";"";"";"82 691";"";"2";""
"NewEleven Grandpa Gifts - Fathers Day Gift For Grandpa, Birthday Gifts For Grandfather, Papa - Grandfather Gift Ideas From Granddaughter, Grandson, Kids - 20 Oz Tumbler COG: 3,42 / Price: 16,98";"B0F17MLPQ4";"M0-BMOU-WK4K";"";"";"";"";"";"";"";"";"";"";"";"";"-";"";"";"";"";"";"";"";"";"";"";"81 940";"";"2";""
"NewEleven Gifts For Dad - Funny Present For Father, Men - Dad Birthday Gift, Unique Father Gifts From Daughter, Son, Kid, Wife - 20 Oz Tumbler Black COG:  / Price: 0";"B0F1FWGNH8";"";"";"";"";"";"";"";"";"";"";"";"";"";"-";"";"";"";"";"";"";"";"";"";"";"82 691";"";"2";""
"NewEleven Gifts For Mom, Gifts Cards For Mommy From Daughter, Son, Kids - Funny Present For Birthday, Humorous Mom Greeting Card COG: 0,42 / Price: 7,99";"B0F2T6J36X";"JU-SXX5-LD1M";"";"";"";"";"";"";"";"";"";"";"";"";"-";"";"6,71";"";"";"6,71";"6,71";"6,71";"";"";"";"14 014";"";"";""
"NewEleven Gifts For Mom From Daughter, Birthday Card For Mommy, Bonus Mom, Mother In Law - Cool Gifts For Mama From Daughter, Heartfelt Message To Mother - Greeting Card COG: 0,42 / Price: 7,99";"B0F2TB3Q7Q";"WZ-FOQA-VOQC";"";"";"";"";"";"";"";"";"";"";"";"";"-";"";"4,12";"-0,42";"";"3,70";"3,70";"4,12";"";"";"880,95";"14 098";"";"";""
"NewEleven Mother's Day Card, Mother Daughter Gift, Gifts For Mom From Daughter - Unique Mom Gift For Mother's Day, Heartfelt Message To Moms - Greeting Card COG: 0,42 / Price: 7,99";"B0F2TD6J1Q";"JR-0H6N-UXCH";"";"";"";"";"";"";"";"";"";"";"";"";"-";"";"";"";"";"";"";"";"";"";"";"14 014";"";"1";""
"NewEleven Birthday Card For Dad - Fathers Day Gift, Dad Gifts From Daughter, Son, Wife - Funnny Present, Dads Gift Idea For Bonus Dads, Father, Father In Law - Greeting Card COG: 0,44 / Price: 7,99";"B0F59S8H6T";"IA-GG14-LH7P";"";"";"";"";"";"";"";"";"";"";"";"";"-";"";"";"";"";"";"";"";"";"";"";"14 014";"";"1";""
"NewEleven Gifts For Dad - Fathers Day Card For Dad, Birthday Present For Dads, Bonus Dads - Fathers Day Card From Daughter, Son, Kid, Wife - Humorous Greeting Card COG: 0,44 / Price: 4,99";"B0F59S997T";"F0-2QAC-J9UH";"";"";"";"";"";"";"";"";"";"";"";"";"-";"";"4,12";"-0,44";"";"3,68";"3,68";"4,12";"";"";"836,36";"14 098";"";"3";""
"NewEleven Gifts For Dad Birhtday - Gifts For Dad, Funny Present From Kids, Daughter, Son - Unique Gift, Birthday Card For Father, Step Father - Greeting Card COG: 0,44 / Price: 7,99";"B0F59VGSY3";"P2-IYY6-4I6R";"";"";"";"";"";"";"";"";"";"";"";"";"-";"";"";"";"";"";"";"";"";"";"";"14 014";"";"2";""
"NewEleven Birthday Card For Dad - Fathers Day Gift, Heartfelt Present For Dads, Bonus Dads, Father In Law - Dad Birthday Gift From Daughter, Son, Kid, Wife - Greeting Card COG: 0,44 / Price: 7,99";"B0F59VGXBY";"4N-OLIJ-V92Z";"";"";"";"";"";"";"";"";"";"";"";"";"-";"";"";"";"";"";"";"";"";"";"";"14 098";"";"1";""
"NewEleven Husband Gift - Romantic Gifts, Father's Day Gifts For Husband From Wife - Unique Present, Heartfelt Message, Fathers Day Card For Husbands - Greeting Card COG: 0,44 / Price: 7,99";"B0F59VYMYR";"4N-UKMX-U3ON";"";"";"";"";"";"";"";"";"";"";"";"";"-";"";"";"";"";"";"";"";"";"";"";"14 098";"";"2";""
"NewEleven Dad Birthday Gift - Meaningful Present For Dads, Bonus Dads - Cute Dad Birthday Card, Fathers Day Card From Son, Daughter, Favorite Kids - Greeting Card COG: 0,44 / Price: 7,99";"B0F59X5XB6";"BQ-8IHB-2PJV";"";"";"";"";"";"";"";"";"";"";"";"";"-";"";"";"";"";"";"";"";"";"";"";"14 014";"";"2";""
"NewEleven Dad Birthday Gift For Dad, Bonus Dads - Fathers Day Card, Unique Present, Heartfelt Messesage For Father From Daughter, Son, Kids - Greeting Card COG: 0,44 / Price: 7,99";"B0F59XTYB6";"45-R2A7-EGYZ";"";"";"";"";"";"";"";"";"";"";"";"";"-";"";"";"";"";"";"";"";"";"";"";"14 014";"";"5";""
"NewEleven Dad Gifts - Gifts For Dad From Daughter, Son, Kid, Wife - Heartfelt Message, Fathers Day Card For Dads, Bonus Das, Step Father - Greeting Card COG: 0,44 / Price: 7,99";"B0F59Y459Y";"RZ-9XXR-XH01";"";"";"";"";"";"";"";"";"";"";"";"";"-";"";"";"";"";"";"";"";"";"";"";"14 014";"";"5";""
"NewEleven Funny Dad Birthday Gift from Daughter, Son, Kids – Humorous Card for Daddy, Bonus Dad, Father-in-Law – Great for Father’s Day, Birthday, Just Because – Sentimental Greeting Card COG: 0,44 / Price: 7,99";"B0F59YVGWG";"8P-L50D-6IVR";"";"";"";"";"";"";"";"";"";"";"";"";"-";"";"";"";"";"";"";"";"";"";"";"14 014";"";"7";""
"NewEleven Grandpa Gifts - Grandpa Birthday Gifts, Gift For Grandparents From Kids, Child - Birthday Gift, Heartfelt Message, Fathers Day Card For Grandpa, Papa - Greeting Card COG: 0,44 / Price: 7,99";"B0F59Z29ZR";"OQ-C9LE-D894";"";"";"";"";"";"";"";"";"";"";"";"";"-";"";"";"";"";"";"";"";"";"";"";"14 098";"";"3";""
"NewEleven Gifts For Dad - Dad Birthday Card, Funny Present, Fathers Day Card For Dads From Daughter, Son, Kids - Unique Birthday, Father's Day Gift - Humorous Greeting Cards COG: 0,44 / Price: 7,99";"B0F5B1ZFQW";"92-DVSY-QP6W";"";"";"";"";"";"";"";"";"";"";"";"";"-";"";"";"";"";"";"";"";"";"";"";"14 098";"";"1";""
"NewEleven Funny Fathers Day Card, Cat Dad Gifts For Men, Best Cat Dad Ever For Father's Day, Cat Lover Gifts For Men, Unique Cats Father Presents - Greeting Card COG: 0,43 / Price: 7,99";"B0F7LL1VLP";"QJ-K197-WWV2";"";"";"";"";"";"";"";"";"";"";"";"";"-";"";"";"";"";"";"";"";"";"";"";"14 098";"";"1";""
"NewEleven Uncle Birthday Gifts - Gift For Uncle, Funcle - Meaningful Present, Birthday Gift For Uncles From Newphew, Niece, Kids - Bible Jar COG: 2,62 / Price: 17,98";"B0F7WYS1R1";"YA-B9EW-YOZ9";"";"";"";"";"";"";"";"";"";"";"";"";"-";"";"";"";"";"";"";"";"";"";"";"15 860";"";"21";""
"NewEleven Birthday Gifts For Women - Humorous Message, Funny Birthday Gift Card For Men, Women, Dad, Mom, Brother, Sister, Friends, Family - Greeting Card COG: 0,39 / Price: 5,99";"B0FC5MVV3Q";"H4-ZU99-Z57Y";"";"";"";"";"";"";"";"";"";"";"";"";"-";"";"";"";"";"";"";"";"";"";"";"";"";"4";""
"NewEleven Dog Dad Gifts For Men - Humorous Present, Cute Birthday Gifts For Dog Lovers, Husband, Him - Funny Dog Dad Card From Friend, Family - Greeting Card COG: 0,39 / Price: 6,99";"B0FC5TBFWB";"60-KN47-M9LV";"";"";"";"";"";"";"";"";"";"";"";"";"-";"";"";"";"";"";"";"";"";"";"";"";"";"2";""
"NewEleven Funny Boss Gifts - Appreciaton Card, Boss Birthday Card For Men, Women, Manager - Supervisor Gifts For Women From Coworker, Colleague - Greeting Card COG: 0,39 / Price: 4,99";"B0FC5TLHKZ";"RT-64X6-JD53";"";"";"";"";"";"";"";"";"";"";"";"";"-";"";"";"";"";"";"";"";"";"";"";"";"";"15";""
"NewEleven Boss Gifts For Women, Men - Boss Birthday Card, Thank You Gift, Heartfelt Message For Leader - Appreciation Present For Manager Form Colleague, Coworker - Greeting Card COG: 0,39 / Price: 4,99";"B0FC5W1QX7";"SS-6UAT-LTMJ";"";"";"";"";"-23,25";"-23,25";"";"";"";"";"";"";"-";"";"";"";"";"-23,25";"-23,25";"-23,25";"";"";"";"";"";"22";""
"NewEleven Dog Mom Gifts For Women - Dog Mom Card, Cute Gifts For Dog Lovers, Dogs Owners - Birthday Gift, Dogs Moms Gift From Friend, Husband, Family - Greeting Card COG: 0,39 / Price: 6,99";"B0FC5XQTBQ";"1A-JRBV-8HH8";"";"";"";"";"-3,78";"-3,78";"";"";"";"";"";"";"-";"";"";"";"";"-3,78";"-3,78";"-3,78";"";"";"";"";"";"3";""
"NewEleven Dog Mom Gifts For Women - Funny Dog Dad Gift, Cute Card For Dog Lover - Birthday Cards, Dog Dad Gifts For Men From Wife, Her, Friend - Greeting Card COG: 0,39 / Price: 6,99";"B0FC65Z1KQ";"ZM-69AN-C3J3";"";"";"";"";"";"";"";"";"";"";"";"";"-";"";"";"";"";"";"";"";"";"";"";"";"";"4";""
"NewEleven Retirement Gift For Woman, Men - Heartfelt Message, Retirement Card For Boss, Friend - Coworker Leaving Gifts For Women From Friends, Colleague - Greeting Card COG: 0,39 / Price: 5,99";"B0FC69Q8BS";"ZB-KCAW-W2E3";"";"";"";"";"";"";"";"";"";"";"";"";"-";"";"";"";"";"";"";"";"";"";"";"";"";"11";""
"NewEleven Retirement Gift For Woman - Retirement Card For Women, Men, Boss - Funny Retirements Gifts For Men, Farewell Gifts For Coworkers From Work Bestie, Colleague - Greeting Card COG: 0,39 / Price: 5,99";"B0FC69R4PK";"A9-HSHI-ATQO";"";"";"";"";"";"";"";"";"";"";"";"";"-";"";"";"";"";"";"";"";"";"";"";"";"";"9";""
"NewEleven Thank You Cards - Teacher Appreciation Gifts, Thanks You Present For Friend, Teacher, Boss - Thank You Gifts For Women, Men From Bestie, Family, Colleague - Greeting Card COG: 0,39 / Price: 4,99";"B0FC6CNPQK";"4R-QNTR-6X4P";"";"";"";"";"";"";"";"";"";"";"";"";"-";"";"";"";"";"";"";"";"";"";"";"";"";"15";""
"NewEleven Cat Mom Gifts For Women - Cat Birthday Card, Funny Gift For Cat Lover, Cat Mom, Her - Cat Lover Gifts For Women From Friend, Family - Greeting Card COG: 0,39 / Price: 6,99";"B0FC6CY15S";"5P-CAQZ-6FK5";"";"";"";"";"";"";"";"";"";"";"";"";"-";"";"";"";"";"";"";"";"";"";"";"";"";"1";""
"NewEleven Gifts For Mom - Heartfelt Message, Birthday Card For Mom From Daughter, Son, Kids - Meaningful Gift, Unique Present For Mother - Greeting Card COG: 0,39 / Price: 5,99";"B0FC6DJMD9";"1E-URHL-R626";"";"";"";"";"";"";"";"";"";"";"";"";"-";"";"";"";"";"";"";"";"";"";"";"";"";"4";""
"NewEleven Funny Retirement Gifts For Men - Farewell Gifts For Coworkers, Funny Present For Boss, Colleague - Retirement Card For Men From Friend, Work Bestie - Greeting Card COG: 0,39 / Price: 5,99";"B0FC6DMH5L";"7P-OJZF-5789";"";"";"";"";"";"";"";"";"";"";"";"";"-";"";"";"";"";"";"";"";"";"";"";"";"";"18";""
"NewEleven Wedding Gifts For Couples 2025 - Funny Wedding Card For Bride And Groom, Newly Wed Gifts For Couple - Meaningful Present From Friend And Family - Greeting Card COG: 0,39 / Price: 4,99";"B0FC6DQZCQ";"DP-MOZ6-JMS1";"";"";"";"";"";"";"";"";"";"";"";"";"-";"";"";"";"";"";"";"";"";"";"";"";"";"25";""
