"Product";"ASIN";"SKU";"Units";"Refunds";"Sales";"Promo";"Ads";"Sponsored products (PPC)";"Sponsored Display";"Sponsored brands (HSA)";"Sponsored Brands Video";"Google ads";"Facebook ads";"% Refunds";"Sellable Quota";"Refund сost";"Amazon fees";"Cost of Goods";"Shipping";"Gross profit";"Net profit";"Estimated payout";"Expenses";"Margin";"ROI";"BSR";"Real ACOS";"Sessions";"Unit Session Percentage"
"NewEleven Engagement Gifts for Couples 2025 - Gift for Newly Engaged Couples, Happy Engagement Gifts for Her, Women, Friends, Bride to Be Gift, Glass Christmas Ornaments COG: 2,1 / Price: 9,99";"B0DR1SNKVX";"4L-EMQE-OQ2Y";"";"";"";"";"";"";"";"";"";"";"";"";"-";"";"";"";"";"";"";"";"";"";"";"92 437";"";"2";""
"NewEleven Wedding Gifts - Mr and Mrs, Bridal Shower Decorations - Wedding Gifts for Couples 2025, Bride Gift for Friends - Just Married Glass 2025 Ornament COG: 1,81 / Price: 9,99";"B0DRT2D2ZB";"GU-M8AT-5NTK";"";"";"";"";"";"";"";"";"";"";"";"";"-";"";"";"";"";"";"";"";"";"";"";"92 437";"";"7";""
"NewEleven Teacher Appreciation Gifts For Women, Thank You Gift for Teachers, Inspirational School Teacher Gifts from Students for Birthday, Retirement, Bible Jar For Teachers with 92 Bible Verses COG: 2,33 / Price: 17,98";"B0DVSJLHZN";"W1-8IDB-BZ73";"";"";"";"";"";"";"";"";"";"";"";"";"-";"";"-15,38";"2,33";"";"-13,05";"-13,05";"-15,38";"";"";"560,09";"18 725";"";"12";""
"NewEleven Gifts For Mom From Husband Daughter, Son - Mom Birthday Gifts, Unique Present For Wife, Mama, Women - 20 Oz Tumbler COG: 3,5 / Price: 16,98";"B0DXVPDSJK";"KE-3OXS-UDHH";"";"";"";"";"";"";"";"";"";"";"";"";"-";"";"";"";"";"";"";"";"";"";"";"81 229";"";"2";""
"NewEleven Birthday Gifts for Dad from Daughter, Son, Wife - First Time Present for Father, Men, Girl Dads Hat - Trucker Hat COG: 2,67 / Price: 17,98";"B0DYJ45P7Q";"QF-PTRY-DG2W";"";"";"";"";"";"";"";"";"";"";"";"";"-";"";"";"";"";"";"";"";"";"";"";"158 085";"";"5";""
"NewEleven Fathers Day Gift For Dad - Funny Present For Father, Men - Dad Birthday Gift, Unique Father Gifts From Daughter, Son, Kid, Wife - 20 Oz Tumbler Navy COG: 3,5 / Price: 16,98";"B0F17F23MZ";"R8-7X5D-8W4W";"";"";"";"";"";"";"";"";"";"";"";"";"100";"3,5";"";"";"";"3,50";"3,50";"";"";"";"";"81 229";"";"2";""
"NewEleven Uncle Birthday Gifts - Funny Uncle Gifts From Niece, Newphew, Kids - Fathers Day Gift, Unique Uncles Present, Best Present For Uncles - 20 Oz Tumbler COG: 0 / Price: 14,98";"B0F17GLNKP";"EK-W8MY-0MBR";"";"";"";"";"";"";"";"";"";"";"";"";"-";"";"";"";"";"";"";"";"";"";"";"81 516";"";"1";""
"NewEleven Grandpa Gifts - Fathers Day Gift For Grandpa, Birthday Gifts For Grandfather, Papa - Grandfather Gift Ideas From Granddaughter, Grandson, Kids - 20 Oz Tumbler COG: 3,42 / Price: 16,98";"B0F17MLPQ4";"M0-BMOU-WK4K";"";"";"";"";"";"";"";"";"";"";"";"";"-";"";"";"";"";"";"";"";"";"";"";"81 516";"";"1";""
"NewEleven Father's Day Gift For Husband - Husband Birthday Gifts, Anniversary Romantic Love Present Ideas For Him - Funny Present For Hubby, Him From Wife - 20 Oz Tumbler COG: 3,42 / Price: 16,98";"B0F17N58SN";"FN-TDOG-NQ7Z";"";"";"";"";"";"";"";"";"";"";"";"";"-";"";"";"";"";"";"";"";"";"";"";"81 516";"";"1";""
"NewEleven Gifts For Dad - Funny Present For Father, Men - Dad Birthday Gift, Unique Father Gifts From Daughter, Son, Kid, Wife - 20 Oz Tumbler Black COG:  / Price: 0";"B0F1FWGNH8";"";"";"";"";"";"";"";"";"";"";"";"";"";"-";"";"";"";"";"";"";"";"";"";"";"81 229";"";"1";""
"NewEleven Birthday Gifts For Mom, Gifts For Mom From Daughter, Birthday Card For Mommy - Cool Mothers From Daughter, Son, Kids - Greeting Card COG: 0,42 / Price: 4,99";"B0F2T9H9W8";"IH-G19E-BA1G";"";"";"";"";"";"";"";"";"";"";"";"";"-";"";"";"";"";"";"";"";"";"";"";"1 851";"";"1";""
"NewEleven Funny Gifts For Mom, Mothers Day Card For Mom From Daughter, Kids On Mother's Day - Funny Mothers Day Gifts, Birthday Present, Humorous Greeting Cards For Mother COG: 0,42 / Price: 7,99";"B0F2TC6CP7";"GI-HLHH-RG89";"";"";"";"";"";"";"";"";"";"";"";"";"-";"";"";"";"";"";"";"";"";"";"";"10 801";"";"9";""
"NewEleven Mother's Day Card, Mother Daughter Gift, Gifts For Mom From Daughter - Unique Mom Gift For Mother's Day, Heartfelt Message To Moms - Greeting Card COG: 0,42 / Price: 7,99";"B0F2TD6J1Q";"JR-0H6N-UXCH";"";"";"";"";"";"";"";"";"";"";"";"";"-";"";"";"";"";"";"";"";"";"";"";"50 031";"";"2";""
"NewEleven Retirement Gifts - Retirement Gift for Woman, Farewell Gift, Goodbye Present for Men, Women - Going Away, Goodbye Gifts for Coworkers - Candle COG: 3,8 / Price: 11,98";"B0F3C9BMFZ";"WY-FHPL-MTWW";"";"";"";"";"-3";"-3";"";"";"";"";"";"";"-";"";"";"";"";"-3,00";"-3,00";"-3";"";"";"";"65 729";"";"16";""
"NewEleven Birthday Card For Dad - Fathers Day Gift, Dad Gifts From Daughter, Son, Wife - Funnny Present, Dads Gift Idea For Bonus Dads, Father, Father In Law - Greeting Card COG: 0,44 / Price: 7,99";"B0F59S8H6T";"IA-GG14-LH7P";"";"";"";"";"";"";"";"";"";"";"";"";"-";"";"";"";"";"";"";"";"";"";"";"10 818";"";"4";""
"NewEleven Gifts For Dad - Fathers Day Card For Dad, Birthday Present For Dads, Bonus Dads - Fathers Day Card From Daughter, Son, Kid, Wife - Humorous Greeting Card COG: 0,44 / Price: 4,99";"B0F59S997T";"F0-2QAC-J9UH";"";"";"";"";"";"";"";"";"";"";"";"";"-";"";"";"";"";"";"";"";"";"";"";"10 818";"";"5";""
"NewEleven Birthday Card For Dad - Fathers Day Gift, Heartfelt Present For Dads, Bonus Dads, Father In Law - Dad Birthday Gift From Daughter, Son, Kid, Wife - Greeting Card COG: 0,44 / Price: 7,99";"B0F59VGXBY";"4N-OLIJ-V92Z";"";"";"";"";"";"";"";"";"";"";"";"";"-";"";"";"";"";"";"";"";"";"";"";"10 818";"";"8";""
"NewEleven Gifts For Son - Meaningful Fathers Day Card For Son From Mom And Dad - Unique Present, Heartfelt Messeage, Father's Day Gifts For Sons, Dad First Time - Greeting Card COG: 0,44 / Price: 7,99";"B0F59X7WSH";"H2-9Z1Y-AGEF";"";"";"";"";"";"";"";"";"";"";"";"";"-";"";"";"";"";"";"";"";"";"";"";"10 774";"";"6";""
"NewEleven Dad Birthday Gift For Dad, Bonus Dads - Fathers Day Card, Unique Present, Heartfelt Messesage For Father From Daughter, Son, Kids - Greeting Card COG: 0,44 / Price: 7,99";"B0F59XTYB6";"45-R2A7-EGYZ";"";"";"";"";"";"";"";"";"";"";"";"";"-";"";"";"";"";"";"";"";"";"";"";"10 818";"";"6";""
"NewEleven Dad Gifts - Gifts For Dad From Daughter, Son, Kid, Wife - Heartfelt Message, Fathers Day Card For Dads, Bonus Das, Step Father - Greeting Card COG: 0,44 / Price: 7,99";"B0F59Y459Y";"RZ-9XXR-XH01";"";"";"";"";"";"";"";"";"";"";"";"";"-";"";"";"";"";"";"";"";"";"";"";"10 801";"";"7";""
"NewEleven Funny Dad Birthday Gift from Daughter, Son, Kids – Humorous Card for Daddy, Bonus Dad, Father-in-Law – Great for Father’s Day, Birthday, Just Because – Sentimental Greeting Card COG: 0,44 / Price: 7,99";"B0F59YVGWG";"8P-L50D-6IVR";"";"";"";"";"";"";"";"";"";"";"";"";"-";"";"";"";"";"";"";"";"";"";"";"50 031";"";"6";""
"NewEleven Grandpa Gifts - Grandpa Birthday Gifts, Gift For Grandparents From Kids, Child - Birthday Gift, Heartfelt Message, Fathers Day Card For Grandpa, Papa - Greeting Card COG: 0,44 / Price: 7,99";"B0F59Z29ZR";"OQ-C9LE-D894";"";"";"";"";"";"";"";"";"";"";"";"";"-";"";"";"";"";"";"";"";"";"";"";"10 818";"";"7";""
"NewEleven Gifts For Dad - Dad Birthday Card, Funny Present, Fathers Day Card For Dads From Daughter, Son, Kids - Unique Birthday, Father's Day Gift - Humorous Greeting Cards COG: 0,44 / Price: 7,99";"B0F5B1ZFQW";"92-DVSY-QP6W";"";"";"";"";"";"";"";"";"";"";"";"";"-";"";"";"";"";"";"";"";"";"";"";"10 801";"";"3";""
"NewEleven Gift For Grandpa - Meaningful Grandpa Gifts From Granddaughter, Grandson - Grandpa Birthday Gifts For Grandfather, New Granddad, PaPa - Bible Jar COG: 2,62 / Price: 16,98";"B0F7WVKZ6F";"8O-S5PG-85KF";"";"";"";"";"";"";"";"";"";"";"";"";"-";"";"";"";"";"";"";"";"";"";"";"18 754";"";"5";""
"NewEleven Wedding Gifts For Couples 2025 - Funny Wedding Card For Bride And Groom, Newly Wed Gifts For Couple - Meaningful Present From Friend And Family - Greeting Card COG: 0,39 / Price: 4,99";"B0FC6DQZCQ";"DP-MOZ6-JMS1";"";"";"";"";"";"";"";"";"";"";"";"";"-";"";"";"";"";"";"";"";"";"";"";"8 508";"";"16";""
