"Product";"ASIN";"SKU";"Units";"Refunds";"Sales";"Promo";"Ads";"Sponsored products (PPC)";"Sponsored Display";"Sponsored brands (HSA)";"Sponsored Brands Video";"Google ads";"Facebook ads";"% Refunds";"Sellable Quota";"Refund сost";"Amazon fees";"Cost of Goods";"Shipping";"Gross profit";"Net profit";"Estimated payout";"Expenses";"Margin";"ROI";"BSR";"Real ACOS";"Sessions";"Unit Session Percentage"
"NewEleven Gift For Brother - Brother Birthday Gifts, Christian Gifts For Little, Adult Bro, Sibling - Meaningful Gift For Brothers From Sister, Family - Bible Jar COG: 2,62 / Price: 18,98";"B0F7XCP31P";"JB-RJTD-OQ2R";"2";"1";"37,96";"";"";"";"";"";"";"";"";"50,00";"-";"-16,61";"-14,08";"-5,24";"";"2,03";"2,03";"7,27";"";"5,35";"38,74";"8 688";"";"31";"6,45"
"NewEleven Gifts For Mom - Gifts For Mother, Women, Wife - Funny Best Birthday Gift Ideas For Wife, New Mama, Bonus Mama, Mom To Be, Mother In Law - 12 Oz Tumbler COG: 3,76 / Price: 15,98";"B07Y7ZQ265";"F1-10S9-NASK";"1";"";"15,98";"";"";"";"";"";"";"";"";"";"-";"";"-6,79";"-3,76";"";"5,43";"5,43";"9,19";"";"33,98";"144,41";"6 843";"";"7";"14,29"
"NewEleven Retirement Gifts For Woman 2025 - Happy Retirement Gifts For Coworker Leaving - Farewell, Goodbye Presents For Women, Coworkers, Friends - 20 Oz Tumbler COG: 4,82 / Price: 19,98";"B09XDFLNR8";"74-78DN-W52B";"1";"";"21,98";"";"";"";"";"";"";"";"";"";"-";"";"-8,18";"-4,82";"";"8,98";"8,98";"13,8";"";"40,86";"186,31";"21 259";"";"3";"33,33"
"NewEleven Retirement Gifts For Men Women 2025 - Retirement Party Decorations - Retired Presents For Coworker Leaving, Men, Retired People, Coworkers, Friends - 20 Oz Tumbler COG: 4,48 / Price: 19,98";"B09YCTFXYV";"KG-HY7Y-VD9N";"1";"";"19,98";"";"";"";"";"";"";"";"";"";"-";"";"-7,85";"-4,48";"";"7,65";"7,65";"12,13";"";"38,29";"170,76";"21 259";"";"8";"12,50"
"NewEleven Retirement Gifts For Women 2024 - Happy Retirement Gift - Coworker Leaving, Farewell, Goodbye Gifts For Coworkers, Friends - 12 Oz Tumbler COG: 3,99 / Price: 22,98";"B0B9RLH8RV";"HB-YPM1-SCJA";"1";"";"22,98";"";"";"";"";"";"";"";"";"";"-";"";"-7,95";"-3,99";"";"11,04";"11,04";"15,03";"";"48,04";"276,69";"10 670";"";"9";"11,11"
"NEWELEVEN 16 Oz Coffee Glass - Mama Needs Coffee - Transparent Glass - Reusable - 16 oz - Casual - Cold Drinks - Christmas, Mother's Day, Birthday - 1 Count COG: 2,55 / Price: 16,99";"B0B9SF2R4R";"SB-OEYK-4VNP";"1";"";"11,98";"";"";"";"";"";"";"";"";"";"-";"";"-6,97";"-2,55";"";"2,46";"2,46";"5,01";"";"20,53";"96,47";"25 644";"";"9";"11,11"
"NewEleven Gifts For Mom - Present For Mom From Daughter, Son, Kids - Unique Birthday Gifts For Mother, New Mom, Mommy, Pregnancy - 16 Oz Coffee Glass COG: 2,82 / Price: 13,99";"B0BHWDNYVL";"CW-5CAB-L7CZ";"1";"";"11,98";"";"";"";"";"";"";"";"";"";"50";"2,82";"-6,97";"-2,82";"";"5,01";"5,01";"5,01";"";"41,82";"177,66";"25 644";"";"6";"16,67"
"NewEleven Gifts For Sister - Unique Birthday Present For Soul Sister, Big, Little Sis, Sisters In Law, Sibling, Bestie - 16 Oz Coffee Glass COG: 2,03 / Price: 15,98";"B0BRB6J55H";"OW-SAUE-CM7G";"1";"";"9,99";"";"";"";"";"";"";"";"";"";"-";"";"-5,87";"-2,03";"";"2,09";"2,09";"4,12";"";"20,92";"102,96";"40 442";"";"11";"9,09"
"NewEleven Gifts For Cat Mom, Cats Lover - Cat Gifts For Women - Cute Kitten Stuff, Cats Themed Gift For Women - Cute Funny Gift For Her, Best Friend - 16 Oz Coffee Glass COG: 2 / Price: 9,99";"B0BRCJ5VYH";"CZ-V369-AMB3";"1";"";"9,99";"";"";"";"";"";"";"";"";"";"-";"";"-6,25";"-2";"";"1,74";"1,74";"3,74";"";"17,42";"87,00";"36 556";"";"12";"8,33"
"NewEleven Gifts For Aunt From Niece, Nephew - Cool Gifts For Auntie, Sister - Aunty Birthday Gift - Announcement, Promoted To Aunt - 16 Oz Coffee Glass COG: 2,23 / Price: 15,98";"B0BYCT1SRJ";"LH-BSSY-KKX9";"1";"";"15,98";"";"-1,01";"-1,01";"";"";"";"";"";"";"-";"";"-7,63";"-2,23";"";"5,11";"5,11";"7,34";"";"31,98";"229,15";"30 248";"6,32";"7";"14,29"
"NewEleven Gifts For Friends, Bestie – Work Bestie Presents For Women Friends - Appreciation Gifts For Coworkers, Unique Present Ideas For Coworker Leaving, Farewell Party – 16 Oz Coffee Glass COG: 2,17 / Price: 14,98";"B0CBJQZCFY";"2D-H3QH-UR6F";"1";"";"14,98";"";"-3,8";"-3,8";"";"";"";"";"";"";"-";"";"-6,63";"-2,17";"";"2,38";"2,38";"4,55";"";"15,89";"109,68";"12 820";"25,37";"14";"7,14"
"NewEleven Gifts For Men, Women - Funny Gag Gifts Ideas For Dad, Mom, Grandpa, Grandma, Husband, Wife, Uncle, Him - 40th 50th 60th 70th 80th Birthday Gifts For Men Women – 20 Oz Tumbler COG: 3,65 / Price: 15,98";"B0CDLQGPKC";"38-P9JP-4W92";"1";"";"15,98";"";"";"";"";"";"";"";"";"";"-";"";"-7,19";"-3,65";"";"5,14";"5,14";"8,79";"";"32,17";"140,82";"2 384";"";"15";"6,67"
"NewEleven Fathers Day Gift For Dad, Men - Funny Birthday Gifts For Dad, Men, Car Guys - Unique Present Idea For Father, Husband, Uncle, Guys From Daughter, Son, Kids, Wife - 20 Oz Tumbler COG: 3,71 / Price: 14,98";"B0CHJ1V1RR";"0I-V2OD-GO56";"1";"";"14,98";"";"";"";"";"";"";"";"";"";"-";"";"-7,03";"-3,71";"";"4,24";"4,24";"7,95";"";"28,30";"114,29";"2 206";"";"9";"11,11"
"NewEleven Gifts For Aunt From Niece, Nephew - Cool Gifts For New Aunt, Auntie, Sister - Auntie Birthday Gift - Announcement, Promoted To Aunty - 16 Oz Coffee Glass COG: 2,4 / Price: 14,98";"B0CJ2CNDQT";"92-KAM5-CE6S";"1";"";"14,98";"";"";"";"";"";"";"";"";"";"100";"2,4";"-7,03";"-2,4";"";"7,95";"7,95";"7,95";"";"53,07";"331,25";"30 084";"";"4";"25,00"
"NEWELEVEN Christmas Book Lovers Gifts for Women, Friends - Bookshelf Cup, Accessories for Writers, Readers, Librarian, Bookaholic, Bookworm - 16 Oz Coffee Glass COG: 2,22 / Price: 9,99";"B0CKYMNV39";"QE-7AYT-7B4M";"1";"";"9,99";"";"";"";"";"";"";"";"";"";"-";"";"-5,87";"-2,22";"";"1,90";"1,90";"4,12";"";"19,02";"85,59";"34 313";"";"17";"5,88"
"NewEleven Fathers Day Gift For Grandpa - Grandpa Gifts From Granddaughter, Grandson - Unique Birthday Present Ideas For Grandfather, New Granddad, Promoted To Granddad, Grandchildren - 20 Oz Tumbler COG: 3,48 / Price: 19,98";"B0CQ4X98YF";"IW-TRN7-KQLA";"1";"";"19,98";"";"";"";"";"";"";"";"";"";"-";"";"-7,45";"-3,48";"";"9,05";"9,05";"12,53";"";"45,30";"260,06";"2 206";"";"9";"11,11"
"NewEleven Birthday Gifts For Women - Funny Gag Gifts Ideas For Mom, Grandma, Wife, Her, Sister, Coworker - 40th 50th 60th 70th 80th Birthday Gifts For Women – 20 Oz Tumbler COG: 3,48 / Price: 15,98";"B0CT8JTMF8";"T3-8QDV-BD6U";"1";"";"15,98";"";"";"";"";"";"";"";"";"";"-";"";"-6,79";"-3,48";"";"5,71";"5,71";"9,19";"";"35,73";"164,08";"2 384";"";"15";"6,67"
"NewEleven 80th Birthday Gifts For Men Women - 1944 80th Birthday Decorations - Gifts For Men Women Turning 80-80 Year Old Gifts For Man, Woman - 20 Oz Tumbler COG: 3,58 / Price: 19,98";"B0CT8N6CSJ";"VN-NUNJ-RBKB";"1";"";"19,98";"";"";"";"";"";"";"";"";"";"-";"";"-7,45";"-3,58";"";"8,95";"8,95";"12,53";"";"44,79";"250,00";"2 384";"";"7";"14,29"
"NewEleven Gifts For Friends, Bestie – Work Bestie Presents For Women Friends - Appreciation Gifts For Coworkers, Unique Present Ideas For Coworker Leaving, Farewell Party – 16 Oz Coffee Glass COG: 2,55 / Price: 15,98";"B0CXXJ751C";"7X-5K3W-K6CS";"1";"";"15,98";"-0,8";"-2,48";"-2,48";"";"";"";"";"";"";"-";"";"-7,88";"-2,55";"";"2,27";"2,27";"4,82";"";"14,21";"89,02";"12 860";"15,52";"15";"6,67"
"NewEleven Trucker Cap for Men, Dad, Husband, Fisherman – Funny Fishing Hat, Trucker Hat Birthday Present for Him, Father, Guys Who Love Fishing COG: 2,67 / Price: 17,98";"B0CY4G9VSR";"BP-B33W-HG8K";"1";"";"19,98";"";"";"";"";"";"";"";"";"";"-";"";"-8,8";"-2,67";"";"8,51";"8,51";"11,18";"";"42,59";"318,73";"101 224";"";"46";"2,17"
"NewEleven Gifts For Him - Fishing Gifts For Men, Dad, Fisherman, Father - Practical Gift, Dad Birthday Present, Men, Husband - 20 Oz Tumbler COG: 3,66 / Price: 17,98";"B0CY4MC1GJ";"YJ-23CQ-KDB5";"1";"";"19,98";"";"";"";"";"";"";"";"";"";"-";"";"-7,85";"-3,66";"";"8,47";"8,47";"12,13";"";"42,39";"231,42";"10 946";"";"12";"8,33"
"NewEleven Bridal Shower Gifts - Wedding Gifts For Bride - Bachelorette Party, Engagement Gift For Women - Gift For Bride To Be, Fiancee, Wifey, Her - 16 Oz Coffee Glass COG: 2,35 / Price: 9,99";"B0CYSTZG5R";"UH-A4QB-NCR6";"1";"";"9,99";"";"";"";"";"";"";"";"";"";"-";"";"-5,87";"-2,35";"";"1,77";"1,77";"4,12";"";"17,72";"75,32";"41 850";"";"6";"16,67"
"NewEleven Gifts For Book Lovers - Book Lovers Gifts For Women - Book Themed Gift for Readers, Librarians, Bookaholics - Birthday Gift For Women, Her, Best Friend – 16 Oz Coffee Glass COG: 2,32 / Price: 13,98";"B0CZDV6J3V";"0B-GUIB-F6GL";"1";"";"13,98";"";"-1,89";"-1,89";"";"";"";"";"";"";"-";"";"-7,3";"-2,32";"";"2,47";"2,47";"4,79";"";"17,67";"106,47";"54 507";"13,52";"12";"8,33"
"NewEleven Gifts For Nurse - Nursing Graduation Gift For Women Her - Caregiver Appreciation Gifts, Nursing Student, New Nurses, Nurse Practitioner, RN - 16 Oz Coffee Glass COG: 2,68 / Price: 9,99";"B0D1GF81G8";"WJ-F0KW-EYOB";"1";"";"9,99";"";"";"";"";"";"";"";"";"";"-";"";"-5,87";"-2,68";"";"1,44";"1,44";"4,12";"";"14,41";"53,73";"37 448";"";"8";"12,50"
"NewEleven Gifts For Godmother - Will You Be My Godmother From GodChild - Pregnancy Announcement Gifts For Godmom, Godparents - 16 Oz Coffee Glass COG: 2,58 / Price: 17,98";"B0D2NSHWZK";"J5-EJIM-0Y8E";"1";"";"17,98";"";"-8,69";"-8,69";"";"";"";"";"";"";"-";"";"-7,87";"-2,58";"";"-1,16";"-1,16";"1,42";"";"-6,45";"-44,96";"45 084";"48,33";"12";"8,33"
"NewEleven Gifts For Mom, New Mom – 2025 Pregnancy Gifts For First Time Mother, Pregnant, Expecting Mama, Mother To Be, Mama, Mommy To Be - 16 Oz Coffee Glass COG: 1,7 / Price: 12,99";"B0DCJQ2SKV";"F5-C0C3-Z1JN";"1";"";"12,99";"";"";"";"";"";"";"";"";"";"-";"";"-7,14";"-1,7";"";"4,15";"4,15";"5,85";"";"31,95";"244,12";"5 683";"";"14";"7,14"
"NewEleven 40th Birthday Gifts For Men Women - 1985 40th Birthday Decorations For Men Women - Turning 40-40 Year Old Gifts For Man, Woman, Mom, Dad, Wife, Husband - 20 Oz Tumbler COG: 3,45 / Price: 21,98";"B0DH7PQ1RX";"7N-6OBC-K7DN";"1";"1";"19,98";"";"-8,32";"-8,32";"";"";"";"";"";"100,00";"100";"-13,89";"-7,45";"-3,45";"";"-13,13";"-13,13";"-13,13";"";"-65,72";"-380,58";"6 843";"41,64";"10";"10,00"
"NewEleven 40th Birthday Gifts For Men Women - 1985 40th Birthday Decorations For Him, Her - Turning 40-40 Year Old Gifts For Man, Woman, Mom, Dad, Wife, Husband - 20 Oz Tumbler COG: 3,29 / Price: 19,98";"B0DH86X93V";"Z0-L1YB-49DF";"1";"2";"19,98";"";"-24,75";"-24,75";"";"";"";"";"";"200,00";"100";"-31,53";"-7,45";"-3,29";"";"-47,04";"-47,04";"-47,04";"";"-235,44";"-1 429,79";"2 384";"123,87";"28";"3,57"
"NewEleven 50th Birthday Gifts for Men Women - 1975 Birthday Decorations for Him, Her - Gifts for People Turning 50 Year Old Mom, Dad, Wife, Husband - Retro Trucker Hat COG: 1,99 / Price: 17,98";"B0DHC2C1S4";"S1-6FQM-HSP6";"1";"";"17,98";"";"-13,8";"-13,8";"";"";"";"";"";"";"-";"";"-8,58";"-1,99";"";"-6,39";"-6,39";"-4,4";"";"-35,54";"-321,11";"169 867";"76,75";"14";"7,14"
"NewEleven Thank You Gifts for Women, Nurses, Teacher, Coworker, Friends - Gift for Women, Appreciation Present for Coworkers, Farewell, BFF, Woman, Men - Glass Christmas Ornaments COG: 1,9 / Price: 5,99";"B0DJY7689G";"2F-J6P4-R5IG";"1";"";"5,99";"";"";"";"";"";"";"";"";"";"-";"";"-3,9";"-1,9";"";"0,19";"0,19";"2,09";"";"3,17";"10,00";"290 413";"";"1";"100,00"
"NewEleven Women - Friend Gifts Ornaments 2025 - Friendship Gifts for Friends, Birthday Gift for Women, Besties, Soul Sisters - Ceramic Christmas Ornaments COG: 0,91 / Price: 4,99";"B0DK16MCXG";"JC-JJYR-OWD3";"1";"";"4,99";"";"";"";"";"";"";"";"";"";"-";"";"-3,12";"-0,91";"";"0,96";"0,96";"1,87";"";"19,24";"105,49";"290 413";"";"4";"25,00"
"NewEleven Engagement Gifts for Couples 2024 - First Christmas Engaged Gifts for Her - Engagement Gift for Newly Engaged Couples, Her, Women, Friends, Bride to Be Gift, Glass Christmas Ornaments COG: 2,09 / Price: 7,99";"B0DK16SMD9";"Q6-R02W-6Y1G";"1";"";"7,99";"";"";"";"";"";"";"";"";"";"-";"";"-4,23";"-2,09";"";"1,67";"1,67";"3,76";"";"20,90";"79,90";"66 626";"";"11";"9,09"
"NewEleven Gifts for Women, Friendship, Friends, Birthday Gift for Friends Female BFF Old Best Friends, Best Friend Ornament, Bestie Ornament COG: 0,93 / Price: 7,99";"B0DK2YP1FB";"JR-LLGY-N975";"1";"";"7,99";"";"";"";"";"";"";"";"";"";"-";"";"-3,61";"-0,93";"";"3,45";"3,45";"4,38";"";"43,18";"370,97";"291 840";"";"1";"100,00"
"NewEleven Birthday Gifts for Dad from Daughter, Son, Wife - First Time Present for Father, Men, Girl Dads Hat - Trucker Hat COG: 2,67 / Price: 17,98";"B0DYJ45P7Q";"QF-PTRY-DG2W";"1";"";"17,98";"-0,9";"";"";"";"";"";"";"";"";"-";"";"-8,48";"-2,67";"";"5,93";"5,93";"8,6";"";"32,98";"222,10";"145 264";"";"1";"100,00"
"NewEleven Fathers Day Gift For Dad From Daughter, Son, Kids - Birthday Gift For Dad, Husband, Men - Best Present Idea For Father, Husband, Bonus Father From Daughter, Son, Wife - 20 Oz Tumbler COG:  / Price: 0";"B088GX79HT";"";"";"";"";"";"";"";"";"";"";"";"";"";"-";"";"";"";"";"";"";"";"";"";"";"12 398";"";"2";""
"NEWELEVEN Coworker Leaving Gift - Farewell, Going Away, New Job, Goodbye, Good Luck for Colleagues, Boss, Men, Women, Friends - 20 Oz Tumbler COG: 4,76 / Price: 19,98";"B08Y8RZRHG";"31-PNFY-F78S";"";"";"";"";"";"";"";"";"";"";"";"";"-";"";"";"";"";"";"";"";"";"";"";"19 256";"";"7";""
"NewEleven Birthday Gifts For Mom - Gifts For Mom From Daughter, Son, Kids - Unique Birthday Gifts For Mom, Mother, Wife, New Mom, Bonus Mom, Pregnant Mom - Funny Gifts Ideas For Mom - 20 Oz Tumbler COG: 4,96 / Price: 12,98";"B08ZKX6YK9";"9M-0Q79-XYNB";"";"";"";"";"";"";"";"";"";"";"";"";"-";"";"";"";"";"";"";"";"";"";"";"215 993";"";"9";""
"NewEleven 20 Oz Tumbler - Christmas Gifts for Dad from Kids COG:  / Price: 0";"B08ZKZ1FJK";"";"";"";"";"";"";"";"";"";"";"";"";"";"";"";"";"";"";"";"";"";"";"";"";"12 398";"";"1";""
"NewEleven Fathers Day Gift For Grandpa From Granddaughter, Grandson - Birthday Present Ideas For Grandfather, New Grampa, Promoted To Grandfather, Grandchildren, Grandkid - 20 Oz Tumbler COG: 4,77 / Price: 19,98";"B094CFGN42";"DW-NMEH-X37K";"";"";"";"";"";"";"";"";"";"";"";"";"-";"";"";"";"";"";"";"";"";"";"";"12 398";"";"3";""
"NewEleven Retirement Gifts For Woman 2025 - Retired Gift For Coworker Leaving - Farewell, Goodbye Presents For Women, Coworkers, Friends - 20 Oz Tumbler COG: 5,1 / Price: 17,98";"B095S16WV3";"VG-MZ2S-KBWR";"";"";"";"";"";"";"";"";"";"";"";"";"-";"";"";"";"";"";"";"";"";"";"";"21 259";"";"2";""
"NewEleven Retirement Gifts For Woman 2025 - Happy Retirement Gifts For Coworker Leaving - Farewell, Goodbye Presents For Women, Coworkers, Friends - 20 Oz Tumbler COG: 5,52 / Price: 19,98";"B095S1818R";"LB-IWKF-ZPU8";"";"1";"";"";"";"";"";"";"";"";"";"∞";"100";"-8,46";"";"";"";"-8,46";"-8,46";"-13,98";"";"";"";"21 259";"";"3";""
"NewEleven Gifts For Him, Men - Gift For Men, Women, Dad, Husband, Friend - Thank You Gifts, Appreciation Gift, Graduation Presents For Men, Nurse, Teacher, Boss, Coworker - 20 Oz Tumbler COG: 4,04 / Price: 16,98";"B0978WGWY4";"BJ-VG4K-QQW3";"";"";"";"";"";"";"";"";"";"";"";"";"-";"";"";"";"";"";"";"";"";"";"";"2 199";"";"21";""
"NewEleven Gift For Brother From Sister, Bro - Best Birthday Gift For Big, Little Brother, Siblings, Brothers In Law - Funny Gag Gifts For Men - 20 Oz Tumbler COG: 4,4 / Price: 19,98";"B09792XF8F";"CC-VIYV-1LFP";"";"";"";"";"-5,65";"-5,65";"";"";"";"";"";"";"-";"";"";"";"";"-5,65";"-5,65";"-5,65";"";"";"";"10 946";"";"15";""
"NewEleven Gifts For Mom From Daughter, Son, Kids - Unique Birthday Gift For Mom Wife, New Mother, Bonus Mama, Pregnant Mama - Funny Gifts Ideas For Mum - 20 Oz Tumbler COG: 4,2 / Price: 16,98";"B097B9H21P";"YP-SEHP-8NOP";"";"";"";"";"";"";"";"";"";"";"";"";"-";"";"5,11";"-4,2";"";"0,91";"0,91";"5,11";"";"";"21,67";"2 206";"";"179";""
"NewEleven Christmas Gift For Dad - Birthday Gifts For Dad From Daughter, Son, Kids - Husband Gifts - Birthday Present Ideas For Father, Husband, New Dad, Bonus Dad From Daughter, Son - 20 Oz Tumbler COG: 4,56 / Price: 19,98";"B097B9SY89";"9A-2WJB-A3US";"";"";"";"";"-6,41";"-6,41";"";"";"";"";"";"";"-";"";"";"";"";"-6,41";"-6,41";"-6,41";"";"";"";"12 398";"";"6";""
"NewEleven Gift For Uncle From Niece, Nephew - Funny Unkie Gift, Uncle Birthday Gifts - Best Present For New Uncles, Funcle, Unky Announcement - 20 Oz Tumbler COG: 4,29 / Price: 19,98";"B097H6PJCN";"C5-L2Z6-TAT4";"";"";"";"";"";"";"";"";"";"";"";"";"-";"";"";"";"";"";"";"";"";"";"";"10 946";"";"3";""
"Neweleven Replacement Lid For 20 Oz NewEleven Tumbler - Pack of 2 lids COG: 0,96 / Price: 9,98";"B0995JRMHP";"O1-FU7J-W72I";"";"";"";"";"";"";"";"";"";"";"";"";"-";"";"";"";"";"";"";"";"";"";"";"164 625";"";"1";""
"NewEleven Bird Watching Gifts, Gifts For Bird Lovers - Gift For Men Women - Funny Birding Gift For Birders, Birds Watchers, Birb Lovers, Men, Women, Friends - 20 Oz Tumbler COG: 4,78 / Price: 22,98";"B09S9PGL4T";"UD-JSC7-HVGH";"";"";"";"";"";"";"";"";"";"";"";"";"-";"";"";"";"";"";"";"";"";"";"";"231 564";"";"2";""
"NewEleven Coworker Leaving Gifts - Farewell Gifts, Going Away Gift For Coworker - New Job Gift, Goodbye, Good Luck Presents For Coworkers, Friends, Boss, Men, Women - 20 Oz Tumbler COG: 4,46 / Price: 19,98";"B09ZYBDMZ1";"Y3-JOZK-KF6U";"";"";"";"";"";"";"";"";"";"";"";"";"-";"";"";"";"";"";"";"";"";"";"";"35 554";"";"37";""
"NewEleven Retirement Gifts For Women 2025 - Happy Retirement Gift - Coworker Leaving Gift, Farewell Gifts, Goodbye Presents For Coworkers, Friends - 12 Oz Tumbler COG: 3,73 / Price: 22,98";"B0B2WGL9ZW";"DI-F7I2-E7AK";"";"";"";"";"";"";"";"";"";"";"";"";"-";"";"";"";"";"";"";"";"";"";"";"10 670";"";"10";""
"NewEleven Gifts For Sister - Unique Birthday Present For Sisters, Soul Sis, Big, Little Sister, Sisters In Law, Sibling, Bestie - 16 Oz Coffee Glass COG: 2,04 / Price: 15,98";"B0BC8WBYW7";"U3-HSBK-1RJI";"";"";"";"";"";"";"";"";"";"";"";"";"-";"";"";"";"";"";"";"";"";"";"";"40 442";"";"8";""
"NewEleven Gifts For Wife, Her - Wife Gifts From Husband - Gift For Her - Gift Ideas For Women, Bride To Be, Fiancee, Wifey - 16 Oz Coffee Glass COG: 2,92 / Price: 13,99";"B0BDLH8KX3";"47-ZC5Z-3DOW";"";"";"";"";"";"";"";"";"";"";"";"";"-";"";"";"";"";"";"";"";"";"";"";"41 807";"";"4";""
"NewEleven Gifts For Women Friendship - Funny Gifts For Friends Female - Unique Friendship Present For Her, Female, Bestie, Bff, Soul Sister, Work Bestie - 16 Oz Coffee Glass COG: 2,29 / Price: 15,98";"B0BRB5SPYZ";"25-YAS2-RJHI";"";"";"";"";"";"";"";"";"";"";"";"";"-";"";"";"";"";"";"";"";"";"";"";"12 820";"";"10";""
"NewEleven Christmas Gifts For Women Friendship - Funny Gifts For Friends Female - Unique Friendship Gift For Women, Friend, Female, Bestie, Bff, Soul Sister, Work Bestie - 16 Oz Coffee Glass COG:  / Price: 0";"B0BRCDZRSP";"";"";"";"";"";"";"";"";"";"";"";"";"";"-";"";"";"";"";"";"";"";"";"";"";"12 820";"";"7";""
"NewEleven Gifts For Sister From Sisters, Brother - Unique Birthday Present, Soul Sister, Big Sis Little Sis, Sisters In Law, Sibling, Bestie - 16 Oz Coffee Glass COG: 2,02 / Price: 15,98";"B0BYCSHGYX";"LB-UB38-W1AN";"";"";"";"";"";"";"";"";"";"";"";"";"-";"";"";"";"";"";"";"";"";"";"";"40 442";"";"5";""
"NewEleven Gifts For Nurse - Nurse Gifts For Women - Caregiver Appreciation Gift, Nursing Student, Nurses Practitioner - RN Gift For Nurses Women - 16 Oz Coffee Glass COG: 2,48 / Price: 9,99";"B0BYDBW7PH";"IP-TZ2U-AFMB";"";"";"";"";"";"";"";"";"";"";"";"";"-";"";"";"";"";"";"";"";"";"";"";"37 448";"";"7";""
"NewEleven Gifts for Women Friendship - Funny Gifts for Friends Female - Unique Friendship Gifts for Women, Friend, Female, Bestie, BFF, Soul Sister, Work Bestie - Lavender Candle 8 Oz COG: 4,69 / Price: 9,99";"B0BYHP62T5";"Z5-85B3-YK10";"";"";"";"";"";"";"";"";"";"";"";"";"-";"";"";"";"";"";"";"";"";"";"";"1 713 826";"";"1";""
"NewEleven Cute Glass Coffee Cups With Lids And Straw – Aesthetic Cups – Iced Coffee Cup, Coffees Tumbler – Galentines Gifts For Women, Coffees Lover - 16 Oz Coffee Glass COG: 2,33 / Price: 14,98";"B0C1BS7BV8";"8N-VAIO-VFH3";"";"";"";"";"";"";"";"";"";"";"";"";"-";"";"";"";"";"";"";"";"";"";"";"12 820";"";"18";""
"NewEleven Cute Cups With Lids And Straw – Aesthetic Cups – Iced Java Cup, Coffee Tumbler, Glass Tumbler – Galentines Gifts For Women, Java Lover - 16 Oz Coffee Glass COG: 2,86 / Price: 12,34";"B0C1C1F4M4";"Z2-BJ5R-5S3M";"";"";"";"";"";"";"";"";"";"";"";"";"-";"";"";"";"";"";"";"";"";"";"";"12 820";"";"7";""
"NewEleven Gifts For Women - Stuff For Sloth Lovers - Cute Funny Birthday Gifts For Women, Best Friend, Sister, Daughter, Coworker - 16 Oz Coffee Glass COG: 2,37 / Price: 14,98";"B0C23XHCN1";"ZE-FHJ1-JZZW";"";"";"";"";"";"";"";"";"";"";"";"";"-";"";"";"";"";"";"";"";"";"";"";"108 588";"";"2";""
"NewEleven Penguin Gifts For Women - Penguin Stuff For Pengy Lovers - Cute Funny Birthday Gift, Gift For Women, Best Friend, Sister, Daughter, Coworker - 16 Oz Coffee Glass COG: 2,17 / Price: 14,98";"B0C23Y5ZYH";"TU-6PXW-EYJS";"";"";"";"";"";"";"";"";"";"";"";"";"100";"2,17";"";"";"";"2,17";"2,17";"";"";"";"";"108 588";"";"2";""
"NewEleven Gifts For Her - Cow Gifts For Women - Stuff For Cow Lovers - Cute Funny Birthday Gift For Women, Best Friend, Sister, Daughter, Coworker - 16 Oz Coffee COG: 2,29 / Price: 14,98";"B0C242DYT4";"OX-EHPQ-U3LT";"";"";"";"";"";"";"";"";"";"";"";"";"-";"";"";"";"";"";"";"";"";"";"";"108 588";"";"1";""
"NewEleven Retirement Gifts For Woman 2025 - Happy Retirement Gifts For Coworker Leaving - Farewell, Goodbye Presents For Women, Coworkers, Friends - 20 Oz Tumbler COG: 4,02 / Price: 19,98";"B0C3CW184G";"L6-4LV1-54DE";"";"";"";"";"";"";"";"";"";"";"";"";"-";"";"";"";"";"";"";"";"";"";"";"21 259";"";"11";""
"NEWELEVEN 16 Oz Coffee Glass - Mom Birthday Gifts, Multicolor, Glass, 16 oz, Reusable, Insulated, Cylindrical, Casual, Cold Drinks, Christmas, Mother's Day, Birthday COG: 2,31 / Price: 12,98";"B0CBJSYJJS";"IV-16R1-T5AZ";"";"";"";"";"";"";"";"";"";"";"";"";"-";"";"";"";"";"";"";"";"";"";"";"25 570";"";"7";""
"NewEleven Gifts For Book Lovers - Book Lovers Gifts For Women, Her, Friends - Book Accessories, Bookish Gifts For Writers, Readers, Librarian, Bookaholic, Bookworm – 16 Oz Coffee Glass COG: 2,03 / Price: 13,98";"B0CCDLWRTD";"68-JFET-D7YN";"";"";"";"";"";"";"";"";"";"";"";"";"-";"";"";"";"";"";"";"";"";"";"";"54 565";"";"6";""
"NewEleven Coworker Leaving Gifts - Farewell, Going Away Gift For Coworker - New Job, Goodbye, Good Luck Gifts For Coworkers, Colleagues, Boss, Men, Women, Friends - 20 Oz Tumbler COG: 3,71 / Price: 19,98";"B0CDLPSMGF";"CO-C7X6-C1NV";"";"";"";"";"";"";"";"";"";"";"";"";"-";"";"";"";"";"";"";"";"";"";"";"19 287";"";"7";""
"NewEleven Gifts For Men, Dad, Husband, Friend - Birthday Gift For Women, Men - Thank You Gifts, Appreciation Gift, Graduation Presents For Men, Nurse, Teacher, Boss, Coworker – 20 Oz Tumbler COG: 3,66 / Price: 16,98";"B0CDLQFJK6";"EH-49BE-XWTF";"";"";"";"";"";"";"";"";"";"";"";"";"-";"";"";"";"";"";"";"";"";"";"";"2 206";"";"7";""
"NewEleven Gifts For Women – Chaos Coordinator Gifts For Women, Boss, Manager, Coworker, Best Friend - Appreciation, Inspirational Gift For Teacher, Nurse, Social Worker – 20 Oz Tumbler COG: 3,87 / Price: 17,98";"B0CFQ4CDD5";"7K-U1QW-2RDX";"";"1";"";"";"-8,3";"-8,3";"";"";"";"";"";"∞";"-";"-15,73";"";"";"";"-24,03";"-24,03";"-24,03";"";"";"";"40 657";"";"14";""
"NewEleven Fathers Day Gift For Dad - Cool Dad Gifts From Daughter - Unique Birthday Present Ideas For Father, Husband, Bonus Father, Step Papa, New Papa From Daughter - 20 Oz Tumbler COG: 3,56 / Price: 17,98";"B0CJLF7CW6";"JY-5OP2-ZVFB";"";"";"";"";"-12,39";"-12,39";"";"";"";"";"";"";"100";"7,12";"";"";"";"-5,27";"-5,27";"-12,39";"";"";"";"12 398";"";"15";""
"NewEleven Fathers Day Gift For Dad - Cool Dad Gifts From Daughter - Unique Birthday Present Ideas For Father, Husband, Bonus Papa, Step Father, New Papa From Daughter - 20 Oz Tumbler COG: 3,63 / Price: 19,98";"B0CJLM3SV5";"5B-L34H-TU17";"";"";"";"";"";"";"";"";"";"";"";"";"-";"";"";"";"";"";"";"";"";"";"";"12 398";"";"3";""
"NewEleven Gifts For Mom - Birthday Gifts For Mom From Daughter, Son, Kids, Husband - Wife Gift - Unique Present Ideas For Mother, Mother In Law, Wife, New Mama - 20 Oz Tumbler COG: 3,65 / Price: 19,98";"B0CJX4XSXB";"S8-FINW-47HP";"";"";"";"";"-26,95";"-26,95";"";"";"";"";"";"";"-";"";"";"";"";"-26,95";"-26,95";"-26,95";"";"";"";"2 206";"";"35";""
"NewEleven Fathers Day Gift For Grandpa From Granddaughter, Grandson - Birthday Present Ideas For Grandfather, New Grandfather, Promoted To Granddad, Grandchildren, Grandkids - 20 Oz Tumbler COG: 3,5 / Price: 17,98";"B0CKYJ8WLN";"FM-KSML-Z7CU";"";"";"";"";"-29,62";"-29,62";"";"";"";"";"";"";"-";"";"";"";"";"-29,62";"-29,62";"-29,62";"";"";"";"2 233";"";"24";""
"NewEleven 30th Birthday Gifts For Her Women - 1994 30th Birthday Decorations For Women - 30 Year Old Gifts Idea For Woman, Friends, Sister - 16 Oz Coffee Glass COG: 2,21 / Price: 12,99";"B0CKYM9HQW";"IC-RCY9-PJCV";"";"";"";"";"";"";"";"";"";"";"";"";"-";"";"";"";"";"";"";"";"";"";"";"8 918";"";"9";""
"NewEleven Birthday Gifts For Men, Women - Funny Gag Gifts Ideas For Dad, Mom, Grandpa, Grandma, Husband, Wife, Uncle, Him - 40th 50th 60th 70th 80th Birthday Gifts For Men Women – 20 Oz Tumbler COG: 3,76 / Price: 16,99";"B0CLYSGX7Q";"OA-DGFL-ZKWU";"";"";"";"";"";"";"";"";"";"";"";"";"-";"";"";"";"";"";"";"";"";"";"";"6 869";"";"6";""
"NewEleven Fathers Day Gift For Dad - Birthday Gifts For Dad From Daughter - Husband Gifts - Unique Birthday Present Ideas For Father, Husband, New Papa, Bonus Father From Daughter - 20 Oz Tumbler COG: 3,19 / Price: 19,98";"B0CM5R5BDX";"WC-3I7C-6VN5";"";"";"";"";"";"";"";"";"";"";"";"";"-";"";"";"";"";"";"";"";"";"";"";"12 398";"";"2";""
